,Document,Page,Sentence
146,Chile_NCSP%20%28ENG%29.pdf,16," Models for cyberspace will be created from the Policy, including physical risks that may affect the same regularly updated by a continuous improvement model, which shall be the basis for technical measures to be adopted in order to prevent, manage and overcome actual risks, with an emphasis on service Resilience and continuity within a set deadline and focus on maximising the countrys cybersecurity levels"
147,Chile_NCSP%20%28ENG%29.pdf,16,Protection of the information infrastructure 
148,Chile_NCSP%20%28ENG%29.pdf,16,"Information infrastructure is composed of people, processes, procedures, tools, installations and technologies, supporting the creation, use, transport, storage and destruction of information"
149,Chile_NCSP%20%28ENG%29.pdf,16," There is an especially relevant group within information structure for a country to keep moving forward called critical information infrastructure, (, CII ), which includes the installation, networks, services and physical and information technology equipment whose impairment degradation, rejection, interruption or destruction may have an important impact on the Security, health and wellbeing of people and on the effective operation of the State and the private sector"
150,Chile_NCSP%20%28ENG%29.pdf,16, Special emphasis will be placed on the impact that an information security incident may have on physical infrastructures controlled or monitored from the cyberspace and on the security of industrial surveillance
151,Chile_NCSP%20%28ENG%29.pdf,16," Sensors and devices enabling such actions CIIs shall the designed with an architecture maximising their robustness and resilience against events that may render them non-operational and enabling them to adapt to natural phenomena, human interventions and information, interferences such as non-voluntary incidents or cyber attacks"
152,Chile_NCSP%20%28ENG%29.pdf,16,Identification and prioritisation of critical information infrastructure Sectors included in the definition of CII are very similar and recurrent in various international classifications
153,Chile_NCSP%20%28ENG%29.pdf,16," While consideration of a specific policy for critical infrastructure is under consideration, information infrastructure in the following sectors will be considered as critical: "
154,Chile_NCSP%20%28ENG%29.pdf,16,"National CYBERSECURITY POLICY, ( NCSP, ), 2017-2022 "
155,Chile_NCSP%20%28ENG%29.pdf,17,"Energy, telecommunications, water, health, financial services, public security, transport, the civil service, civil protection and defence"
156,Chile_NCSP%20%28ENG%29.pdf,17," The policy contains a full set of areas, roles and responsible State entities used to identify and specify the critical level of each sector"
157,Chile_NCSP%20%28ENG%29.pdf,17," Technical bodies in charge of executing measures derived from this policy shall include special cybersecurity standards for CIIs, depending on the different levels of development, especially with regard to special processes"
158,Chile_NCSP%20%28ENG%29.pdf,17," The medium term will see the implementation of measures ensuring service continuity through the redundancy of the physical infrastructure of some CII, especially in the fields of telecommunications, civil service, civil protection and defence Equipment available to respond to cybersecurity incidents According to best practices worldwide"
159,Chile_NCSP%20%28ENG%29.pdf,17," It is essential to have available prevention, monitoring management and response structures to face computer-related security incidents at a national level"
160,Chile_NCSP%20%28ENG%29.pdf,17," The basic body in this structure is the Computer Security Incident Response Team, (, CSIRT, ) or teams in charge of responding to computer security"
161,Chile_NCSP%20%28ENG%29.pdf,17," Chile needs today the human and financial resources, a clear institutional framework and a mechanism to operate in coordination so as to promote the creation and operation of the same at different levels of the national life"
162,Chile_NCSP%20%28ENG%29.pdf,17," Chile will have a national CSIRT in place to collect and structure information received from other ( national and international ) CSIRTs, promoting action coordination between CSIRTs in each sector, with the required authority to coordinate the technical response in the case of incidents endangering the countrys security, The Governments current CSIRT will be strengthened with a specific CSIRT to be created in the area of the National Defence"
163,Chile_NCSP%20%28ENG%29.pdf,17," Likewise, the need is also in place to evaluate the relevance of creating a CSIRT for critical infrastructure"
164,Chile_NCSP%20%28ENG%29.pdf,17, The creation of CSIRTs by sector will be supported by different public private academic and civil society
165,Chile_NCSP%20%28ENG%29.pdf,17,"Implementation of standardised mechanisms for reporting, managing and recovering from incidents There will be centralised and standardised mechanisms for reporting cybersecurity incidents, enabling the widespread and real time overview of incidents generated in the country"
166,Chile_NCSP%20%28ENG%29.pdf,17," These mechanisms will be compulsory for the central Government and certain regulated sectors and voluntary in principle, for any stakeholders that may want to join them"
167,Chile_NCSP%20%28ENG%29.pdf,17," The amount of information required will be restrictedly limited to what is needed to describe and manage the type of threat, especially avoiding the collection and processing of data affecting peoples"
168,Chile_NCSP%20%28ENG%29.pdf,17, Private lives For such purpose
169,Chile_NCSP%20%28ENG%29.pdf,17, The National CSIRT will keep a secure and confidential platform able to cooperate in case of cybersecurity incidents and gather the relevant information and will create a network in conjunction with public and private bodies
170,Chile_NCSP%20%28ENG%29.pdf,18,"At the same time, both public bodies and CII will have institutional bodies responsible for information security, together management and recovery plans in place for addressing incidents, with special emphasis on business continuity and on minimising any damages caused by actual incidents"
171,Chile_NCSP%20%28ENG%29.pdf,18," In addition to the foregoing, the preparation of computer vulnerability reports by users and experts will be promoted through the adoption of guidelines for responsible information, delivery models to reward the detection of security problems and other mechanisms promoting responsible disclosure"
172,Chile_NCSP%20%28ENG%29.pdf,18, Differentiated standards are required in the field of cybersecurity
173,Chile_NCSP%20%28ENG%29.pdf,18," Any information, infrastructure governed by or providing goods and services to the Chilean Government or services to the people shall comply with a basic set of standards covering confidentiality, integrity and availability of the information and the systems operating the same according to the risks and threats faced by Them and in consistency with their size, maturity, critical state and confidentiality level of information, and/or processes supported by them"
174,Chile_NCSP%20%28ENG%29.pdf,18," With regard to critical information infrastructure, any risk shall be properly evaluated and addressed pursuant to standards, including CIIs confidentiality, integrity and availability, aimed at having an effective and comprehensive security system in place that allows the prevention management and recovery from cyber attacks and other information security incidents"
175,Chile_NCSP%20%28ENG%29.pdf,18," Together with contingency plans for ensuring business continuity of their services, Standards and best practices used shall be compatible with international efforts, ensuring the confidentiality, integrity and availability of information without setting out specific solutions, except for qualified cases"
176,Chile_NCSP%20%28ENG%29.pdf,18,"The State will protect peoples, rights in cyberspace, Crime prevention and trust, building in cyberspace, Crime prevention, dissuasion control and punishment are critical to minimise risks and threats in cyberspace, thus contributing to trust building in connection with the activities carried out"
177,Chile_NCSP%20%28ENG%29.pdf,18," There are multiple criminal activities carried out in cyberspace, such as stealing strategic information interrupting online service systems, information hijacking, (, ransomware, ), phishing pharming and the fraudulent use of credit or debit cards among other illicit activities"
178,Chile_NCSP%20%28ENG%29.pdf,18," At a global level, there is information about cyber attacks consisting in espionage activities and distributed denial of service ( DDoS ) attacks through the Internet, the large-scale intercepting of telecommunication networks against critical infrastructure such as, inter alia, banks, basic services and Government entities"
179,Chile_NCSP%20%28ENG%29.pdf,18," This policy is aimed at minimising risks associated to these threats, In addition to public policies developed to prevent and punish the above-mentioned crimes"
180,Chile_NCSP%20%28ENG%29.pdf,18, It is also possible to build trust in cyberspace by employing the same technologies
181,Chile_NCSP%20%28ENG%29.pdf,18,", The adoption of technical solutions allowing to increase user security in cyberspace, especially in the case of solutions cooperating with identity management in this environment, such as the mass adoption of digital certificates, ( digital Signature ) in websites and by people and organisations will be promoted as a way to safeguard user communication and identity"
182,Chile_NCSP%20%28ENG%29.pdf,18," This policy also recognises the value placed on encryption technology, thus allowing the provision of the most unprecedented levels of information, confidentiality and integrity levels in history"
183,Chile_NCSP%20%28ENG%29.pdf,18,"National CYBERSECURITY POLICY, ( NCSP, ), 2017-2022 "
184,Chile_NCSP%20%28ENG%29.pdf,19,"Measures, based on this policy shall promote encryption adoption for online users according to international standards and under no circumstances the intentional use of unsafe technologies shall be promoted or there will be and obligation by any person or organisation to provide digital services to implement back door mechanisms Compromising or increasing any risks associated with the security technologies used"
185,Chile_NCSP%20%28ENG%29.pdf,19,"Priority setting in the implementation of punishing measures, Unlike crimes committed in the physical space cyberspace, presents some challenges to crime, prosecution and punishment"
186,Chile_NCSP%20%28ENG%29.pdf,19," Some of these challenges include, inter alia, the identification of authors, the time elapsed between the perpetration of a crime and the victims reaction, the low rate of complaints submitted and the unlike possibility to prosecute the perpetrator"
187,Chile_NCSP%20%28ENG%29.pdf,19," ( s ), because enforcement agencies operate within the States territorial borders, while the cyberspace is essentially a borderless place"
188,Chile_NCSP%20%28ENG%29.pdf,19,Measures in place to punish these actions should be implemented by bearing in mind this context and as a complement to this policy
189,Chile_NCSP%20%28ENG%29.pdf,19," The updating of Chiles legislation promoted by the decision to adhere to the Convention on Cybercrime of the Council of Europe8, together with the upgrading and strengthening of current regulations and the development of cross-cutting measures instead of the adoption of measures by sectors, are important objectives in this Field, Multi-sectoral prevention, "
190,Chile_NCSP%20%28ENG%29.pdf,19,"Because cyber attacks and cybercrime may be perpetrated by State bodies, organised groups or individuals and threats may come from inside and outside the country"
191,Chile_NCSP%20%28ENG%29.pdf,19," Any response must come from multi-sectoral actors involving the private sector, the academia, the civil society and, indeed, criminal prosecution and defence bodies, as well as victim advocacy organisations"
192,Chile_NCSP%20%28ENG%29.pdf,19, It is therefore essential to generate the proper spaces for coordination meeting and cooperation and strengthen significantly the existing technical skills and access to training by prosecutors and judges
193,Chile_NCSP%20%28ENG%29.pdf,19," The investigation and forensic capacities of the police bodies and the development of guidelines aimed at providing a minimum safeguard to the entire population Definitions must be designed to gather, standardise and integrate data and information related with cybercrime, increase investigation capacity and generate evidence regarding such crimes"
194,Chile_NCSP%20%28ENG%29.pdf,19," Respect for, and promotion of, fundamental rights, All measures proposed by the policy should be designed and executed, with a focus on fundamental rights because of their fundamental nature and indivisibility and on the basis that cyberspace is an environment where people have the same rights as in the Physical world9"
195,Chile_NCSP%20%28ENG%29.pdf,19,", Therefore, the policy includes and promotes the following: "
196,Chile_NCSP%20%28ENG%29.pdf,19,"In this regard, Resolution A/HRC/20/L"
197,Chile_NCSP%20%28ENG%29.pdf,19,13 from the UN Human Rights Council declared that peoples rights should be also protected in the Internet
198,Chile_NCSP%20%28ENG%29.pdf,20,The Internet is a global public asset
199,Chile_NCSP%20%28ENG%29.pdf,20," Therefore, users may not be deprived from accessing the network, but for reasons of force majeure, duly based with access, never being denied, by vague reasons such as public order, national security or for the honour of any individual"
200,Chile_NCSP%20%28ENG%29.pdf,20, Despite their capacity or title
201,Chile_NCSP%20%28ENG%29.pdf,20," Regarding the foregoing and taking into account that information availability is an essential characteristic of cybersecurity, this policy will support public and private efforts made for the access to information and culture by the population through digital channels Related with the above"
202,Chile_NCSP%20%28ENG%29.pdf,20, The principle of respecting Internet neutrality is also included so that Internet service providers may not discriminate or arbitrarily restrict the access to any content whatsoever
203,Chile_NCSP%20%28ENG%29.pdf,20," Unless there is a legal justification to do that, "
204,Chile_NCSP%20%28ENG%29.pdf,20,"This policy also respects and promotes the respect for freedom of speech by taking into consideration not only communication media, but also the population as a whole"
205,Chile_NCSP%20%28ENG%29.pdf,20, The intermediaries making possible to communicate these messages and social networks10
206,Chile_NCSP%20%28ENG%29.pdf,20," Any interference with this right shall be carried out in accordance with national and international standards in the field of human rights, The protection of private life and the inviolability of user communication in the cyberspace, including the Protection against the unauthorised gathering process and publication of personal data, transparency in the management of such data by private and public stakeholders, and, as mentioned above, the protection of essential technologies, to ensure that users may safely and confidently use the cyberspace The protection of due process"
207,Chile_NCSP%20%28ENG%29.pdf,20," With regard to the measures affecting information, security seeking that surveillance and criminal prosecution measures in cyberspace comply with international standards with regard to protection, such as the principles of suitability, need and proportionality11"
208,Chile_NCSP%20%28ENG%29.pdf,20,", These measures will not only be applicable to criminal prosecution by the State, but also To the actions of all its bodies, thus safeguarding the application of this right among the users of cyberspace"
209,Chile_NCSP%20%28ENG%29.pdf,20,", Massive and indiscriminate surveillance of cyberspace is a serious attempt against fundamental rights"
210,Chile_NCSP%20%28ENG%29.pdf,20, Efforts in the field of fundamental rights will especially take into account the rights of vulnerable groups
211,Chile_NCSP%20%28ENG%29.pdf,20," Such as, inter alia, boys, girls and young people, the elderly, disabled persons and ethnic minorities"
212,Chile_NCSP%20%28ENG%29.pdf,20,", There will be also a gender focus making possible to visualise and address the inequalities faced by different users in cyberspace"
213,Chile_NCSP%20%28ENG%29.pdf,20, The policy will seek that all people may enjoy a safe cyberspace
214,Chile_NCSP%20%28ENG%29.pdf,20," Free from abuses such as online bullying, the theft of personal information, large-scale surveillance and other practices affecting especially the most underprivileged members of society"
215,Chile_NCSP%20%28ENG%29.pdf,20,", Particularly efforts will be carried out at all levels, so that cybersecurity is not considered luxurious for people or the countrys organisations"
216,Chile_NCSP%20%28ENG%29.pdf,20, The role of Internet intermediaries has increasingly attracted attention because of the critical role they plan in ensuring rights such as freedom of speech
217,Chile_NCSP%20%28ENG%29.pdf,20," In this regard, reference frameworks, such as the Manila principles, may be consulted [ online ] Available in https // www"
218,Chile_NCSP%20%28ENG%29.pdf,20," A useful analysis tool is the document `` International Principles on the Application of Human Rights to Surveillance of Communications, `` ( International Principles about the Application of Human Rights to the Surveillance of Communications, ) [ online ] Available in https //es"
219,Chile_NCSP%20%28ENG%29.pdf,20,"National CYBERSECURITY POLICY, ( NCSP, ), 2017-2022 "
220,Chile_NCSP%20%28ENG%29.pdf,21,", Chile will develop a cybersecurity culture based on education, good practices and accountability in the management of digital technologies, Cybersecurity culture, "
221,Chile_NCSP%20%28ENG%29.pdf,21,"Icts promote the development of an equitable and inclusive cultural, technological and economic heritage of the country and comprehensive peoples development"
222,Chile_NCSP%20%28ENG%29.pdf,21," Therefore, a cybersecurity culture will be promoted at all levels, with the purpose of making the tools and knowledge available for society to understand this field of human relations, including its advantages and risks and may manage them properly"
223,Chile_NCSP%20%28ENG%29.pdf,21, Community awareness and information 
224,Chile_NCSP%20%28ENG%29.pdf,21,"People will be made aware of the risks and threats involved in cyberspace, with the purpose of achieving a safe use of platforms providing services to the community, both from public institutions and private agents"
225,Chile_NCSP%20%28ENG%29.pdf,21,The community will be made aware of the good use measures or personal care and security in cyberspace
226,Chile_NCSP%20%28ENG%29.pdf,21,This field will present many challenges to Chiles educational system
227,Chile_NCSP%20%28ENG%29.pdf,21, Early and advanced education of the Chilean population should be a part of these challenges
228,Chile_NCSP%20%28ENG%29.pdf,21," Therefore, digital gaps generated by, inter alia, inequitable access to resources, skills, infrastructure and connectivity should be addressed To achieve the above goal"
229,Chile_NCSP%20%28ENG%29.pdf,21," It is critical to implement initiatives promoting and developing a conscious, competent, informed and responsible digital culture, including all relevant stakeholders, and understanding that this is a joint effort to achieve a common long-term benefit"
230,Chile_NCSP%20%28ENG%29.pdf,21,The country will carry out cooperation actions with other stakeholders in the field of cybersecurity and will actively participate in international forums and discussions
231,Chile_NCSP%20%28ENG%29.pdf,21, Chilean foreign policy principles 
232,Chile_NCSP%20%28ENG%29.pdf,21,"Chiles foreign policy is based on a series of principles driving its diplomatic work and actions, such as the respect for international law, the promotion of democracy, the respect for human rights, conflict prevention, the pacific resolution of disputes and the commitment to cooperate in the international"
233,Chile_NCSP%20%28ENG%29.pdf,21," In turn, these principles drive the interest of Chiles foreign policy, namely contribute to the strengthening of multilateralism and promote international peace and security12"
234,Chile_NCSP%20%28ENG%29.pdf,21," The emergence of cyberspace, especially the Internet as a public asset, urges us to face the challenges of managing all types of risks where interacting at an international level is particularly important in the light of the global and cross-border nature"
235,Chile_NCSP%20%28ENG%29.pdf,21," Of the same Cybersecurity is a cross-cutting and multi-factorial concept which, at an international level, conveys the possibility to build common capacities, approaches and measures with the cooperation and 12 Further information in http //www"
236,Chile_NCSP%20%28ENG%29.pdf,22,"Assistance of other countries, such as the conviction that sustained multilateral diplomatic work involving multiple stakeholders allows decreasing the risk of conflict in cyberspace"
237,Chile_NCSP%20%28ENG%29.pdf,22," To achieve the above, the Ministry of Foreign Affairs will be responsible for coordinating with other ministries and Government agencies, the international cybersecurity policy, Cooperation and assistance"
238,Chile_NCSP%20%28ENG%29.pdf,22,"Bilateral cooperation work will promote different types of relations with other countries in the field of cybersecurity, including assistance to and from Chile, exchange of information and experiences"
239,Chile_NCSP%20%28ENG%29.pdf,22, The implementation and furtherance of mechanisms for facilitating political dialogue in this field and the promotion of transparency and trust building
240,Chile_NCSP%20%28ENG%29.pdf,22," In cyberspace, with an emphasis on multi-agency, "
241,Chile_NCSP%20%28ENG%29.pdf,22,"Reinforce the participation in multilateral and multi-stakeholder work, Efforts must be focused on promoting digital as a free, open and safe environment for all users in the cyberspace"
242,Chile_NCSP%20%28ENG%29.pdf,22,"The country needs to strengthen its work in this field, taking into consideration the special challenges faced in terms not only of the technical conditions and the global nature and decentralised character of the network, but also regarding its political scope and with a system of Internet governance, including Multiple stakeholders, where the private sector and civil society have a special role Within this framework, the countrys involvement will be increased in the multilateral and global arena, supporting regional sub-regional and multilateral consultations in this field, especially in Latin America, and actively involving stakeholders in this debate, Promote International regulations encouraging trust and security in the cyberspace "
243,Chile_NCSP%20%28ENG%29.pdf,22,"Although there are practically no specific regulation instruments, the cyberspace is actually regulated both by the existing national laws and by the general applicable international regulations"
244,Chile_NCSP%20%28ENG%29.pdf,22," Therefore, the challenge lies particularly on being able to identify and interpret the relevant regulations of the applicable international law"
245,Chile_NCSP%20%28ENG%29.pdf,22,"However, there are some challenges that must be faced through specific international agreements and regulations such as the Convention on Cybercrime, which the country will adhere to with reservations and safeguards consistent with this policy"
246,Chile_NCSP%20%28ENG%29.pdf,22," Additionally, the debate and adoption of multilateral and bilateral agreements should be promoted in order to encourage cooperation and mutual assistance in the field of cybersecurity, both in terms of formal instruments and as informal agreements and arrangements focused on international transparency and the trust building in this field"
247,Chile_NCSP%20%28ENG%29.pdf,22,The country will promote the development of a cybersecurity industry serving its strategic objectives
248,Chile_NCSP%20%28ENG%29.pdf,22," The importance of innovation and development in cybersecurity Activities aimed at protecting domestic security and foreign defence generally require a strong innovation and development element, promoting an increased development of the industry at a "
249,Chile_NCSP%20%28ENG%29.pdf,22,"National CYBERSECURITY POLICY, ( NCSP, ), 2017-2022 "
250,Chile_NCSP%20%28ENG%29.pdf,23," Within this framework, the field of cybersecurity requires a special effort because of its original nature and strategic importance for the country as a whole Cybersecurity as a means to contribute to Chiles digital development, While the size of the ICT sector represents 3~4, 12 % share Of the Chilean economy in OECD countries, this industry reports an average 6 % share in the countrys economies13, generating a gap between both realities that Chile will partly resolve through the development of the cybersecurity component within this industry"
251,Chile_NCSP%20%28ENG%29.pdf,23," This will generate both an increased demand on the information technology industry and a higher industrial development in this field, helping the country to advance towards OECDs indicators, as well as strengthening policy objectives, Development of the cybersecurity industry in Chile"
252,Chile_NCSP%20%28ENG%29.pdf,23, There are no specific figures regarding the level of development of the national industry
253,Chile_NCSP%20%28ENG%29.pdf,23," Apart from some studies, exploring this alternative14"
