,Document,Page,Sentence
254,Chile_NCSP%20%28ENG%29.pdf,23,", The countrys effort to develop a cybersecurity industry will be supported by studies describing the industry and identifying strategic fields for development in the short, medium and long time, Particularly a field which is regularly developed in compared experiences"
255,Chile_NCSP%20%28ENG%29.pdf,23," Is the domestic industry related with the development and use of encryption standards by reason of its strategic importance for the countrys security abroad, Contribute to the generation of an offer by the local industry? Measures will be adopted in order to help creating and strengthening a domestic industry for cybersecurity services, technologies and management through a programme and initiatives aimed at the production of new goods and services in this area"
256,Chile_NCSP%20%28ENG%29.pdf,23,", A development pole will be created in this area, which is in Line with the Productivity, Innovation and Growth Agenda15 and the Digital Agenda for 2020 "
257,Chile_NCSP%20%28ENG%29.pdf,23,"Generation of demand by the public sector based on the States, strategic interests, "
258,Chile_NCSP%20%28ENG%29.pdf,23,"The generation of demand by the public sector, based on their strategic and security needs and interests, will support the strengthening of a national industry focused on cybersecurity services, technologies and management, which is in line with international technical standards"
259,Chile_NCSP%20%28ENG%29.pdf,23," There are studies giving an approximate value to the GDP contributed by the ICT sector, such as the ndice Pas Digital carried out by the Pas Digital Foundation and UDD submitted in January 2015"
260,Chile_NCSP%20%28ENG%29.pdf,23, This study estimated that the ICT sector represents 3 % of the total Chilean economy
261,Chile_NCSP%20%28ENG%29.pdf,23, ( source from 2012 )
262,Chile_NCSP%20%28ENG%29.pdf,23," Likewise, in March 2015, the Under-Secretariat of Economy commissioned to F & K, Consultores the study Status of the Digital Development in Chile, which reported that the aggregate value of the ICT sector reaches 4"
263,Chile_NCSP%20%28ENG%29.pdf,23,"12 % as compared with the total aggregated value ( source from 2011 ) 14 Report `` Information and Communication Technologies in Chile, Research Areas and Capabilities, State of the Art, Report'' ( Information and Communication Technology in Chile, Research Areas and Capabilities; State-of-the-art Report, ) Conicyt 2010"
264,Chile_NCSP%20%28ENG%29.pdf,23," ndice Pas Digital Pas Digital Foundation in conjunctions, with UDD January 2015"
265,Chile_NCSP%20%28ENG%29.pdf,23,"; Status of the Digital Development in Chile F & K, Consultores March 2015, 15 Available in http //www"
266,Chile_NCSP%20%28ENG%29.pdf,24,7 Roles and required institutional structure to develop a national cybersecurity policy
267,Chile_NCSP%20%28ENG%29.pdf,24,Institutional structure for cybersecurity: 
268,Chile_NCSP%20%28ENG%29.pdf,24,"It is essential for Chile, in order to fulfil this ambitious national cybersecurity policy and following the example of several other countries that have started this process some years ago to have available a cybersecurity governance model responsible, at least for carrying out such roles, identified as essential, which Are not being addressed or are executed with no coordination within the country"
269,Chile_NCSP%20%28ENG%29.pdf,24," Therefore, the creation of an institutional framework to take up that role is hereby proposed"
270,Chile_NCSP%20%28ENG%29.pdf,24," A modern governance model and institutional framework, which is in line with the needs of cyberspace and the countrys digital development"
271,Chile_NCSP%20%28ENG%29.pdf,24, Will be a matter of law to be prepared and submitted by responsible institutional actors
272,Chile_NCSP%20%28ENG%29.pdf,24,"? Additionally, the creation of an advisory consulting council composed of different sectors will be assessed"
273,Chile_NCSP%20%28ENG%29.pdf,24," The roles identified as essential are management of inter-institutional relationships, incident management, national and international point of contact, communications role, technical regulation and advisory role in general regulations, follow-up and evaluation of measures To carry out the above correspondence of the cybersecurity framework, with supplementary measures being developed in The area of digital governance within the State administration will be especially taken into account"
274,Chile_NCSP%20%28ENG%29.pdf,24,Transitional governance in cybersecurity: 
275,Chile_NCSP%20%28ENG%29.pdf,24,"While the cybersecurity bill containing the final proposal for its institutional structure is discussed in the National Congress, certain essential roles identified up until now shall be temporarily performed by some of the institutions that are currently a part of the Governments structure"
276,Chile_NCSP%20%28ENG%29.pdf,24," An example of this is the role played by CSIRT Gob, which will be technically responsible for managing incidents arisen within the States Connectivity Network, while at a political level, it has been proposed to extend the term and scope of the Inter-Ministerial Cybersecurity Committee"
277,Chile_NCSP%20%28ENG%29.pdf,24, With regard to the communication coordination and follow up roles of the different measures set out in the NCSP 
278,Chile_NCSP%20%28ENG%29.pdf,24,"National CYBERSECURITY POLICY, ( NCSP, ), 2017-2022 "
279,Chile_NCSP%20%28ENG%29.pdf,25,8 Public policy measures for 2017-2018
280,Chile_NCSP%20%28ENG%29.pdf,25, The measures below are an integral part of the public policy agenda to be implemented based on the strategic objectives described above16 MEASURE
281,Chile_NCSP%20%28ENG%29.pdf,25,Prepare and forward to the National Congress a cybersecurity bill aimed at consolidating the institutional framework and incident management related with information security throughout the country
282,Chile_NCSP%20%28ENG%29.pdf,25,"( monitoring this measure, ) "
283,Chile_NCSP%20%28ENG%29.pdf,25,"Update Decree Law 83 about the States, information security aimed at the adoption of new standards and the MINSEGPRES "
284,Chile_NCSP%20%28ENG%29.pdf,25,"Creation of a model to control, effective compliance, Add a cybersecurity dimension to the preparation and MOP ( Concessions"
285,Chile_NCSP%20%28ENG%29.pdf,25,"Management of contracts for public concession tenders, Department, ), "
286,Chile_NCSP%20%28ENG%29.pdf,25,Create a working group responsible for developing a regulation and obligation framework for critical 
287,Chile_NCSP%20%28ENG%29.pdf,25,"Infrastructures in Chile, from a risk management focus, Create a technical regulation for the development or contracting of software within the State pursuant to MINSEGPRES "
288,Chile_NCSP%20%28ENG%29.pdf,25,"Standards for safe development, "
289,Chile_NCSP%20%28ENG%29.pdf,25,Create a platform to add information about cybersecurity incidents; 
290,Chile_NCSP%20%28ENG%29.pdf,25,Coordinate the creation of updated requirements for MTT Super-intendence 
291,Chile_NCSP%20%28ENG%29.pdf,25,Identify a minimum set of risks for Critical Information Infrastructure
292,Chile_NCSP%20%28ENG%29.pdf,25,Implement a standardised template for cybersecurity incident reports
293,Chile_NCSP%20%28ENG%29.pdf,25,"16, The first body is the main responsible entity to carry out the task and the other bodies support execution of the same"
294,Chile_NCSP%20%28ENG%29.pdf,25," Csirt means the current security equipment of the States Connectivity Network, which will gradually take on operational duties identified in this policy"
295,Chile_NCSP%20%28ENG%29.pdf,25,"Public institutions are identified with the following acronyms CICS Interministerial Committee on Cybersecurity, ( Interministerial Committee on Cyber Securiry, MISP Ministry of the Interior and Public Security, ( Interior and Public Security Ministry, ) MTT Ministry of Transportation and Telecommunications, ( Transport and Telecommunications Ministry, ), MINDEF Ministry of National Defense, (, National Defense Ministry, ), MINHACIENDA, Ministry of Finance, ( Finance Ministry, ), ANI, National Intelligence Agency, (, National Intelligence, Bureau, ), MINJUSTICIA Ministry of Justice And Human Rights, ( Ministry of Justice and Human Rights, ) MINSEGPRES Ministry, General Secretariat of the Presidency, ( Ministry of the President's Office ) MOP Ministry of Public Works, ( Ministry of Public Works, Public Works, ), MINEDUC"
296,Chile_NCSP%20%28ENG%29.pdf,25,"Ministry of Education, MINREL Ministry of Foreign Affairs, ( Ministry of Foreign Affairs ) MSGG Ministry, General Secretariat of Government, ( Ministry of the Government's Office, ) MINECON Ministry of Economy, Development and Tourism, ( Ministry, the Economy, Development and Tourism ) When a ministry is mentioned without identifying a specific public service or under-secretariat"
297,Chile_NCSP%20%28ENG%29.pdf,25," The reference relates with the under- secretariat participating in the Inter-Ministerial Committee on Cybersecurity, or should the corresponding ministry not be a part of the Committee, the corresponding ministry shall be responsible in general"
298,Chile_NCSP%20%28ENG%29.pdf,26,Incorporate a cybersecurity dimension in the national MISP ( CICS monitoring this 
299,Chile_NCSP%20%28ENG%29.pdf,26,Prepare the regulation setting out safe mechanisms for exchanging information within the Government between MISP MINDEF ANI- 
300,Chile_NCSP%20%28ENG%29.pdf,26,High level officers and other officials handling confidential MINREL MINSEGPRES 
301,Chile_NCSP%20%28ENG%29.pdf,26,Prepare a study about the resilience of telecommunication 
302,Chile_NCSP%20%28ENG%29.pdf,26,Networks in Chile proposing measures to improve it in the 
303,Chile_NCSP%20%28ENG%29.pdf,26,Public and private fields - 
304,Chile_NCSP%20%28ENG%29.pdf,26,"Update the regulation on computer-related crimes, MISP MINJUSTICIA "
305,Chile_NCSP%20%28ENG%29.pdf,26,Design and implement a standardised template to report MISP ( with the police forces
306,Chile_NCSP%20%28ENG%29.pdf,26,Promote the strengthening of investigation and forensic MISP ( with ANI and the 
307,Chile_NCSP%20%28ENG%29.pdf,26,"Analysis skills related with cybercrime, "
308,Chile_NCSP%20%28ENG%29.pdf,26,Generate a first point for the dissemination of information: 
309,Chile_NCSP%20%28ENG%29.pdf,26,"To citizens, based on the different digital channels and social networks enabled by the Internet, MISP MSGG, (, CICS, "
310,Chile_NCSP%20%28ENG%29.pdf,26,Monitoring this measure ) 
311,Chile_NCSP%20%28ENG%29.pdf,26,"Mark the Cybersecurity Month in October, each year, "
312,Chile_NCSP%20%28ENG%29.pdf,26,"Promoting and developing activities to raise awareness at MISP, MSGG, (, CICS "
313,Chile_NCSP%20%28ENG%29.pdf,26," Additionally participate in the Safe Internet Day, monitoring this measure ) "
314,Chile_NCSP%20%28ENG%29.pdf,26,Design and implement a large-scale cybersecurity campaign and promote the implementation of 
315,Chile_NCSP%20%28ENG%29.pdf,26,"Dissemination programmes in partnership with the private sector, in awareness campaigns, with an emphasis on vulnerable sectors and a gender perspective, MSGG ( CICS monitoring, "
316,Chile_NCSP%20%28ENG%29.pdf,26,Generate best practice guidelines both for citizens and the public sector; 
317,Chile_NCSP%20%28ENG%29.pdf,26,Establish a cross-sectoral committee to promote 
318,Chile_NCSP%20%28ENG%29.pdf,26,Cybersecurity at all levels and areas of the educational 
319,Chile_NCSP%20%28ENG%29.pdf,26,Design and implement a cybersecurity campaign 
320,Chile_NCSP%20%28ENG%29.pdf,26,"Aimed at the elderly population, including training and dissemination, "
321,Chile_NCSP%20%28ENG%29.pdf,26,"( Human Capital Committee, ) "
322,Chile_NCSP%20%28ENG%29.pdf,26,( CICS monitoring this 
323,Chile_NCSP%20%28ENG%29.pdf,26,Mds ( Senama ) MINECON 
324,Chile_NCSP%20%28ENG%29.pdf,26,"( Human Capital Committee, ) "
325,Chile_NCSP%20%28ENG%29.pdf,26,( CICS monitoring this 
326,Chile_NCSP%20%28ENG%29.pdf,26,Mineduc ( Links ) 
327,Chile_NCSP%20%28ENG%29.pdf,26,"Include Internet security issues in MINEDUCs, specific MINECON, ( Human Capital, "
328,Chile_NCSP%20%28ENG%29.pdf,26,"Programmes promoting the ENLACES initiative, "
329,Chile_NCSP%20%28ENG%29.pdf,26,Committee ) ( CICS 
330,Chile_NCSP%20%28ENG%29.pdf,26,Monitoring this measure ) 
331,Chile_NCSP%20%28ENG%29.pdf,26,"National CYBERSECURITY POLICY, ( NCSP, ), 2017-2022 "
332,Chile_NCSP%20%28ENG%29.pdf,27,"Strongly support the establishment at an international level of regional, sub-regional and multilateral political consultation processes, with special emphasis on the "
333,Chile_NCSP%20%28ENG%29.pdf,27,"Advance the creation of bilateral work, mechanisms, "
334,Chile_NCSP%20%28ENG%29.pdf,27,Developing agendas and implementing cross-cutting 
335,Chile_NCSP%20%28ENG%29.pdf,27,Political consultation instances with partner countries 
336,Chile_NCSP%20%28ENG%29.pdf,27,"Prepare a document containing Chiles international policy, MINREL (, CICS monitoring, "
337,Chile_NCSP%20%28ENG%29.pdf,27,"About cyberspace and cybersecurity, "
338,Chile_NCSP%20%28ENG%29.pdf,27,Establish an inter-agency working group to address international issued related with cyberspace
339,Chile_NCSP%20%28ENG%29.pdf,27,"Encourage the exchange of experiences with other countries in the field of cyber-security, with emphasis on the implementation and evaluation of strategies and "
340,Chile_NCSP%20%28ENG%29.pdf,27,Analyse the regulation and application of the current 
341,Chile_NCSP%20%28ENG%29.pdf,27,"System of public procurement, supporting production and strategic domestic interests, "
342,Chile_NCSP%20%28ENG%29.pdf,27,"Division, ) MISP MINDEF "
343,Chile_NCSP%20%28ENG%29.pdf,27,"Carry out studies both describing the cybersecurity industry, ( offer ) and the use of cybersecurity in the country"
344,Chile_NCSP%20%28ENG%29.pdf,27," ( demand ), with the purpose of creating special programmes to promote the cybersecurity industry in specific sectors"
345,Chile_NCSP%20%28ENG%29.pdf,27," Corfo MINDEF, MINECON, "
346,Chile_NCSP%20%28ENG%29.pdf,27,"Analyse tax incentives, subsidies or R+D+I schemes in order MINHACIENDA, MINECON "
347,Chile_NCSP%20%28ENG%29.pdf,27,"To develop and adopt cybersecurity standards, CORFO "
348,Chile_NCSP%20%28ENG%29.pdf,27,Process the new law on personal data conferring powers to 
349,Chile_NCSP%20%28ENG%29.pdf,27,"A specific body that may impose security and notification, MINHACIENDA- MINECON "
350,Chile_NCSP%20%28ENG%29.pdf,27,Requirements in connection with data leakage Develop one or more multi-sectoral cooperation
351,Chile_NCSP%20%28ENG%29.pdf,27,"Opportunities with a series of social stakeholders, ( NGOs, companies, unions and academia, inter alia, ) CICS, ( committee, "
352,Chile_NCSP%20%28ENG%29.pdf,27, 5 996 and Supreme Decree No
353,Chile_NCSP%20%28ENG%29.pdf,27," 1,299, in line with the amendments to Supreme Decree, No "
354,Chile_NCSP%20%28ENG%29.pdf,27,"Setting out the requirements to access the network, ( self- "
355,Chile_NCSP%20%28ENG%29.pdf,27,"Assessment online courses ) and the obligation to report incidents by public bodies, "
356,Chile_NCSP%20%28ENG%29.pdf,27,Carry out cyber exercises about cybersecurity incidents with different stakeholders in order to encourage the 
357,Chile_NCSP%20%28ENG%29.pdf,27,"Proper knowledge, research and dissemination of gaps, "
358,Chile_NCSP%20%28ENG%29.pdf,27,Vulnerabilities and ways of mitigation in the national systems - 
359,Chile_NCSP%20%28ENG%29.pdf,28,"Incorporate cybersecurity standards in the States suppliers requesting specific requirements for ICT MINHACIENDA, ( Chilecompra "
360,Chile_NCSP%20%28ENG%29.pdf,28,"Suppliers and analysing other requirements for other Division, ) "
361,Chile_NCSP%20%28ENG%29.pdf,28,Include a set of questions linked to cybercrime in the MISP ( Under-Secretariat of 
362,Chile_NCSP%20%28ENG%29.pdf,28,"National Urban Survey on Citizen Security, ( ENUSC, ) Crime Prevention, ) "
363,Chile_NCSP%20%28ENG%29.pdf,28,Prepare and regularly update a record of training offers 
364,Chile_NCSP%20%28ENG%29.pdf,28,"For public servants about cybersecurity available in MISP, MINREL "
365,Chile_NCSP%20%28ENG%29.pdf,28,International organisations and national institutions 
366,Chile_NCSP%20%28ENG%29.pdf,28,"Adhere to and implement the Convention on, Cybercrime of the Council of Europe"
367,Chile_NCSP%20%28ENG%29.pdf,28,Encourage State support of R+D+I projects with public or 
368,Chile_NCSP%20%28ENG%29.pdf,28,"Private financing, whether national or international, in the "
369,Chile_NCSP%20%28ENG%29.pdf,28,"Promote the development of advanced human capital, "
370,Chile_NCSP%20%28ENG%29.pdf,28,"Regarding cybersecurity in the different technical-, professional or vocational areas, "
371,Chile_NCSP%20%28ENG%29.pdf,28,Corfo MINECON ( Human 
372,Chile_NCSP%20%28ENG%29.pdf,28,Support the export of national products and services in the 
373,Chile_NCSP%20%28ENG%29.pdf,28,"Field of cybersecurity, identifying international exhibitions and evaluating support actions"
374,Chile_NCSP%20%28ENG%29.pdf,28,Minrel ( Prochile ) 
375,Chile_NCSP%20%28ENG%29.pdf,28,"National CYBERSECURITY POLICY, ( NCSP, ), 2017-2022 "
376,Chile_NCSP%20%28ENG%29.pdf,29,"Annex N 1 Standards and institutions involved in cybersecurity in Chile, "
377,Chile_NCSP%20%28ENG%29.pdf,29,"Relevant STANDARDS AT A NATIONAL LEVEL, "
378,Chile_NCSP%20%28ENG%29.pdf,29,"Political Constitution of the Republic of Chile, Article 8, about public transparency, "
379,Chile_NCSP%20%28ENG%29.pdf,29,"Article 19, including a catalogue of fundamental rights with the most relevant ones, being 2 equality before the law Nos"
380,Chile_NCSP%20%28ENG%29.pdf,29, 3 and 7 due process and individual safety Nos
381,Chile_NCSP%20%28ENG%29.pdf,29," Protection of life and inviolability of communications, No"
382,Chile_NCSP%20%28ENG%29.pdf,29, Freedom of speech and freedom of information and Nos
383,Chile_NCSP%20%28ENG%29.pdf,29," 24 and 25 property and freedom of creation, Article 24 vesting upon the person who acts as President of the Republic, the authority to safeguard the public order in and the external security of the Republic"
384,Chile_NCSP%20%28ENG%29.pdf,29," Apart from the regulations that govern the authorities vested upon other State powers and bodies, Articles 39 and following regulating specific situations that affect the normal operation of the "
385,Chile_NCSP%20%28ENG%29.pdf,29,"Criminal Procedure Code, This piece of legislation regulates criminal investigation and prosecution in Chile and within this framework, any investigation related with cybercrime that may be carried out in the country"
386,Chile_NCSP%20%28ENG%29.pdf,29," Additionally, it regulates a set of intrusive measures that may affect the recipients, private life or inviolability of communications, and therefore the inviolability of their communication, for which purpose the Law demands certain legal requirements and a court order authorising the practice of such measures"
387,Chile_NCSP%20%28ENG%29.pdf,29,"19,913, which creates the financial analysis unit and modifies a series of provisions in the field of money laundering and bleaching"
388,Chile_NCSP%20%28ENG%29.pdf,29," This law regulates some investigation and surveillance measures that, as in the case of the Criminal Procedure Code, may affect the recipients, private life or inviolability of communication, and therefore the confidentiality of their information, for which reason the Law in this case also requires a court order"
389,Chile_NCSP%20%28ENG%29.pdf,29," In conjunction with the fulfilment of the legal requirements of the case, Decree Law No"
390,Chile_NCSP%20%28ENG%29.pdf,29," 211 Free Competition Law, As in the previous case, this law authorises the carrying out of intrusive in specific cases and, in the same terms, described above "
391,Chile_NCSP%20%28ENG%29.pdf,29," 19,974 about the System of the States, Intelligence and creating the National Intelligence Bureau Within the framework of intelligence information gathering"
392,Chile_NCSP%20%28ENG%29.pdf,29, This Law regulates the practice of special procedures to gather information which has to be done under a court order and taking into account a series of legal safeguards
393,Chile_NCSP%20%28ENG%29.pdf,29, Restricting the gathering and use of this information
394,Chile_NCSP%20%28ENG%29.pdf,30," Criminal Code, This legal piece is the countrys main criminal catalogue containing the description of a set of specific conducts, together with the associated sentences"
395,Chile_NCSP%20%28ENG%29.pdf,30," Regarding cybersecurity, this code describes a series of conducts that may be carried out through cyberspace or affects the elements thereof"
396,Chile_NCSP%20%28ENG%29.pdf,30," Having a key relevance in the development of policies and the combat against cybercrime, "
397,Chile_NCSP%20%28ENG%29.pdf,30,"Code of Military Justice, A legal piece containing specific provisions regarding crimes, mostly perpetrated by members of the armed forces or at times of war"
398,Chile_NCSP%20%28ENG%29.pdf,30," The provisions of this legal piece cover crimes related with espionage and disclosure of certified information to third parties, with the purpose of protecting the national security"
399,Chile_NCSP%20%28ENG%29.pdf,30,"19,223, There is a sub-category in the field of cybercrime, related with the disturbance of the logical components of cyberspace, ( computer programmes, information systems, databases, ), called computer-related crimes"
400,Chile_NCSP%20%28ENG%29.pdf,30," This Law sets out specific criminal definitions, describing the non-authorised access, theft and destruction of information systems"
401,Chile_NCSP%20%28ENG%29.pdf,30,"20,009, covering the Loss, Theft or Robbery of Credit and Debit Cards Law No"
402,Chile_NCSP%20%28ENG%29.pdf,30," 18,168 General Telecommunications Law"
403,Chile_NCSP%20%28ENG%29.pdf,30," This piece of legislation regulates the legal framework of the countrys telecommunication industry, which provides key physical and logical infrastructure for the national cyber space"
404,Chile_NCSP%20%28ENG%29.pdf,30," One of its provisions set out the protection, confidentiality and integrity of the information through the criminalisation of offences related with the non-authorised interception, ( art"
405,Chile_NCSP%20%28ENG%29.pdf,30," 36B, letters b and c )"
406,Chile_NCSP%20%28ENG%29.pdf,30," Two recent modifications are especially relevant for the countrys cybersecurity, namely Law No"
407,Chile_NCSP%20%28ENG%29.pdf,30," That ensures the principle of networks, neutrality for Internet consumers and users regulating network management measures that may be adopted by Internet service providers and ensuring the duty of confidentiality and Law No"
408,Chile_NCSP%20%28ENG%29.pdf,30," 20,478 about business recovery and continuity"
409,Chile_NCSP%20%28ENG%29.pdf,30, When the public telecommunications system is affected by critical and emergency situations enacted after the earthquake that affected the country in 2010
410,Chile_NCSP%20%28ENG%29.pdf,30,", As described by its name, this Law sets out a set of measures allowing maintaining the continuity of the countrys telecommunications and therefore the availability of information Contained in the cyberspace "
411,Chile_NCSP%20%28ENG%29.pdf,30," 19,799 regarding electronic documents, electronic signature and signature certification services"
412,Chile_NCSP%20%28ENG%29.pdf,30," This Law regulates the use of electronic documents in the country, with the corresponding mechanisms to ensure information, integrity and confidentiality by the use of digital signature, together with a system guaranteeing the proper operations of the bodies providing this service"
413,Chile_NCSP%20%28ENG%29.pdf,30," 20,285 about the access to public information"
414,Chile_NCSP%20%28ENG%29.pdf,30," This piece of legislation creates a transparency scheme for the States activities with active transparency obligations which must be carried out through the website of each relevant public body and passive obligations, which consist in providing the data that any person may require from these bodies"
415,Chile_NCSP%20%28ENG%29.pdf,30," Provided that this does not affect other rights and interests set out in the law -such as the States, security and third partys privacy, so that the confidentiality of the relevant is not affected"
416,Chile_NCSP%20%28ENG%29.pdf,30,"19,628 regarding the protection of private life, This law sets out a series of principles and rights relative to the management of personal data in the country that may be requested by the owner of the personal data to whom is in possession of, or manages a record containing"
417,Chile_NCSP%20%28ENG%29.pdf,30," Such data, together with the general application rules for the management of personal data by the public and private sectors in connection with the safeguarding of the data contained in such information, "
418,Chile_NCSP%20%28ENG%29.pdf,30,"National CYBERSECURITY POLICY, ( NCSP, ), 2017-2022 "
419,Chile_NCSP%20%28ENG%29.pdf,31, 83/2005 approving the technical regulations for the State administration bodies about the security and confidentiality of electronic documents
420,Chile_NCSP%20%28ENG%29.pdf,31," This decree, which evolves from the provisions contained in Law No"
421,Chile_NCSP%20%28ENG%29.pdf,31," 19,799, sets out a regulation for the public administration of the State about the security and confidentiality of electronic documents"
422,Chile_NCSP%20%28ENG%29.pdf,31," Together with the information infrastructure based on ISO standard 27,000, with the setting out of administrative measures such as the creation of information security committees in each public service"
423,Chile_NCSP%20%28ENG%29.pdf,31,", This decree is supplemented with Supreme Decree No"
