,Document,Page,Sentence
120,Estonia_2014_cyber_security_strategy_2014-2017_public_version.pdf,10,"Protection of critical information infrastructure is enhanced through the participation in the work of international organizations being represented in the interest groups of partners and allies and through contributing to the professional development of experts, Subgoal 2"
121,Estonia_2014_cyber_security_strategy_2014-2017_public_version.pdf,10, Enhancing of the fight against cybercrime
122,Estonia_2014_cyber_security_strategy_2014-2017_public_version.pdf,10," The economic damage deriving from cybercrime reduces trust in digital services and in a worst-case scenario, could lead to loss of life"
123,Estonia_2014_cyber_security_strategy_2014-2017_public_version.pdf,10, Greater awareness among the general public about cyber security risks helps to prevent cybercrimes
124,Estonia_2014_cyber_security_strategy_2014-2017_public_version.pdf,10, Greater awareness is achieved by addressing cyber-related topics at all levels of education and informing people based on research and analysis of secure behaviours
125,Estonia_2014_cyber_security_strategy_2014-2017_public_version.pdf,10,Enhancing detection of cybercrime 
126,Estonia_2014_cyber_security_strategy_2014-2017_public_version.pdf,10,"In order to improve the efficiency of cybercrime, detection and prosecution, the current structure of law enforcement and its organisation of work will be further clarified"
127,Estonia_2014_cyber_security_strategy_2014-2017_public_version.pdf,11,Of personnel dealing with cybercrime will be increased and the capabilities of bodies conducting proceedings to process digital data carriers will be raised
128,Estonia_2014_cyber_security_strategy_2014-2017_public_version.pdf,11, In order to develop capabilities
129,Estonia_2014_cyber_security_strategy_2014-2017_public_version.pdf,11, Cooperation takes place with universities and international centres of excellence
130,Estonia_2014_cyber_security_strategy_2014-2017_public_version.pdf,11,"Raising public awareness of cyber risks In order to raise the level of awareness of actors operating in cyberspace, attention is paid to introducing actions preventing cyber threats, providing the knowledge needed to identify, as well as wisely respond to incidents"
131,Estonia_2014_cyber_security_strategy_2014-2017_public_version.pdf,11, Users of e-services are directed to use the most secure solutions and are informed about new technologies and how to securely use these solutions
132,Estonia_2014_cyber_security_strategy_2014-2017_public_version.pdf,11,"Promoting international cooperation against cybercrime, "
133,Estonia_2014_cyber_security_strategy_2014-2017_public_version.pdf,11,"In order to achieve more effective and timely prosecution of cybercrimes with an international dimension, information exchange between countries is improved"
134,Estonia_2014_cyber_security_strategy_2014-2017_public_version.pdf,11," Active participation in various initiatives and projects that are part of the international fight against cybercrime, Subgoal 3, Development of national cyber defence capabilities, Civil military and international Cooperation based on the resources at the disposal of the state must also function adequately in cyberspace"
135,Estonia_2014_cyber_security_strategy_2014-2017_public_version.pdf,11," With regards to warning deterrence and active defence, "
136,Estonia_2014_cyber_security_strategy_2014-2017_public_version.pdf,11,"Synchronising military planning and preparation for civil emergencies, Broad-based national defence requires that the continuous operation plans of vital service providers are coordinated with national defence threat scenarios Developing collective cyber defence and international collaboration To ensure collective defence in an international environment"
137,Estonia_2014_cyber_security_strategy_2014-2017_public_version.pdf,11, Information exchange and cooperation are enhanced
138,Estonia_2014_cyber_security_strategy_2014-2017_public_version.pdf,11," With NATO European Union cyber instances and other partners, Efforts are made concerning the creation and development of NATO joint cyber security capabilities standards, training and training opportunities, Developing military cyber defence capabilities"
139,Estonia_2014_cyber_security_strategy_2014-2017_public_version.pdf,11,The development of military cyber defence capabilities will result in cyber defence being a part of broad-based collective defence
140,Estonia_2014_cyber_security_strategy_2014-2017_public_version.pdf,11, The latter will be ensured by involving specialists
141,Estonia_2014_cyber_security_strategy_2014-2017_public_version.pdf,12,"From, the Defence Forces and the Estonian Defence League, as well as other public and private sector professionals, "
142,Estonia_2014_cyber_security_strategy_2014-2017_public_version.pdf,12,Ensuring a high level of awareness concerning the role of cyber security in national defence 
143,Estonia_2014_cyber_security_strategy_2014-2017_public_version.pdf,12,"In order to raise the level of awareness concerning cyber security risks in the field of national defence and to link it with other military domains, additional training is organised for personnel in the field"
144,Estonia_2014_cyber_security_strategy_2014-2017_public_version.pdf,12,Subgoal 4 Estonia manages evolving cyber security threats To maintain and improve its cyber security capability
145,Estonia_2014_cyber_security_strategy_2014-2017_public_version.pdf,12," Estonia will adopt independent cyber security solutions, which are backed by cyber security, training and training opportunities, research and development and entrepreneurship"
146,Estonia_2014_cyber_security_strategy_2014-2017_public_version.pdf,12," In order to ensure the sustainability of solutions, the state acts as a smart contractor and supports the export of cyber security solutions"
147,Estonia_2014_cyber_security_strategy_2014-2017_public_version.pdf,12,"Ensuring the next generation cyber security professionals To ensure the next generation of cyber security professionals, opportunities for additional education will be established both in the form of higher education as well as forms of in- service"
148,Estonia_2014_cyber_security_strategy_2014-2017_public_version.pdf,12, Support will be given to raise the number of students having completed a Masters Degree in cyber security and increase
149,Estonia_2014_cyber_security_strategy_2014-2017_public_version.pdf,12, The number of doctoral theses on cyber security
150,Estonia_2014_cyber_security_strategy_2014-2017_public_version.pdf,12, Instruction will involve more foreign lecturers and professionals Developing smart contracting for cyber security solutions
151,Estonia_2014_cyber_security_strategy_2014-2017_public_version.pdf,12," In order to create secure solutions, the state will contribute to cyber security-related research and development"
152,Estonia_2014_cyber_security_strategy_2014-2017_public_version.pdf,12,": A supervisory board shall be set up to coordinate the corresponding activities and to consolidate the domains of national defence, security, economic development and academia"
153,Estonia_2014_cyber_security_strategy_2014-2017_public_version.pdf,12,"Supporting development of enterprises providing cyber security and national cyber security solutions, "
154,Estonia_2014_cyber_security_strategy_2014-2017_public_version.pdf,12,"To support the sustainability of secure solutions, the state will contribute to the export of cyber security solutions and to increasing their use at the international level"
155,Estonia_2014_cyber_security_strategy_2014-2017_public_version.pdf,13,", Preventing security risks in new solutions In order to avoid large-scale cyber incidents"
156,Estonia_2014_cyber_security_strategy_2014-2017_public_version.pdf,13, The technological risks pertaining to the development and introduction of new technologies are investigated and assessed in depth
157,Estonia_2014_cyber_security_strategy_2014-2017_public_version.pdf,13, High level of knowledge and risk-awareness facilitate achieving advantages in developing the state society and economy
158,Estonia_2014_cyber_security_strategy_2014-2017_public_version.pdf,13,Subgoal 5 Estonia develops cross-sectoral activities To improve the capabilities necessary for combating cyber threats
159,Estonia_2014_cyber_security_strategy_2014-2017_public_version.pdf,13, A number of overarching objectives are addressed
160,Estonia_2014_cyber_security_strategy_2014-2017_public_version.pdf,13, Adjusting the legal framework and developing cyber foreign policy are vital for protecting critical services
161,Estonia_2014_cyber_security_strategy_2014-2017_public_version.pdf,13," The fight against cybercrime, as well as for designing national defence in cyberspace, "
162,Estonia_2014_cyber_security_strategy_2014-2017_public_version.pdf,13,Development of a legal framework to support cyber security In order to implement cyber security measures ensuring a more secure cyberspace
163,Estonia_2014_cyber_security_strategy_2014-2017_public_version.pdf,13, The legal framework related to cyber security will be updated
164,Estonia_2014_cyber_security_strategy_2014-2017_public_version.pdf,13, Promoting international cyber security policy 
165,Estonia_2014_cyber_security_strategy_2014-2017_public_version.pdf,13,"In international organisations, an emphasis is placed on introducing and protecting Estonia's foreign cyber security policy positions and vision, along with developing a common understanding on the application of international legal norms and confidence building measures in cyber space"
166,Estonia_2014_cyber_security_strategy_2014-2017_public_version.pdf,13, Special attention is paid to the protection of fundamental rights and freedoms and the topic of Internet governance
167,Estonia_2014_cyber_security_strategy_2014-2017_public_version.pdf,13," In addition, development assistance and secure e-solutions support the emergence of free and secure cyberspace in countries where the non- governmental sector lacks the freedom to act and the necessary technical base, Closer cooperation with allies and partners With a view to enhancing relations with allies and partners"
168,Estonia_2014_cyber_security_strategy_2014-2017_public_version.pdf,13, Cooperation is intensified with close neighbours and cooperation formats are expanded with like-minded countries
169,Estonia_2014_cyber_security_strategy_2014-2017_public_version.pdf,13," Significant effort is made to share cyber security, related know-how and experience Enhancing the capability of the European Union With the goal of promoting the European Union's common cyber security and its policies"
170,Estonia_2014_cyber_security_strategy_2014-2017_public_version.pdf,13, Joint efforts will be made to raise the cyber capability of Member States and to improve their 
171,Estonia_2014_cyber_security_strategy_2014-2017_public_version.pdf,14,Readiness and ability to deal with new threats: 
172,Estonia_2014_cyber_security_strategy_2014-2017_public_version.pdf,14,"Parties RELATED TO THE STRATEGY, "
173,Estonia_2014_cyber_security_strategy_2014-2017_public_version.pdf,14,The Ministry of Economic Affairs and Communications directs cyber security policy and coordinates the implementation of the strategy
174,Estonia_2014_cyber_security_strategy_2014-2017_public_version.pdf,14," The strategy will be implemented by involving all ministries and government agencies, especially the Ministry of Defence, the Information System Authority, the Ministry of Justice, Police and Border Guard Board"
175,Estonia_2014_cyber_security_strategy_2014-2017_public_version.pdf,14," The Government Office, the Ministry of Foreign Affairs, the Ministry of the Interior and the Ministry of Education and Research"
176,Estonia_2014_cyber_security_strategy_2014-2017_public_version.pdf,14," NGOs, business organizations, governments and educational institutions will cooperate in the implementation and assessment of the strategy"
177,Estonia_2014_cyber_security_strategy_2014-2017_public_version.pdf,14,At the request of the Ministry of Economic Affairs and Communications agencies involved in executing the strategy will submit a written overview of the implementation of the measures and activities each year by 31 January at the latest
178,Estonia_2014_cyber_security_strategy_2014-2017_public_version.pdf,14," Based on the reviews, the Ministry of Economic Affairs and Communication will evaluate the effectiveness of the measures and activities and will compile a report on the implementation of the strategy annually by 31 May at the latest"
179,Estonia_2014_cyber_security_strategy_2014-2017_public_version.pdf,14, A brief report on the execution of the strategy consisting of an overview of the activities difficulties with and the cost of the application will be presented annually to the Government of the Republic by 30 June at the latest
180,Estonia_2014_cyber_security_strategy_2014-2017_public_version.pdf,14, The final report on the execution of the strategy shall be presented by the Ministry of Economic Affairs and Communication to the Government of the Republic by 31 May 2018 at the latest
181,Estonia_2014_cyber_security_strategy_2014-2017_public_version.pdf,14,"The action plan will lay out the activities and budget of the strategy, as well as the individuals responsible for each part"
182,Estonia_2014_cyber_security_strategy_2014-2017_public_version.pdf,14, The four-year cost of the strategy will be nearly EUR 16 million
183,Estonia_2014_cyber_security_strategy_2014-2017_public_version.pdf,14, The report of the action plan that will be submitted to the Government of the Republic will also include propositions on improving the action plan
184,Estonia_2014_cyber_security_strategy_2014-2017_public_version.pdf,14, The activities of the action plan will be reflected in the work plans of the various ministries and other government institutions
185,Estonia_2014_cyber_security_strategy_2014-2017_public_version.pdf,14,The strategy will not redefine the competencies of the different offices responsible for cyber security
186,Estonia_2014_cyber_security_strategy_2014-2017_public_version.pdf,15,"The list of the persons who participated in compiling this strategy or provided their advice, is available in Annex 1 to the strategy"
187,Estonia_2014_cyber_security_strategy_2014-2017_public_version.pdf,15, The list of the participants in the compilation of the Cyber Security Strategy for 2014-2017 
188,Estonia_2014_cyber_security_strategy_2014-2017_public_version.pdf,15, Parties involved in the preparation of the Cyber Security Strategy for 20142017 Annex 2
189,Estonia_2014_cyber_security_strategy_2014-2017_public_version.pdf,15,The strategy was compiled by Sander Retel national cyber security coordinator of the Ministry of Economic Affairs and Communication
