,Document,Page,Sentence
144,Finland_2013_s_Cyber_Security_Strategy.pdf,11, Meas- ures will fall short of the goal without effective and systematically coordinated international cooperation
145,Finland_2013_s_Cyber_Security_Strategy.pdf,11," All authorities within their field of competence will cooperate, especially with those states and organisations that are global, forerun- ners in the field of cyber security"
146,Finland_2013_s_Cyber_Security_Strategy.pdf,11, Active collaboration takes place through R & D
147,Finland_2013_s_Cyber_Security_Strategy.pdf,11," Pre-Agreement consultations and the teamwork efforts of organisations, as well as through participation in international exercises"
148,Finland_2013_s_Cyber_Security_Strategy.pdf,11, In the development of cyber security
149,Finland_2013_s_Cyber_Security_Strategy.pdf,11," The European Union, as well as many interna- tional organisations such as the UN, the OSCE, NATO and the OECD, are impor- tant venues for Finland"
150,Finland_2013_s_Cyber_Security_Strategy.pdf,11, The EU is increasingly active in the field of cyber security and it also engages in cooperation with third countries
151,Finland_2013_s_Cyber_Security_Strategy.pdf,11, Finland is actively partici- pating in this development
152,Finland_2013_s_Cyber_Security_Strategy.pdf,11, - Improve the cyber expertise and awareness of all societal actors
153,Finland_2013_s_Cyber_Security_Strategy.pdf,11, In support of continuously improving the competence and awareness of the actors of society
154,Finland_2013_s_Cyber_Security_Strategy.pdf,11, Inputs will be made to developing utilising and training common cyber security and information security instructions
155,Finland_2013_s_Cyber_Security_Strategy.pdf,11," In order to develop the compre- hensive preparedness of society, the exercises will also incorporate businesses and non-governmental organisations"
156,Finland_2013_s_Cyber_Security_Strategy.pdf,11," ( NGOs, ) critical to the vital functions of society"
157,Finland_2013_s_Cyber_Security_Strategy.pdf,11," A strategic cyber security centre of excellence will be established under the exist- ing, ICT-SHOK (, TIVIT )"
158,Finland_2013_s_Cyber_Security_Strategy.pdf,11, It will provide an opportunity for top research teams and companies who utilise the results to engage in effective mutual cooperation over the long term
159,Finland_2013_s_Cyber_Security_Strategy.pdf,11, The centre of excellence will facilitate the conditions for the estab- lishment of a robust national cyber security
160,Finland_2013_s_Cyber_Security_Strategy.pdf,11," Inputs into R & D and educa- tion will be increased, as well as action to improve cyber security know-how in the whole of society"
161,Finland_2013_s_Cyber_Security_Strategy.pdf,11," Cyber SECURITY STRATEGY, "
162,Finland_2013_s_Cyber_Security_Strategy.pdf,12,Secure the preconditions for the implementation of effective cyber security measures through national legislation
163,Finland_2013_s_Cyber_Security_Strategy.pdf,12," Working together, the administrative branches and the business community will chart the legislation, including any needs to review the provisions relevant to the cyber domain and cyber security"
164,Finland_2013_s_Cyber_Security_Strategy.pdf,12," The results of this action will comprise the pro- posals for legislative review, which will advance the achievement of the goals of the Cyber Security Strategy"
165,Finland_2013_s_Cyber_Security_Strategy.pdf,12, The charting will take into account the rapidly changing phenomena in the cyber do- main
166,Finland_2013_s_Cyber_Security_Strategy.pdf,12, One of the purposes is to provide the competent authorities and other actors with the sufficient means and powers through legislation to implement cyber defenc- es for the functions vital to society and especially the security of the state
167,Finland_2013_s_Cyber_Security_Strategy.pdf,12,", Any pos- sible legislative hurdles, restrictions and obligations related to Data protection, as well as those arising from international obligations that impede the obtainability, disclo-, sure and exchange of information useful for effective cyber defence purposes, will be taken under review"
168,Finland_2013_s_Cyber_Security_Strategy.pdf,12, When it comes to the assessment of information-gathering and other data processing
169,Finland_2013_s_Cyber_Security_Strategy.pdf,12," One should also estimate whether the competent authori- ties should have improved possibilities for gathering information, data processing or being informed of cyber threats and their sources, while simultaneously paying at- tention to ensuring the basic rights of privacy and confidentiality in electronic com- munications"
170,Finland_2013_s_Cyber_Security_Strategy.pdf,12, Most of the critical infrastructure in society is in private business ownership
171,Finland_2013_s_Cyber_Security_Strategy.pdf,12," Cyber know-how and expertise as well as services and defences are, for the most part provided by companies"
172,Finland_2013_s_Cyber_Security_Strategy.pdf,12, National cyber security legislation must provide a favourable environment for the development of business activities
173,Finland_2013_s_Cyber_Security_Strategy.pdf,12," This would, for its part, enable the creation of an internationally recognised, competitive and export-capable cyber security cluster"
174,Finland_2013_s_Cyber_Security_Strategy.pdf,12," At the same time, Finland would become an appealing and cyber secure environment worthy of business investments and companies, operations"
175,Finland_2013_s_Cyber_Security_Strategy.pdf,12," Assign cyber security, related tasks, service models and common cyber security management standards to the authorities and actors in the business community"
176,Finland_2013_s_Cyber_Security_Strategy.pdf,12, The development of cyber security requires the clear allocation of responsibilities and tasks in accordance with the strategic guidelines
177,Finland_2013_s_Cyber_Security_Strategy.pdf,12," In practice, this presuppos- es that each administrative branch make its risk assessment and maturity analysis which help identify any significant vulnerabilities and risks from the standpoint of cyber security and the level of their management"
178,Finland_2013_s_Cyber_Security_Strategy.pdf,12,", The results will be used in pre- paring action plans for each administrative Sector and together with the security of supply-organisation, support the drafting of action plans for the business com- munity "
179,Finland_2013_s_Cyber_Security_Strategy.pdf,12,"Finlands CYBER SECURITY STRATEGY, "
180,Finland_2013_s_Cyber_Security_Strategy.pdf,13,"10, The implementation of the Strategy and its completion will be monitored"
181,Finland_2013_s_Cyber_Security_Strategy.pdf,13," Ministries and agencies are responsible for implementing the Strategy within their respective administrative branches, carrying out the tasks related to cyber secu- rity and implementing and developing the security of supply"
182,Finland_2013_s_Cyber_Security_Strategy.pdf,13, The future Securi- ty Committee monitors and coordinates the implementation of the Strategy
183,Finland_2013_s_Cyber_Security_Strategy.pdf,13, The goals of cyber security coordination include the avoidance of unnecessary duplica- tion identification of possible shortcomings and determining the competent enti- ties
184,Finland_2013_s_Cyber_Security_Strategy.pdf,13, The competent authorities will make the actual decisions subject to the pro- visions
185,Finland_2013_s_Cyber_Security_Strategy.pdf,13," The Government Information Security Management Board, (, VAHTI ), will process and coordinate the central governments"
186,Finland_2013_s_Cyber_Security_Strategy.pdf,13," Key information, security and cy- ber security, guidelines"
187,Finland_2013_s_Cyber_Security_Strategy.pdf,13," Ministries, agencies and establishments are to include the resources for the implementation of the Cyber Security Strategy in their operating and financial plans"
188,Finland_2013_s_Cyber_Security_Strategy.pdf,13, The security of society 
189,Finland_2013_s_Cyber_Security_Strategy.pdf,13,"Finlands CYBER SECURITY STRATEGY, "
190,Finland_2013_s_Cyber_Security_Strategy.pdf,14,"Cyber domain cyber environment, "
191,Finland_2013_s_Cyber_Security_Strategy.pdf,14,"Definition, Information infrastructure means the structures and functions behind information systems that electronically transmit transfer, receive, store or otherwise process"
192,Finland_2013_s_Cyber_Security_Strategy.pdf,14," Information ( data, ), Critical information infrastructure refers to the structures and func- tions behind the information systems of the vital functions of socie- ty, which electronically transmit transfer receive, store or otherwise, process information"
193,Finland_2013_s_Cyber_Security_Strategy.pdf,14, ( data ) Critical infrastructure refers to the structures and functions which are indispensable for the vital functions of society
194,Finland_2013_s_Cyber_Security_Strategy.pdf,14," They comprise physi- cal facilities and structures, as well as electronic functions and services"
195,Finland_2013_s_Cyber_Security_Strategy.pdf,14, The word cyber is almost invariably the prefix for a term or the modi- fier of a compound word rather than a stand-alone word
196,Finland_2013_s_Cyber_Security_Strategy.pdf,14," Its inference usually relates to electronic information, ( data, ) processing, informa- tion technology, electronic communications, ( data transfer, ) or infor- mation and computer systems"
197,Finland_2013_s_Cyber_Security_Strategy.pdf,14, Only the complete term of the com- pound word ( modifier+head ) itself can be considered to possess actual meaning
198,Finland_2013_s_Cyber_Security_Strategy.pdf,14, The word cyber is generally believed to originate from the Ancient Greek verb
199,Finland_2013_s_Cyber_Security_Strategy.pdf,14," ( kybereo ), to steer to guide to control"
200,Finland_2013_s_Cyber_Security_Strategy.pdf,14," Cyber risk means the possibility of an accident or vulnerability in the cyber domain which, if it materialises or is being utilised, can damage harm or disturb an operation that depends on the functioning of the cyber domain"
201,Finland_2013_s_Cyber_Security_Strategy.pdf,14," Cyber domain means an electronic information, ( data, ) processing, do- main comprising of one or several information technology"
202,Finland_2013_s_Cyber_Security_Strategy.pdf,14,", Note 1 Representative to the environment, is the utilisation of electronics and the electromagnetic spectrum for the purpose of storing processing and transferring data and information via telecommunications"
203,Finland_2013_s_Cyber_Security_Strategy.pdf,14," Note 2 Information, ( data, ) processing means collecting saving organising using transferring disclosing, storing modifying combining pro-, tecting, removing destroying and other similar actions on informa- tion ( data ) "
204,Finland_2013_s_Cyber_Security_Strategy.pdf,14,"Finlands CYBER SECURITY STRATEGY, "
205,Finland_2013_s_Cyber_Security_Strategy.pdf,15,"Information ( data, ) security, "
206,Finland_2013_s_Cyber_Security_Strategy.pdf,15,"Definition, Cyber security means the desired end state in which the cyber domain is reliable and in which its functioning is ensured"
207,Finland_2013_s_Cyber_Security_Strategy.pdf,15, In the desired end state the cyber domain will not jeopardise harm or disturb the operation of functions dependent on electronic informa- tion ( data ) processing
208,Finland_2013_s_Cyber_Security_Strategy.pdf,15, Note 2 Reliance on the cyber domain depends on its actors: implementing ap- propriate and sufficient information security procedures
209,Finland_2013_s_Cyber_Security_Strategy.pdf,15," ( communal data security ): These procedures can prevent the materialisation of cy- ber threats and should they still materialise, prevent mitigate or help tolerate their consequences"
210,Finland_2013_s_Cyber_Security_Strategy.pdf,15," Cyber security encompasses the measures on the functions vital to so- ciety and the critical infrastructure which aim to achieve the capability of predictive management and, if necessary, tolerance of cyber threats and their effects, which can cause significant harm or danger to Fin- land or its population"
211,Finland_2013_s_Cyber_Security_Strategy.pdf,15," Cyber threat means the possibility of action or an incident in the cy- ber domain, which, when materialised, jeopardises some operation de- pendent"
212,Finland_2013_s_Cyber_Security_Strategy.pdf,15, On the cyber world
213,Finland_2013_s_Cyber_Security_Strategy.pdf,15," Note, Cyber threats are information, threats which, when materialised, jeop- ardise the correct or intended functioning of the information system"
214,Finland_2013_s_Cyber_Security_Strategy.pdf,15," Information system means the system comprising the personnel, in- formation, processing, equipment, data transfer equipment and soft- ware programs intended to make some operation more Efficient, easier or even possible by means of information, ( data, ), processing"
215,Finland_2013_s_Cyber_Security_Strategy.pdf,15, Protection of privacy means the protection against the unlawful or hurtful invasion of personal privacy
216,Finland_2013_s_Cyber_Security_Strategy.pdf,15, Protection of privacy includes the right to privacy and other associated rights in the processing of per- sonal data
217,Finland_2013_s_Cyber_Security_Strategy.pdf,15, Personal data means any information on a private individu- al and any information on his/her personal characteristics or personal circumstances where these are identifiable
218,Finland_2013_s_Cyber_Security_Strategy.pdf,15, As concerning him/her or the members of his/her family or household
219,Finland_2013_s_Cyber_Security_Strategy.pdf,15," Information, security means the administrative and technical measures taken to ensure the availability, integrity and confidentiality of data"
220,Finland_2013_s_Cyber_Security_Strategy.pdf,15, Cabinet Committee on Foreign and Security Policy
221,Finland_2013_s_Cyber_Security_Strategy.pdf,15,", Government Information, Security Management, Board"
222,Finland_2013_s_Cyber_Security_Strategy.pdf,15, The Security Strategy for Society Government Resolution 16
223,Finland_2013_s_Cyber_Security_Strategy.pdf,15, Decem- ber 2010 FINLANDS CYBER SECURITY STRATEGY
224,Finland_2013_s_Cyber_Security_Strategy.pdf,16,"Finlands CYBER SECURITY STRATEGY, "
225,Finland_2013_s_Cyber_Security_Strategy.pdf,17,"Finlands CYBER SECURITY, STRATEGY: "
226,Finland_2013_s_Cyber_Security_Strategy.pdf,17,"The Background Dossier of the Security Committee FINLANDS CYBER SECURITY STRATEGY BACKGROUND DOSSIER, "
227,Finland_2013_s_Cyber_Security_Strategy.pdf,18, TABLE OF CONTENTS FOR THE BACKGROUND DOSSIER
228,Finland_2013_s_Cyber_Security_Strategy.pdf,18,Cyber DOMAIN AND CYBER THREAT 
229,Finland_2013_s_Cyber_Security_Strategy.pdf,18,"Principles OF CYBER SECURITY MANAGEMENT AND THE MANAGEMENT OF DISRUPTIONS, "
230,Finland_2013_s_Cyber_Security_Strategy.pdf,18,"1 Basic principles of cyber security management, 2 Management of disturbances, endangering society, SECURING THE VITAL FUNCTIONS OF SOCIETY AGAINST CYBER THREATS"
231,Finland_2013_s_Cyber_Security_Strategy.pdf,18,"1, Cyber situation, awareness and setting up the Cyber Security Centre 2, Guaranteeing the preconditions of the business community security of supply"
232,Finland_2013_s_Cyber_Security_Strategy.pdf,18,"4, Cyber defence capability "
233,Finland_2013_s_Cyber_Security_Strategy.pdf,18,Improving research and competence exercises 
234,Finland_2013_s_Cyber_Security_Strategy.pdf,18,International and national cyber security regulation 
235,Finland_2013_s_Cyber_Security_Strategy.pdf,18,Implementation OF THE CYBER SECURITY STRATEGY - 
236,Finland_2013_s_Cyber_Security_Strategy.pdf,18,Principles of implementing the Strategy - 
237,Finland_2013_s_Cyber_Security_Strategy.pdf,18,4 Action Plan and assessing effectiveness APPENDIX 
238,Finland_2013_s_Cyber_Security_Strategy.pdf,19,This background dossier is a part of the process for adopting Finlands Cyber Security Strategy
239,Finland_2013_s_Cyber_Security_Strategy.pdf,19, The key purpose of this document is to increase the understanding of cyber se- curity actors of the cyber domain and consequently help them improve their cyber se- curity
240,Finland_2013_s_Cyber_Security_Strategy.pdf,19," The background dossier expands the Strategy and explains in further detail the national cyber security approach, the cyber domain and the threat scenario that deter- mines our preparedness"
241,Finland_2013_s_Cyber_Security_Strategy.pdf,19," The document elaborates on the measures required by the stra- tegic guidelines, as well as national and international cyber security regulation"
242,Finland_2013_s_Cyber_Security_Strategy.pdf,19, The prin- ciples for drafting the action plans for different administrative branches and other actors are presented at the end of this document
243,Finland_2013_s_Cyber_Security_Strategy.pdf,19, Cyber DOMAIN AND CYBER THREAT
244,Finland_2013_s_Cyber_Security_Strategy.pdf,19,"The global cyber domain consist of an elaborate and multi-layered worldwide informa- tion network, which comprises ICT networks that are operated by national security, au- thorities, other public authorities, the business community monitoring and control sys- tems of the industry and critical infrastructure"
245,Finland_2013_s_Cyber_Security_Strategy.pdf,19,", The increasingly high-speed global cyber domain Is bringing states, businesses and citizens ever closer together"
246,Finland_2013_s_Cyber_Security_Strategy.pdf,19,", While this devel- opment has significantly fostered well-being, it has also introduced an entirely new set of risks"
247,Finland_2013_s_Cyber_Security_Strategy.pdf,19, When IT equipment and systems are down the ICT infrastructure crashes or seri- ous cyber attacks occur
248,Finland_2013_s_Cyber_Security_Strategy.pdf,19," These can result in extremely negative impacts on public servic- es business, life and administration and consequently, the viability of society as a whole"
249,Finland_2013_s_Cyber_Security_Strategy.pdf,19," Cyber attacks can seriously disrupt or even paralyse segments of critical infrastruc-, ture and societys vital functions"
250,Finland_2013_s_Cyber_Security_Strategy.pdf,19, The state or an organisation can be forced to make po- litical military or financial concessions
251,Finland_2013_s_Cyber_Security_Strategy.pdf,19," The great powers equate cyber attacks with mili- tary action, which can be met with any available means"
252,Finland_2013_s_Cyber_Security_Strategy.pdf,19," Thus far, cyber operations have been interpreted as soft measures, for which reason the threshold for using them is estimated to be below that of traditional military oper- ations"
253,Finland_2013_s_Cyber_Security_Strategy.pdf,19, The increasing cyber activism cybercrime and cyber espionage denote growing activity among states and non-state actors
254,Finland_2013_s_Cyber_Security_Strategy.pdf,19," Consequently, the cyber domain has trans- formed the traditional power structure, providing even small states and non-state actors with an opportunity to have effectual action"
255,Finland_2013_s_Cyber_Security_Strategy.pdf,19, It is no longer size and mass that matter
256,Finland_2013_s_Cyber_Security_Strategy.pdf,19," Rather, it is expertise"
257,Finland_2013_s_Cyber_Security_Strategy.pdf,19, The previously described developments in the cyber domain also impact Finland
258,Finland_2013_s_Cyber_Security_Strategy.pdf,19, Finland is one of the most developed information societies whose functioning relies on various electronic networks and services
259,Finland_2013_s_Cyber_Security_Strategy.pdf,19," Finland has already been the target of cyber operations, where the focus was on cyber activism, cybercrime and cyber espionage"
260,Finland_2013_s_Cyber_Security_Strategy.pdf,19, The international development in cyberspace increases the possibilities of new threats being FINLANDS
261,Finland_2013_s_Cyber_Security_Strategy.pdf,19," Cyber SECURITY STRATEGY BACKGROUND DOSSIER, "
262,Finland_2013_s_Cyber_Security_Strategy.pdf,20,", The public administration and the business community are continually being targeted by crackers and hackers attempting to exploit system vulnerabilities"
263,Finland_2013_s_Cyber_Security_Strategy.pdf,20, That the targets are carefully selected and studied only serves as an indication of the profes- sionalism of the attacks
264,Finland_2013_s_Cyber_Security_Strategy.pdf,20, Sophisticated malware and techniques are increasingly used in these attacks By exploiting system vulnerabilities
265,Finland_2013_s_Cyber_Security_Strategy.pdf,20, The openness of the cyber domain makes it pos- sible to carry out attacks from all over the world
266,Finland_2013_s_Cyber_Security_Strategy.pdf,20," Such vulnerabilities exist in human ac-, tion organisational processes and the ICT technology being used"
267,Finland_2013_s_Cyber_Security_Strategy.pdf,20, It is very difficult to protect oneself against complex and sophisticated malware and to identify or locate the perpetrators
268,Finland_2013_s_Cyber_Security_Strategy.pdf,20," The increasing proliferation of information technology in industrial, pro-, duction and control systems has created new vulnerabilities and possible targets for cy- ber attacks"
269,Finland_2013_s_Cyber_Security_Strategy.pdf,20," Cyber security entered a new era in 2010, when the Stuxnet worm was discovered"
270,Finland_2013_s_Cyber_Security_Strategy.pdf,20," It was used to carry out an attack against Irans nuclear plants, Stuxnet damaged, Irans, ura-, nium enrichment, centrifuges holding back its enrichment project for years"
271,Finland_2013_s_Cyber_Security_Strategy.pdf,20,", Expert skills and considerable resources were needed to write"
272,Finland_2013_s_Cyber_Security_Strategy.pdf,20, This malware demon- strated that cyber tools can also inflict physical damage on electronic equipment and sys- tems
273,Finland_2013_s_Cyber_Security_Strategy.pdf,20," In this new phase, industrial automation and programmable logic controllers are ever more often the first targets of cyber attacks when, in fact, the ultimate objective is to impact societys, vital functions"
274,Finland_2013_s_Cyber_Security_Strategy.pdf,20," The cyber threat scenario means a description of disruptions caused by cyber threats and their mechanism, source target and impacts on the target"
275,Finland_2013_s_Cyber_Security_Strategy.pdf,20," The threats can directly or indirectly impact societys, vital functions, critical infrastructure, and/or citizens from within or outside national borders"
276,Finland_2013_s_Cyber_Security_Strategy.pdf,20," Cyber threats included in the cyber threat scenario, are Cyber activism, ( cyber vandalism, hactivism ) Cybercrime, Cyber espionage, Cyberterrorism, Cyber operations, pressure, Low Intensity, Conflict, (, LIC ), or cyber warfare"
277,Finland_2013_s_Cyber_Security_Strategy.pdf,21,"Finlands CYBER SECURITY STRATEGY, BACKGROUND DOSSIER, "
278,Finland_2013_s_Cyber_Security_Strategy.pdf,21,"FIGURE 1 Finlands cyber threat scenario, Threats to societys, vital functions and critical infrastructure can emerge independently, concurrently or as a sequential continuum"
279,Finland_2013_s_Cyber_Security_Strategy.pdf,21,", Whereas their escalation varies in speed and endurance"
280,Finland_2013_s_Cyber_Security_Strategy.pdf,21," More often than not, they make their impact in a short period of time"
281,Finland_2013_s_Cyber_Security_Strategy.pdf,21," Due to the nature of the cyber domain, it is difficult to predict the causes of threats, the actors be- hind them their exact targets, goals and scope, or the consequences of their effects"
282,Finland_2013_s_Cyber_Security_Strategy.pdf,21, Er risks can also be associated with cyber threats
283,Finland_2013_s_Cyber_Security_Strategy.pdf,21," Terrorist strikes, causing physical destruction can also incorporate various cyber operations, PRINCIPLES OF CYBER SECURITY MANAGEMENT AND THE MANAGEMENT OF DISRUPTIONS"
284,Finland_2013_s_Cyber_Security_Strategy.pdf,21,1 Basic principles of cyber security management
285,Finland_2013_s_Cyber_Security_Strategy.pdf,21, The Government comprises the highest level of cyber security management
286,Finland_2013_s_Cyber_Security_Strategy.pdf,21, The Prime Minister leads the Government and is responsible for preparing and coordinating the han- dling of the matters that are the purview of the Government
287,Finland_2013_s_Cyber_Security_Strategy.pdf,21, Preliminary deliberation and coordination occurs in ministerial working groups led by the Prime Minister and as re- quired the Governments evening session and Negotiations
288,Finland_2013_s_Cyber_Security_Strategy.pdf,21,", The Government is responsible for providing political guidance and strategic guidelines for cyber security, as well as for tak- ing the required decisions regarding the prerequisites and resources allocated to it"
289,Finland_2013_s_Cyber_Security_Strategy.pdf,21," In line with the basic principles of the Security Strategy for Society, the competent authorities are responsible for disturbance, management and associated contingency planning"
290,Finland_2013_s_Cyber_Security_Strategy.pdf,21," Each ministry sees to the legislative process within its administrative domain guides the action within its branch and when necessary, participates in intersectoral co- FINLANDS"
291,Finland_2013_s_Cyber_Security_Strategy.pdf,21," Cyber SECURITY STRATEGY BACKGROUND DOSSIER, "
292,Finland_2013_s_Cyber_Security_Strategy.pdf,22,", The Cyber Security Strategy does not change the tasks defined in the Security Strategy for Society, pursuant to which the Ministry of Transport and Communications is responsible for safeguarding the functioning of electronic ICT systems and the Ministry of Finance is responsible for safeguarding the state administrations"
