,Document,Page,Sentence
293,Finland_2013_s_Cyber_Security_Strategy.pdf,22, It functions and in- formation security and the service systems common to the central government
294,Finland_2013_s_Cyber_Security_Strategy.pdf,22," The future Security Committee coordinates cyber security preparedness monitors, the implementation of the Cyber Security Strategy and issues recommendations"
295,Finland_2013_s_Cyber_Security_Strategy.pdf,22, On its further development
296,Finland_2013_s_Cyber_Security_Strategy.pdf,22,", The Security Committee closely cooperates with other collabora- tive bodies that coordinate cyber security-related issues as part of their duties"
297,Finland_2013_s_Cyber_Security_Strategy.pdf,22, The future Cyber Security Centre supports and assists cyber security actors within the scope of its tasking
298,Finland_2013_s_Cyber_Security_Strategy.pdf,22," The Government Information Security Management Board, ( VAHTI ), supports the Government and the Ministry of Finance in administrative data, security-related de- cision-making"
299,Finland_2013_s_Cyber_Security_Strategy.pdf,22, VAHTI processes and coordinates all of the central governments
300,Finland_2013_s_Cyber_Security_Strategy.pdf,22, Impor- tant matters that relate to data security and cyber security
301,Finland_2013_s_Cyber_Security_Strategy.pdf,22, The effectiveness of disturbance management will be measured by the successfulness of the pre-emptive measures
302,Finland_2013_s_Cyber_Security_Strategy.pdf,22, Cyber security arrangements in normal conditions will make or break the outcome of cyber incidents in emergency conditions
303,Finland_2013_s_Cyber_Security_Strategy.pdf,22," All administra- tive branches, as well as organisations and companies critical to security of supply, are re- quired to make contingency plans against cyber threats"
304,Finland_2013_s_Cyber_Security_Strategy.pdf,22," Companies are to include cyber preparedness in their normal continuity management planning, FIGURE 2"
305,Finland_2013_s_Cyber_Security_Strategy.pdf,22, Principles of cyber security management
306,Finland_2013_s_Cyber_Security_Strategy.pdf,23,"Finlands CYBER SECURITY STRATEGY BACKGROUND DOSSIER, "
307,Finland_2013_s_Cyber_Security_Strategy.pdf,23,The prevention of cyber threats calls for proper planning and forecasting
308,Finland_2013_s_Cyber_Security_Strategy.pdf,23," This being the case, our new operating environment demands strong expertise as well as swift, appropri-, ate and consistent reaction from all parties, in other words, strategic agility"
309,Finland_2013_s_Cyber_Security_Strategy.pdf,23," Cyber securi- ty management embodies all three factors of strategic agility, strategic sensitivity, collec- tive commitment and resource fluidity"
310,Finland_2013_s_Cyber_Security_Strategy.pdf,23," Strategic sensitivity entails the capability to rapidly compile a situation, picture and es- tablish situation"
311,Finland_2013_s_Cyber_Security_Strategy.pdf,23," The commitment of the leadership requires integrated situa-, tion awareness, coordinated and networked management, and the optimisation of collec- tive benefits"
312,Finland_2013_s_Cyber_Security_Strategy.pdf,23, The flexible use of resources demands sufficient cyber expertise and the ability to rapidly implement countermeasures and allocate financial resources
313,Finland_2013_s_Cyber_Security_Strategy.pdf,23, The cyber domain must get rid of partial optimisation and rigidity caused by silo structures in management
314,Finland_2013_s_Cyber_Security_Strategy.pdf,23," The conclusion is that the speed with which the cyber domain is changing, including its complexity, ( FIG 3 ), requires a new kind of networked approach that relies on strong coordination and common rules"
315,Finland_2013_s_Cyber_Security_Strategy.pdf,23, The action must be able to combine the benefits of cen- tralisation and decentralisation i
316,Finland_2013_s_Cyber_Security_Strategy.pdf,23, strong coordination and quick reaction that emerges from local ownership
317,Finland_2013_s_Cyber_Security_Strategy.pdf,23," Finland, generally speaking, has excellent chances of becoming a global forerunner of cyber security and the novel approach it entails"
318,Finland_2013_s_Cyber_Security_Strategy.pdf,23," Our undisputed fortes include strong competence, a tradition of both intersectoral and public-private cooperation, as well as well-defined processes and division of duties between different actors"
319,Finland_2013_s_Cyber_Security_Strategy.pdf,23," ( see the Security Strategy for Society, ) FIGURE, 3"
320,Finland_2013_s_Cyber_Security_Strategy.pdf,23,"Finlands CYBER SECURITY STRATEGY BACKGROUND DOSSIER, "
321,Finland_2013_s_Cyber_Security_Strategy.pdf,24,"2 Management of disturbances, endangering society As the vulnerability of society increases, it is necessary to be able to rapidly start managing sudden disturbances in the cyber domain"
322,Finland_2013_s_Cyber_Security_Strategy.pdf,24," Cyber incidents, typical- ly, have wide-ranging impacts"
323,Finland_2013_s_Cyber_Security_Strategy.pdf,24," Therefore, it is necessary to provide the broadest possible intersectoral support to the competent authorities when required"
324,Finland_2013_s_Cyber_Security_Strategy.pdf,24,", Concurrently, in spite of the disturbances, the viability of society must be secured in an appropriate manner"
325,Finland_2013_s_Cyber_Security_Strategy.pdf,24, Cyber incident management will follow the rule of law and the existing division of duties
326,Finland_2013_s_Cyber_Security_Strategy.pdf,24, The same cyber incident management principles that are used in normal condi- tions will be applied in emergency conditions
327,Finland_2013_s_Cyber_Security_Strategy.pdf,24," The authorities, division of duties and the modi operandi of the cooperation bodies will remain as they are in normal conditions"
328,Finland_2013_s_Cyber_Security_Strategy.pdf,24, Management will be proactive and the needed resources will be brought on- line at once
329,Finland_2013_s_Cyber_Security_Strategy.pdf,24, The competent authority is in charge of operations supported by intersecto- ral cooperation
330,Finland_2013_s_Cyber_Security_Strategy.pdf,24,", The competent authority is also responsible for communications"
331,Finland_2013_s_Cyber_Security_Strategy.pdf,24, Businesses and organisations will participate in the management of the situation as required
332,Finland_2013_s_Cyber_Security_Strategy.pdf,24,", Along with operational activity in situation management"
333,Finland_2013_s_Cyber_Security_Strategy.pdf,24, It is essential to ensure the flow of communication and provide sufficient information to the state leadership
334,Finland_2013_s_Cyber_Security_Strategy.pdf,24, Disturbance management will be organised and implemented in accordance with the Security Strategy for Society
335,Finland_2013_s_Cyber_Security_Strategy.pdf,24," In line with the Strategy, the competent authority launches the action needed in managing the disturbance informs the other authorities and actors as appropriate and brings in the other actors needed for situation management"
336,Finland_2013_s_Cyber_Security_Strategy.pdf,24," Cyber incident management encompasses four elements: contingency planning, compilation of a situation, picture countermeasures and recovery; "
337,Finland_2013_s_Cyber_Security_Strategy.pdf,25,Finlands CYBER SECURITY STRATEGY BACKGROUND DOSSIER 
338,Finland_2013_s_Cyber_Security_Strategy.pdf,25, SECURING THE VITAL FUNCTIONS OF SOCIETY AGAINST CYBER THREATS; 
339,Finland_2013_s_Cyber_Security_Strategy.pdf,25,"1, Cyber situation, awareness and setting up the Cyber Security Centre"
340,Finland_2013_s_Cyber_Security_Strategy.pdf,25,"Improve comprehensive cyber security situation, awareness among the key actors that participate in securing the vital functions of society"
341,Finland_2013_s_Cyber_Security_Strategy.pdf,25," Establish a Cyber Security Centre, supported by a cooperative network of actors"
342,Finland_2013_s_Cyber_Security_Strategy.pdf,25, The decision-making process of the state leadership and the authorities requires suffi- cient situation
343,Finland_2013_s_Cyber_Security_Strategy.pdf,25,", The various actors need to have a reliable real-time cyber se- curity situation, picture on the state of societys, vital functions and the disturbances that are affecting them"
344,Finland_2013_s_Cyber_Security_Strategy.pdf,25, The real-time cyber security situation picture does not only com- prise information from technical monitoring and control
345,Finland_2013_s_Cyber_Security_Strategy.pdf,25," It also includes an analysis that amalgamates observations, intelligence, other information gathering and previous les- sons-learned"
346,Finland_2013_s_Cyber_Security_Strategy.pdf,25," The national Cyber Security Centre will be set up to serve the authorities, the business community and other actors in maintaining and developing cyber security"
347,Finland_2013_s_Cyber_Security_Strategy.pdf,25, The Centres arrangements and services will be implemented
348,Finland_2013_s_Cyber_Security_Strategy.pdf,25, As part of the integrated cyber security strategy action plan
349,Finland_2013_s_Cyber_Security_Strategy.pdf,25,", The primary service of the Centre will entail the compilation, main-, tenance and dissemination of the situation picture in close cooperation with its support"
350,Finland_2013_s_Cyber_Security_Strategy.pdf,25,", The Cyber Security Centre will be founded by merging the functions of the present CERT-FI and the planned GOV-CERT, and by earmarking the needed addition- al resources for its operation"
351,Finland_2013_s_Cyber_Security_Strategy.pdf,25," The Centre will be supported by a functional network that encompasses all pertinent authorities, businesses and other separately designated actors tasked to prepare and respond to cyber security violations, As the Cyber Security Centre is being established"
352,Finland_2013_s_Cyber_Security_Strategy.pdf,25, Other parallel projects will be tak- en into consideration in order to streamline and improve situation picture arrangements
353,Finland_2013_s_Cyber_Security_Strategy.pdf,25, The Government Resolution on Enhancing Information Security in Central Government provides guidelines for 24/7 ICT security arrangements in the central government
354,Finland_2013_s_Cyber_Security_Strategy.pdf,25, The planning and implementation of this function will be coordinated with the operations of the Cyber Security Centre
355,Finland_2013_s_Cyber_Security_Strategy.pdf,25," Furthermore, when it comes to the compilation of the situ- ation picture, the central governments joint ICT projects, such as the security network, ( TUVE ) venture, will be taken into consideration"
356,Finland_2013_s_Cyber_Security_Strategy.pdf,25," Finlands CYBER SECURITY STRATEGY BACKGROUND DOSSIER, "
357,Finland_2013_s_Cyber_Security_Strategy.pdf,26,The Cyber Security Centre will 1
358,Finland_2013_s_Cyber_Security_Strategy.pdf,26, Compile and disseminate the cyber security situation
359,Finland_2013_s_Cyber_Security_Strategy.pdf,26, Compile and maintain a cyber threat risk analysis in conjunction with different administrative branches and actors
360,Finland_2013_s_Cyber_Security_Strategy.pdf,26,"Support the competent authorities and actors in the private sector in the management of widespread cyber incidents, Intensify cooperation and support the development of expertise"
361,Finland_2013_s_Cyber_Security_Strategy.pdf,26,"The most important service of the Cyber Security Centre is to compile, maintain and distribute the cyber security situation picture to those who need it"
362,Finland_2013_s_Cyber_Security_Strategy.pdf,26, The compilation of the situation picture requires the ability to collect and analyse relevant information and to meet the information requirements of different actors
363,Finland_2013_s_Cyber_Security_Strategy.pdf,26," The integrated situation, pic- ture, compiled by the Cyber Security Centre and its support network, comprises a tech- nical situation picture and an evaluation of the total consequences of the cyber security violations to the vital functions of society"
364,Finland_2013_s_Cyber_Security_Strategy.pdf,26, The Cyber Security Centre and different ac- tors will determine their respective information requirements
365,Finland_2013_s_Cyber_Security_Strategy.pdf,26," The information on vul- nerabilities provided to network administrators will become more automatic, whereas the content of the situation picture intended for the authorities and decision-makers will be developed more towards being an analysis of the consequences of the effects on societys vital functions"
366,Finland_2013_s_Cyber_Security_Strategy.pdf,26, Cyber incident damage control is the responsibility of the authorities and businesses that the disturbance concerns
367,Finland_2013_s_Cyber_Security_Strategy.pdf,26,", The Cyber Security Centre can support the lead, author- ity in managing widespread cyber incidents that concurrently impact many authorities or businesses"
368,Finland_2013_s_Cyber_Security_Strategy.pdf,26, The Cyber Security Centre generates an overall cyber security situation
369,Finland_2013_s_Cyber_Security_Strategy.pdf,26, As- sessment built on its integrated cyber security situation picture
370,Finland_2013_s_Cyber_Security_Strategy.pdf,26," The purpose of such a briefing is to support the administrative branches in their cyber preparedness, arrange-, ments and contingency planning"
371,Finland_2013_s_Cyber_Security_Strategy.pdf,26," The Cyber Security Centre, monitors and analyses cyber threats and, together with its international partners, generates forecasts on their consequences to Finland"
372,Finland_2013_s_Cyber_Security_Strategy.pdf,26," In accord- ance, with its monitoring activities, the threat scenarios of the Security Strategy for Soci- ety, the cyber threat scenario and real-time national intelligence information"
373,Finland_2013_s_Cyber_Security_Strategy.pdf,26," The Cyber Security Centre alerts, businesses and authorities critical to the vital functions of society concerning new cyber threats to Finland and increased cyber threat levels and upon re- quest, assists them in contingency planning"
374,Finland_2013_s_Cyber_Security_Strategy.pdf,26," The Government Situation Centre, ( GOVSITCEN ) compiles the situation picture for the state"
375,Finland_2013_s_Cyber_Security_Strategy.pdf,26," Close cooperation between the GOVSITCEN and the Cyber Securi- ty Centre improves intersectoral, monitoring and analysis capabilities on which the inte- grated situation picture relies"
376,Finland_2013_s_Cyber_Security_Strategy.pdf,26, Awareness makes it possible to appro- priately respond to threats at political and operational levels
377,Finland_2013_s_Cyber_Security_Strategy.pdf,27,"Finlands CYBER SECURITY STRATEGY, BACKGROUND DOSSIER, "
378,Finland_2013_s_Cyber_Security_Strategy.pdf,27,The Ministry of Transport and Communications is responsible for the performance guidance of the Cyber Security Centre
379,Finland_2013_s_Cyber_Security_Strategy.pdf,27," In order to guarantee the performance guidance, a separate cyber security working group will be established"
380,Finland_2013_s_Cyber_Security_Strategy.pdf,27, The participants of the group will include all service providers
381,Finland_2013_s_Cyber_Security_Strategy.pdf,27, Users and facilitators of the Cyber Security Centre
382,Finland_2013_s_Cyber_Security_Strategy.pdf,27,", The members of the working group, must be experts in their respective fields, with extensive knowledge of their organisations, preparedness and of the state and requirements of their cyber security situation"
383,Finland_2013_s_Cyber_Security_Strategy.pdf,27," 2, Guaranteeing the preconditions of the business community security of supply"
384,Finland_2013_s_Cyber_Security_Strategy.pdf,27,Maintain and improve the abilities of businesses and organisations critical to the vital functions of society as regards detecting and repelling cyber threats and disturbances that jeopardise any vital function and their recovery capabilities as part of the business communitys continuity management
385,Finland_2013_s_Cyber_Security_Strategy.pdf,27," The goal is to guarantee also during ongoing cyber incidents, the continued operations of businesses that are vital to society"
386,Finland_2013_s_Cyber_Security_Strategy.pdf,27, Continuity management planning in the business community will be supported when it can have impact on vital functions and the creation of a safe cyber domain
387,Finland_2013_s_Cyber_Security_Strategy.pdf,27, The security of supply organisation plays a central role in securing the conditions of the business community
388,Finland_2013_s_Cyber_Security_Strategy.pdf,27," Contingency planning will ensure the func- tioning of infrastructure, crucial to the viability of society and the continuation of critical production capabilities in all situations"
389,Finland_2013_s_Cyber_Security_Strategy.pdf,27, Societys critical production processes are increasingly dependent on automation
390,Finland_2013_s_Cyber_Security_Strategy.pdf,27, The development cycles of automation systems are long and they are associated with rapidly developing IT solutions
391,Finland_2013_s_Cyber_Security_Strategy.pdf,27," When it comes to continuity management in critical, infrastruc- ture data protection arrangements in automation"
392,Finland_2013_s_Cyber_Security_Strategy.pdf,27, Systems must also be addressed
393,Finland_2013_s_Cyber_Security_Strategy.pdf,27, The connections between equipment in the physical world and networks must be designed in such a manner that no simple cyber attack can bring a plant or unit down
394,Finland_2013_s_Cyber_Security_Strategy.pdf,27, Regarding so- cietys vital functions
395,Finland_2013_s_Cyber_Security_Strategy.pdf,27," It is imperative to minimise the vulnerabilities of automation, sys- tems, such as building automation, remote operations and remote reading"
396,Finland_2013_s_Cyber_Security_Strategy.pdf,27," Most of the modern critical infrastructure, including services, is owned and gener- ated by the private sector"
397,Finland_2013_s_Cyber_Security_Strategy.pdf,27," The prerequisites companies need to see to the continuation of their business operations during cyber threat situations is being improved, thereby in- creasing confidence in the continued supply of their products"
398,Finland_2013_s_Cyber_Security_Strategy.pdf,27, The security of supply organisation is a network which maintains and develops the security of supply in Finland
399,Finland_2013_s_Cyber_Security_Strategy.pdf,27," As a public-private, partnership"
400,Finland_2013_s_Cyber_Security_Strategy.pdf,27,", Security of supply is built on a well-functioning market and a competitive economy"
401,Finland_2013_s_Cyber_Security_Strategy.pdf,27, Societys economic and tech- nological basic functions are being prepared so that they can be sustained by various se- FINLANDS
402,Finland_2013_s_Cyber_Security_Strategy.pdf,27," Cyber SECURITY STRATEGY BACKGROUND DOSSIER, "
403,Finland_2013_s_Cyber_Security_Strategy.pdf,28,"Curity of supply-measures that supplement free enterprise during different disturbances and emergency conditions, Measures that support the continuity of businesses, critical to Finlands security of supply will be outlined and carried out as part of the Government Decision on Safe- guarding the Security of Supply, including its implementation"
404,Finland_2013_s_Cyber_Security_Strategy.pdf,28," An individual organisa- tion normally implements cyber preparedness through the traditional means, methods and structures of information"
405,Finland_2013_s_Cyber_Security_Strategy.pdf,28," Companies should be better prepared to evalu- ate the risks and consequences of cyber attacks, as well as the required action"
406,Finland_2013_s_Cyber_Security_Strategy.pdf,28, The capa- bility for conducting analyses and assessments of various functional chains and networks will be improved and awareness of network operations and security of supply will be in- creased
407,Finland_2013_s_Cyber_Security_Strategy.pdf,28, Cyber defence requires that actors operate under identical or compatible protec- tion practices
408,Finland_2013_s_Cyber_Security_Strategy.pdf,28," The security of supply organisation, provides instruments to critical busi- nesses, which make it easier for them to carry out risk assessments and develop their continuity management"
409,Finland_2013_s_Cyber_Security_Strategy.pdf,28, By virtue of its good cyber security situation
410,Finland_2013_s_Cyber_Security_Strategy.pdf,28, Finland can also be a lucrative target for investment
411,Finland_2013_s_Cyber_Security_Strategy.pdf,28,", Whereas the public sector is tasked with the creation of a safe and efficient operating environment"
412,Finland_2013_s_Cyber_Security_Strategy.pdf,28," It is the responsibility of the private sector to develop business models, products and services"
413,Finland_2013_s_Cyber_Security_Strategy.pdf,28, The aim is to establish an internationally renowned cyber security cluster
414,Finland_2013_s_Cyber_Security_Strategy.pdf,28,", Close international contacts, guarantee a sound knowledge base and fa- cilitate internationally networked business operations"
415,Finland_2013_s_Cyber_Security_Strategy.pdf,28," Various national development projects run by Tekes ( Finnish Funding Agency for Technology and Innovation, ) or Tivit ( Strategic Centre for Science Technology and Inno- vation in the Field of ICT ) among others, must clearly shift their focus towards new busi- ness and research, supporting cyber defence"
416,Finland_2013_s_Cyber_Security_Strategy.pdf,28," For example, one focus area of the Cloud Software program laboratory commencing its operation in 2013, must be aimed at the development of new cyber defence services"
417,Finland_2013_s_Cyber_Security_Strategy.pdf,28, Business security is implemented by countering illicit economic intelligence and cy- ber espionage and by reducing intellectual capital risks
418,Finland_2013_s_Cyber_Security_Strategy.pdf,28," In order to bolster the domestic information security sector, the central government will increase investment in R & D and education and intensify the internal development of its administrative agencies"
419,Finland_2013_s_Cyber_Security_Strategy.pdf,28," The Na- tional Communications Security Authority will become a renowned authority in provid-, ing international information, security, certifications, "
420,Finland_2013_s_Cyber_Security_Strategy.pdf,29,"Finlands CYBER SECURITY STRATEGY BACKGROUND DOSSIER, "
421,Finland_2013_s_Cyber_Security_Strategy.pdf,29,"Make certain that the police have sufficient capabilities to prevent, expose and solve cybercrime? The police must be able to identify and prevent the planning, financing and directing of terrorist crime and other crime in networks that endanger society and be able to solve the suspected crimes IT crime has become an extremely noteworthy sector of crime, with its consequences extending to states Individuals and businesses alike"
422,Finland_2013_s_Cyber_Security_Strategy.pdf,29," IT networks provide an increasingly lucrative and regarding the risk-benefit and damage ratio ever more attractive, environ- ment for committing crimes that have financial or terrorist goals"
423,Finland_2013_s_Cyber_Security_Strategy.pdf,29," Traditional organised crime, too, takes advantage of the vulnerabilities of networks and ICT systems"
424,Finland_2013_s_Cyber_Security_Strategy.pdf,29, Cyber at- tacks can be employed to endanger societys critical infrastructure and carry out terrorist strikes
425,Finland_2013_s_Cyber_Security_Strategy.pdf,29," In addition to terrorism, traditional crime, such as fraud, sexual exploitation of children and industrial espionage, is increasing its presence in the cyber domain In general, the police, being the competent authority in preventing and investigat- ing crime and in taking cases to the prosecutors, cooperate with the other Law, enforce-, ment, authorities"
426,Finland_2013_s_Cyber_Security_Strategy.pdf,29, Cybercrime is time and again transboundary in nature and its investi- gation often demands international police and judicial cooperation
427,Finland_2013_s_Cyber_Security_Strategy.pdf,29," Judicial cooperation is needed, among other things, to obtain evidence or for the extradition of suspects"
428,Finland_2013_s_Cyber_Security_Strategy.pdf,29," It must be ensured that the police have sufficient powers, competences and rights to information when it comes to exposing and preventing cybercrime, as well as identify- ing criminals operating in cyberspace and solving these crimes"
429,Finland_2013_s_Cyber_Security_Strategy.pdf,29," Likewise, it must be en- sured that the police have sufficient powers, competences and rights to information when it comes to identifying and preventing the planning, financing and directing of terrorist crime in networks and other crimes that endangers society, including associated propaganda and preparing the ground for criminal Activity and the capability to solve the suspected crimes"
430,Finland_2013_s_Cyber_Security_Strategy.pdf,29,", The police will establish the competence capacity and appropriate legal powers to ex- change information and cooperate with other law enforcement authorities in preventing identifying and solving crimes"
431,Finland_2013_s_Cyber_Security_Strategy.pdf,29," As part of organised crime prevention, the police shall in- vest in cybercrime prevention"
432,Finland_2013_s_Cyber_Security_Strategy.pdf,29, The police will develop and bolster national IT crime
433,Finland_2013_s_Cyber_Security_Strategy.pdf,29," Pre- vention techniques, by increasing cooperation between different police forces, including their rapid response capabilities, In accordance with the order of the National Police Board"
