,Document,Page,Sentence
0,Germany_2011_Cyber_Security_Strategy_for_Germany.pdf,1,"Cyber Security Strategy for Germany, "
1,Germany_2011_Cyber_Security_Strategy_for_Germany.pdf,3,"Basic principles of the Cyber Security Strategy, Strategic objectives and measures - "
2,Germany_2011_Cyber_Security_Strategy_for_Germany.pdf,4,"Cyberspace includes all information infrastructures accessible via the Internet, beyond all territorial boundaries"
3,Germany_2011_Cyber_Security_Strategy_for_Germany.pdf,4," In Germany, all players of social and economic life use the possibilities provided by cyberspace"
4,Germany_2011_Cyber_Security_Strategy_for_Germany.pdf,4, As part of an increasingly inter- connected world
5,Germany_2011_Cyber_Security_Strategy_for_Germany.pdf,4," The state, critical infrastructures, businesses and citizens in Germany depend on the reliable functioning of information and communication technology and the Internet"
6,Germany_2011_Cyber_Security_Strategy_for_Germany.pdf,4,"Malfunctioning IT products and components, the break-down of information infrastructures or serious"
7,Germany_2011_Cyber_Security_Strategy_for_Germany.pdf,4," Cyber attacks may have a considerable negative impact on the performance of technology, businesses and the administration, and hence on Germanys social lifelines"
8,Germany_2011_Cyber_Security_Strategy_for_Germany.pdf,4," The availability of cyberspace and the integrity, authen- ticity and confidentiality of data in cyberspace have become vital questions of the 21st century"
9,Germany_2011_Cyber_Security_Strategy_for_Germany.pdf,4," Ensuring cyber security has thus turned into a central challenge for the state, business and society both at national and international level"
10,Germany_2011_Cyber_Security_Strategy_for_Germany.pdf,4, The Cyber Security Strategy is intended to improve the framework conditions in this area
11,Germany_2011_Cyber_Security_Strategy_for_Germany.pdf,5,"In recent years, attacks against information infrastructures have become ever more frequent and complex, while at the same time perpetrators have become more professional"
12,Germany_2011_Cyber_Security_Strategy_for_Germany.pdf,5, Cyber attacks are launched both from Germany and abroad
13,Germany_2011_Cyber_Security_Strategy_for_Germany.pdf,5," Given the openness and extent of cyberspace, it is possible to conduct covert attacks and misuse vulnerable systems as tools for an attack"
14,Germany_2011_Cyber_Security_Strategy_for_Germany.pdf,5, In view of technologically sophisticated malware
15,Germany_2011_Cyber_Security_Strategy_for_Germany.pdf,5, The possibilities of responding to and retracing an attack are rather limited
16,Germany_2011_Cyber_Security_Strategy_for_Germany.pdf,5, Often attacks give no clue as to the identity and the background of the attacker
17,Germany_2011_Cyber_Security_Strategy_for_Germany.pdf,5, Terrorists and spies use cyberspace as a place for their activities and do not stop at state borders
18,Germany_2011_Cyber_Security_Strategy_for_Germany.pdf,5, Military operations can also be behind such attacks
19,Germany_2011_Cyber_Security_Strategy_for_Germany.pdf,5,"The trend to develop information systems for industry on the basis of standard components and connect them to cyberspace, which is motivated mainly by economic concerns, entails new vulnerabilities"
20,Germany_2011_Cyber_Security_Strategy_for_Germany.pdf,5, Experience with the Stuxnet virus shows that important industrial infrastructures are no longer exempted from targeted
21,Germany_2011_Cyber_Security_Strategy_for_Germany.pdf,5,"Given the increasing complexity and vulnerability of information infrastructures, the cyber security situation will remain critical"
22,Germany_2011_Cyber_Security_Strategy_for_Germany.pdf,5, Also in the future
23,Germany_2011_Cyber_Security_Strategy_for_Germany.pdf,5," In Germany, the public and the private sector, as well as society at large, are all equally affected by targeted or coincidental"
24,Germany_2011_Cyber_Security_Strategy_for_Germany.pdf,6,"Ensuring cyber security enforcing rights and protecting critical information infrastructures require major efforts by the state, both at national level and in cooperation with international partners"
25,Germany_2011_Cyber_Security_Strategy_for_Germany.pdf,6," Given the shared responsibilities of the state, the industry and the society, a cyber security strategy will only be successful if all players act as partners and fulfil their tasks"
26,Germany_2011_Cyber_Security_Strategy_for_Germany.pdf,6, The same applies to the international context
27,Germany_2011_Cyber_Security_Strategy_for_Germany.pdf,6,"Since IT systems are interconnected in global networks, incidents in other coun- tries information"
28,Germany_2011_Cyber_Security_Strategy_for_Germany.pdf,6, Infrastructures may also indirectly affect Germany
29,Germany_2011_Cyber_Security_Strategy_for_Germany.pdf,6, For this rea- son
30,Germany_2011_Cyber_Security_Strategy_for_Germany.pdf,6, Strengthening cyber security also requires the enforcement of international rules of conduct standards and norms
31,Germany_2011_Cyber_Security_Strategy_for_Germany.pdf,6, Only a mix of domestic and external policy measures will be appropriate for the dimension of the problem
32,Germany_2011_Cyber_Security_Strategy_for_Germany.pdf,6, Cyber security can be improved by enhancing the framework conditions for drawing up com- mon minimum standards
33,Germany_2011_Cyber_Security_Strategy_for_Germany.pdf,6, ( code of conduct ) with allies and partners
34,Germany_2011_Cyber_Security_Strategy_for_Germany.pdf,6, Fighting the rapid growth of cybercrime requires close cooperation between law enforcement authorities worldwide
35,Germany_2011_Cyber_Security_Strategy_for_Germany.pdf,6,"Basic principles of the Cyber Security Strategy, The Federal Government aims at making a substantial contribution to a secure cyberspace, thus maintaining and promoting economic and social prosperity in Germany"
36,Germany_2011_Cyber_Security_Strategy_for_Germany.pdf,6," Cyber security in Germany must be ensured at a level commensurate with the importance and protection required by interlinked information, infra- structures without hampering the opportunities and the utilization of the cyber-"
37,Germany_2011_Cyber_Security_Strategy_for_Germany.pdf,6," In this context, the level of cyber security reached is the sum of all national and international measures taken to protect the availability of information and communications technology and the integrity, authenticity and confidentiality of data in cyberspace"
38,Germany_2011_Cyber_Security_Strategy_for_Germany.pdf,7,Cyber security must be based on a comprehensive approach
39,Germany_2011_Cyber_Security_Strategy_for_Germany.pdf,7, This requires even more intensive information sharing and coordination
40,Germany_2011_Cyber_Security_Strategy_for_Germany.pdf,7, The Cyber Security Strat- egy mainly focuses on civilian approaches and measures
41,Germany_2011_Cyber_Security_Strategy_for_Germany.pdf,7, They are complemented by measures taken by the Bundeswehr1 to protect its capabilities and measures based on mandates to make cyber security a part of Germanys preventive security strategy
42,Germany_2011_Cyber_Security_Strategy_for_Germany.pdf,7," Given the global nature of information and communications technology, international coordination and appropriate networks focusing on foreign and security policy aspects are indispensable"
43,Germany_2011_Cyber_Security_Strategy_for_Germany.pdf,7," This includes cooperation not only in the United Nations, but also in the EU"
44,Germany_2011_Cyber_Security_Strategy_for_Germany.pdf,7," The Council of Europe, NATO, the G8, the OSCE and other multinational organizations"
45,Germany_2011_Cyber_Security_Strategy_for_Germany.pdf,7, The aim is to ensure the coherence and capabilities of the international community to protect cyberspace
46,Germany_2011_Cyber_Security_Strategy_for_Germany.pdf,7,"Armed Forces ( Bundeswehr, ) "
47,Germany_2011_Cyber_Security_Strategy_for_Germany.pdf,8,Strategic objectives and measures 
48,Germany_2011_Cyber_Security_Strategy_for_Germany.pdf,8,"With the present Cyber Security Strategy, the Federal Government adapts meas- ures to the current threats on the basis of the structures established by the CIP implementation plan and the implementation plan for the federal administration"
49,Germany_2011_Cyber_Security_Strategy_for_Germany.pdf,8, The Federal Government will specifically focus on ten strategic areas: Protection of critical information infrastructures; 
50,Germany_2011_Cyber_Security_Strategy_for_Germany.pdf,8,The protection of critical information infrastructures is the main priority of cyber security
51,Germany_2011_Cyber_Security_Strategy_for_Germany.pdf,8, They are a central component of nearly all critical infrastructures and become increasingly important
52,Germany_2011_Cyber_Security_Strategy_for_Germany.pdf,8, The public and the private sector must cre- ate an enhanced strategic and organizational basis for closer coordination based on intensified information
53,Germany_2011_Cyber_Security_Strategy_for_Germany.pdf,8," To this end, cooperation established by the CIP implementation plan is systematically extended and legal commitments to "
54,Germany_2011_Cyber_Security_Strategy_for_Germany.pdf,9,"Enhance, the binding nature of the CIP implementation plan are examined"
55,Germany_2011_Cyber_Security_Strategy_for_Germany.pdf,9," The participation of the National Cyber Security Council (, cf"
56,Germany_2011_Cyber_Security_Strategy_for_Germany.pdf,9," objective 5 ), the in- tegration of additional sectors is examined and the introduction of new relevant technologies is considered to a greater extent"
57,Germany_2011_Cyber_Security_Strategy_for_Germany.pdf,9, Whether and where protective measures have to be made mandatory and whether and where additional powers are required in case of specific threats have to be clarified too
58,Germany_2011_Cyber_Security_Strategy_for_Germany.pdf,9," Furthermore, we will examine the necessity of harmonizing rules to maintain critical infrastructures during IT crises "
59,Germany_2011_Cyber_Security_Strategy_for_Germany.pdf,9,"Secure IT systems in Germany, "
60,Germany_2011_Cyber_Security_Strategy_for_Germany.pdf,9,Infrastructure protection requires more security with regard to IT
61,Germany_2011_Cyber_Security_Strategy_for_Germany.pdf,9, Systems used by citizens and small and medium-sized businesses
62,Germany_2011_Cyber_Security_Strategy_for_Germany.pdf,9, Users need appropriate and consistent information on risks related to the use of IT systems and on security measures they can take to use cyberspace in a secure manner
63,Germany_2011_Cyber_Security_Strategy_for_Germany.pdf,9," We will organize joint initiatives with groups from society to pool information and advice, con- sistently"
64,Germany_2011_Cyber_Security_Strategy_for_Germany.pdf,9," Furthermore, we will examine whether providers may have to assume greater responsibility and make sure that a basic collection of appropriate security products and services are made available to users by providers"
65,Germany_2011_Cyber_Security_Strategy_for_Germany.pdf,9," We want to provide specific incentives and funds for basic security functions certified by the state, ( e, electronic proof of identity or De-mail ), to be used by the vast majority of citizens To support small and medium-sized businesses in the secure use of IT systems"
66,Germany_2011_Cyber_Security_Strategy_for_Germany.pdf,9," The Federal Ministry of Economics and Technology has set up a task force on IT: security in industry, with the participation of industry, "
67,Germany_2011_Cyber_Security_Strategy_for_Germany.pdf,9,"Strengthening IT security in the public administration, The public administration will further enhance the protection of its IT systems"
68,Germany_2011_Cyber_Security_Strategy_for_Germany.pdf,9, State authorities have to serve as role models for data security
69,Germany_2011_Cyber_Security_Strategy_for_Germany.pdf,9," We will create a common, uniform and secure network infrastructure in the federal administra- tion ( federal networks )"
70,Germany_2011_Cyber_Security_Strategy_for_Germany.pdf,9," As a basis for electronic audio and data communication, We will continue to press ahead with the implementation plan, for the federal administration"
71,Germany_2011_Cyber_Security_Strategy_for_Germany.pdf,9, Should the IT security situation get worse
72,Germany_2011_Cyber_Security_Strategy_for_Germany.pdf,9, This plan may be 
73,Germany_2011_Cyber_Security_Strategy_for_Germany.pdf,10,", Effective IT security requires powerful structures in all federal authorities"
74,Germany_2011_Cyber_Security_Strategy_for_Germany.pdf,10," For this reason, resources must be deployed appropriately at central and local level"
75,Germany_2011_Cyber_Security_Strategy_for_Germany.pdf,10, To facilitate implementation through uniform action by authorities joint investments into the Federal Governments
76,Germany_2011_Cyber_Security_Strategy_for_Germany.pdf,10, It security will be made regularly in line with budgetary possibilities
77,Germany_2011_Cyber_Security_Strategy_for_Germany.pdf,10," Operational cooperation with the federal Lnder, particularly with regard to CERTs ( computer emergency response teams"
78,Germany_2011_Cyber_Security_Strategy_for_Germany.pdf,10, ) will be further intensified by the IT planning council National Cyber Response Centre
79,Germany_2011_Cyber_Security_Strategy_for_Germany.pdf,10,"To optimize operational cooperation between all state authorities and improve the coordination of protection and response measures for IT incidents, we will set up a National Cyber Response"
80,Germany_2011_Cyber_Security_Strategy_for_Germany.pdf,10," It will report to the Federal Office for Information Security, (, BSI ), and cooperate directly with the Federal Office for the Protection of the Constitution, ( BfV ) and the Federal Office of Civil Protection and Disaster Assistance"
81,Germany_2011_Cyber_Security_Strategy_for_Germany.pdf,10, ( BBK ) Cooperation in the National Cyber Response Centre will strictly observe the statutory tasks and powers of all authorities involved on the basis of cooperation
82,Germany_2011_Cyber_Security_Strategy_for_Germany.pdf,10,", The Federal Criminal Police Office, ( BKA ), the Federal Police, ( BPOL ), the Customs Criminological Office, ( ZKA, ), the Federal Intelligence Service, (, BND ), the Bundeswehr and authorities supervising critical infrastructure operators all participate in this centre within the framework of their statutory tasks And powers "
83,Germany_2011_Cyber_Security_Strategy_for_Germany.pdf,10,"Quick and close information sharing on weaknesses of IT products, vulnerabilities forms of attacks and profiles of perpetrators enables the National Cyber Response Centre to analyse IT incidents and give consolidated recommendations for action"
84,Germany_2011_Cyber_Security_Strategy_for_Germany.pdf,10, The interests of the private sector to protect itself against crime and espionage in cyberspace should also be adequately taken into account
85,Germany_2011_Cyber_Security_Strategy_for_Germany.pdf,10," At the same time, respective responsibilities must be observed"
86,Germany_2011_Cyber_Security_Strategy_for_Germany.pdf,10," Every stakeholder takes the necessary measures in its remit on the basis of the jointly developed national cyber security assessment and coordinates them with the competent authorities, as well as partners from industry and academia"
87,Germany_2011_Cyber_Security_Strategy_for_Germany.pdf,10,"Since security preparedness is best achieved by early warning and prevention, the Cyber Response Centre will submit recommendations to the National Cyber Secu- rity Council, both on a regular basis and for specific incidents"
88,Germany_2011_Cyber_Security_Strategy_for_Germany.pdf,10," If the cyber security situation reaches the level of an imminent or already occurred crisis, the National Cyber Response Centre will directly inform the crisis management staff, headed by the responsible State Secretary at the Federal Ministry of the Interior"
89,Germany_2011_Cyber_Security_Strategy_for_Germany.pdf,11, National Cyber Security Council 
90,Germany_2011_Cyber_Security_Strategy_for_Germany.pdf,11,The identification and removal of structural causes for crises are considered an important preventive tool for cyber security
91,Germany_2011_Cyber_Security_Strategy_for_Germany.pdf,11," For this reason, we want to establish and maintain cooperation within the Federal Government and between the public and the private sector within the responsibility of the Federal Government, Com- missioner"
92,Germany_2011_Cyber_Security_Strategy_for_Germany.pdf,11, For Information Technology more visible and set up a National Cyber Security? Council
93,Germany_2011_Cyber_Security_Strategy_for_Germany.pdf,11,", The Federal Chancellery and a State Secretary from each the Federal Foreign Office, the Federal Ministry of the Interior, the Federal Ministry of Defence, the Federal Ministry for Economics and Technology, the Federal Ministry of Justice, the Federal Ministry of Finance, the Federal Ministry of Education and Resarch And representatives of the federal Lnder will participate"
94,Germany_2011_Cyber_Security_Strategy_for_Germany.pdf,11," Additional ministries will be included, Business representatives will be invited, as associated members"
95,Germany_2011_Cyber_Security_Strategy_for_Germany.pdf,11, Representatives from academia will be involved if required
96,Germany_2011_Cyber_Security_Strategy_for_Germany.pdf,11,", The National Cyber Security Council is intended to coordinate preventive tools and the interdisciplinary cyber security "
97,Germany_2011_Cyber_Security_Strategy_for_Germany.pdf,12,Approaches of the public and the private sector
98,Germany_2011_Cyber_Security_Strategy_for_Germany.pdf,12,", The National Cyber Security Council will complement and interlink IT management at federal level and the work of the IT Planning Council in the area of cyber security at a political and strategic level, Effective crime control also in cyberspace"
99,Germany_2011_Cyber_Security_Strategy_for_Germany.pdf,12," The capabilities of law enforcement agencies, the Federal Office for Information Security and the private sector in combating cyber crime, also with regard to protection against espionage and sabotage, must be strengthened"
100,Germany_2011_Cyber_Security_Strategy_for_Germany.pdf,12, To improve the exchange of know
101,Germany_2011_Cyber_Security_Strategy_for_Germany.pdf,12," How, in this area, we intend to set up joint institutions with indus- try with the participation of the competent law enforcement agencies, which will act in an advisory capacity"
102,Germany_2011_Cyber_Security_Strategy_for_Germany.pdf,12, Projects to support partner countries with structural weaknesses will also serve the aim of combating cyber crime
103,Germany_2011_Cyber_Security_Strategy_for_Germany.pdf,12," To face Up to the growing challenges of global cyber crime activities, we will make a major effort to achieve global harmonization in criminal law based on the Council of Europe Cyber Crime Convention"
104,Germany_2011_Cyber_Security_Strategy_for_Germany.pdf,12," Furthermore, we will examine whether additional conventions in this area may be necessary at UN level"
105,Germany_2011_Cyber_Security_Strategy_for_Germany.pdf,13, Effective coordinated action to ensure cyber security in Europe and worldwide 
106,Germany_2011_Cyber_Security_Strategy_for_Germany.pdf,13,"In global cyberspace, security can be achieved only through coordinated tools at national and international level"
107,Germany_2011_Cyber_Security_Strategy_for_Germany.pdf,13,"At EU level, we support appropriate measures based on the action plan for the protection of critical information infrastructures, the extension and moderate enlargement of the mandate of the European Network and Information Security Agency (, ENISA )"
108,Germany_2011_Cyber_Security_Strategy_for_Germany.pdf,13," In view of the changed threat situation in ICT and the pooling of IT, competences in EU institutions"
109,Germany_2011_Cyber_Security_Strategy_for_Germany.pdf,13,", The EU Internal Security Strategy and the Digital Agenda provide guidance for further activities"
110,Germany_2011_Cyber_Security_Strategy_for_Germany.pdf,13," We will shape our external cyber policy in such a way that German interests and ideas concerning cyber security are coordinated and pursued in international organizations such as the United Nations, the OSCE, the Council of Europe, the OECD and NATO"
111,Germany_2011_Cyber_Security_Strategy_for_Germany.pdf,13, An increasingly multilateral approach must be brought in line with the necessity of sovereign evaluation and decision-making powers
112,Germany_2011_Cyber_Security_Strategy_for_Germany.pdf,13," In this context, a code for state conduct in cyberspace, ( cyber code ), should be estab- lished, which is signed by as many countries as possible and includes confidence- building security measures"
113,Germany_2011_Cyber_Security_Strategy_for_Germany.pdf,13," In the G8 framework, we are currently working on intensifying anti-botnet activities"
114,Germany_2011_Cyber_Security_Strategy_for_Germany.pdf,13,Nato serves as the basis of transatlantic security
115,Germany_2011_Cyber_Security_Strategy_for_Germany.pdf,13, Hence NATO must take cyber security appropriately into account in its entire range of responsibilities
116,Germany_2011_Cyber_Security_Strategy_for_Germany.pdf,13," We are in favour of the alliances commitment to establishing uniform security, stand- ards, which Member States may also use for civilian critical infrastructures on a voluntary basis, as foreseen in NATOs new Strategic Concept, Use of reliable and trustworthy information technology, The availability of reliable IT systems and Components must be ensured on a permanent basis"
117,Germany_2011_Cyber_Security_Strategy_for_Germany.pdf,13," The development of innovative protection plans for improved security, which take into account social and economic aspects, is strongly sup-"
118,Germany_2011_Cyber_Security_Strategy_for_Germany.pdf,13," To this end, we will continue and intensify research on IT security and on critical infrastructure"
119,Germany_2011_Cyber_Security_Strategy_for_Germany.pdf,13," Furthermore, we will strengthen Germanys technological sovereignty and economic capacity in the entire range of core strategic"
120,Germany_2011_Cyber_Security_Strategy_for_Germany.pdf,13, It competences include them in our political strategies and develop them further
121,Germany_2011_Cyber_Security_Strategy_for_Germany.pdf,13," Wherever it makes sense, we will pool our resources with those "
122,Germany_2011_Cyber_Security_Strategy_for_Germany.pdf,14,"Of, our partners and allies, particularly in Europe"
123,Germany_2011_Cyber_Security_Strategy_for_Germany.pdf,14,", We are in favour of diversity in technology"
124,Germany_2011_Cyber_Security_Strategy_for_Germany.pdf,14," Our aim is to use components in critical security areas which are certified against an international recognized certification, standard Personnel, development in federal authorities"
125,Germany_2011_Cyber_Security_Strategy_for_Germany.pdf,14,"Given the strategic importance of cyber security, it must be examined as a priority whether additional staff is necessary in authorities in the interest of cyber security"
126,Germany_2011_Cyber_Security_Strategy_for_Germany.pdf,14," Furthermore, intensified personnel exchange between federal authorities and ap- propriate further training measures will enhance interministerial cooperation Tools to respond to cyber attacks"
127,Germany_2011_Cyber_Security_Strategy_for_Germany.pdf,14," If the state wants to be fully prepared for cyber attacks, a coordinated and com- prehensive set of tools to respond to cyber attacks must be created in coopera- tion with the competent state authorities"
128,Germany_2011_Cyber_Security_Strategy_for_Germany.pdf,14, We will continue to assess the threat situation regularly and take appropriate protection measures
129,Germany_2011_Cyber_Security_Strategy_for_Germany.pdf,14," If necessary, we have to examine whether additional statutory powers must be created at federal or Lnder level"
130,Germany_2011_Cyber_Security_Strategy_for_Germany.pdf,14," Above all, the aims, mechanisms and institutions mentioned above must be internalized through a permanent exercise process, with the relevant federal and Lnder authorities, as well as businesses"
131,Germany_2011_Cyber_Security_Strategy_for_Germany.pdf,15,"With the implementation of the strategic objectives and measures, the Federal Government contributes to ensuring cyber security and thus to freedom and prosperity in Germany"
132,Germany_2011_Cyber_Security_Strategy_for_Germany.pdf,15, A lot will depend on whether we succeed at international level in taking effective measures to protect cyberspace
133,Germany_2011_Cyber_Security_Strategy_for_Germany.pdf,15, The information technologies used are subject to short innovation cycles means that the technical and social aspects of cyberspace will continue to change and bear not only new opportunities but also new risks
134,Germany_2011_Cyber_Security_Strategy_for_Germany.pdf,15," For this reason, the Federal Government will regularly review whether the aims of the Cyber Security Strategy have been achieved under the overall control of the National Cyber Security Council and will adapt the strategies and measures to the given requirements and framework conditions"
135,Germany_2011_Cyber_Security_Strategy_for_Germany.pdf,16,"Federal Office of Civil Protection and Disaster Assistance Federal Office for the Protection of the Constitution, Federal Criminal Police Office, "
