,Document,Page,Sentence
136,Germany_2011_Cyber_Security_Strategy_for_Germany.pdf,16,Federal Ministry of the Interior 
137,Germany_2011_Cyber_Security_Strategy_for_Germany.pdf,16,"Federal Office for Information Security, "
138,Germany_2011_Cyber_Security_Strategy_for_Germany.pdf,16,Computer Emergency Response Team 
139,Germany_2011_Cyber_Security_Strategy_for_Germany.pdf,16,European Network and Information Security Agency European Union 
140,Germany_2011_Cyber_Security_Strategy_for_Germany.pdf,16,"Group of leading industrialized nations in the world - ( Germany, USA, Japan, United Kingdom, Canada, France, Italy and the Rus- sian Federation, ) "
141,Germany_2011_Cyber_Security_Strategy_for_Germany.pdf,16,"North Atlantic Treaty Organization, "
142,Germany_2011_Cyber_Security_Strategy_for_Germany.pdf,16,"Organization for Security and Co-operation in Europe, Customs Criminological Office, "
143,Germany_2011_Cyber_Security_Strategy_for_Germany.pdf,16,( Explanations and terminology used in this document ) Cyberspace
144,Germany_2011_Cyber_Security_Strategy_for_Germany.pdf,16, Cyberspace is the virtual space of all IT systems linked at data level on a global scale
145,Germany_2011_Cyber_Security_Strategy_for_Germany.pdf,16," The basis for cyberspace is the Internet as a universal and publicly accessible, connec-, tion and transport network, which can be complemented and further expanded by any number of additional data"
146,Germany_2011_Cyber_Security_Strategy_for_Germany.pdf,16, IT systems in an isolated virtual space are not part of cyberspace
147,Germany_2011_Cyber_Security_Strategy_for_Germany.pdf,16,"Cyber attack cyber espionage and cyber sabotage A cyber attack is an IT attack in cyberspace, directed against one or several other IT systems and aimed at damaging IT security"
148,Germany_2011_Cyber_Security_Strategy_for_Germany.pdf,16," The aims of IT: security, confiden-, tiality, integrity and availability may, all or individually be compromised"
149,Germany_2011_Cyber_Security_Strategy_for_Germany.pdf,16, Cyber attacks directed against the confidentiality of an IT system which are launched 
150,Germany_2011_Cyber_Security_Strategy_for_Germany.pdf,17,Or managed by foreign intelligence services are called cyber espionage
151,Germany_2011_Cyber_Security_Strategy_for_Germany.pdf,17, Cyber attacks against the integrity and availability of IT systems are termed cyber sabotage
152,Germany_2011_Cyber_Security_Strategy_for_Germany.pdf,17,"Cyber security and civilian and military cyber security, ( Global ) cyber security is the desired objective of the IT security situation in which the risks of global cyberspace have been reduced to an acceptable minimum"
153,Germany_2011_Cyber_Security_Strategy_for_Germany.pdf,17,"Hence, cyber security in Germany is the desired objective of the IT security situation in which the risks of the German cyberspace have been reduced to an acceptable minimum"
154,Germany_2011_Cyber_Security_Strategy_for_Germany.pdf,17, Cyber security ( in Germany ) is the sum of suitable and appropriate measures
155,Germany_2011_Cyber_Security_Strategy_for_Germany.pdf,17,"Civilian, cyber security focuses on all IT systems for civilian use in German cyber- Military cyber security focuses on all IT systems for military use in German cyberspace"
156,Germany_2011_Cyber_Security_Strategy_for_Germany.pdf,17,"Critical infrastructures, Critical infrastructures are organizations or institutions with major importance for the public good, whose failure or damage would lead to sustainable supply bottlenecks, considerable disturbance of public security or other dramatic consequences"
157,Germany_2011_Cyber_Security_Strategy_for_Germany.pdf,17,"At federal level, the following areas have been identified: Energy "
158,Germany_2011_Cyber_Security_Strategy_for_Germany.pdf,17,Information technology and telecommunication 
159,Germany_2011_Cyber_Security_Strategy_for_Germany.pdf,17,Finance and insurance sector 
160,Germany_2011_Cyber_Security_Strategy_for_Germany.pdf,19,This brochure has been published free of charge as part of the public information efforts of the Federal Ministry of the Interior
161,Germany_2011_Cyber_Security_Strategy_for_Germany.pdf,19, It may not be used by any political party candidate or campaign workers during an election campaign for purposes of campaign advertising
162,Germany_2011_Cyber_Security_Strategy_for_Germany.pdf,19, This applies to elections at the European federal state and local levels
163,Germany_2011_Cyber_Security_Strategy_for_Germany.pdf,19," Distributing this publication at campaign events or at informa- tion stands of political parties or inserting, stamping or attaching to it any political information or adver- tising constitutes misuse"
164,Germany_2011_Cyber_Security_Strategy_for_Germany.pdf,19, Nor may it be passed on to third parties for purposes of campaign advertising
165,Germany_2011_Cyber_Security_Strategy_for_Germany.pdf,20,", Regardless of when, by what means and in what quantities, this publication was delivered to the recipient, even without reference to any upcoming election, it may not be used in a manner that could be Construed as bias by the Federal Government on behalf of any individual political group, "
166,Germany_2011_Cyber_Security_Strategy_for_Germany.pdf,20,Federal Ministry of the Interior 
167,Germany_2011_Cyber_Security_Strategy_for_Germany.pdf,20,"Media CONSULTA Germany, GmbH "
168,Germany_2011_Cyber_Security_Strategy_for_Germany.pdf,20,Federal Ministry of the Interior 
