,Document,Page,Sentence
124,Greek_National_Cyber_Strategy%20IN%20GREEK_ver%202.pdf,14, Awareness-Raising of users and citizens is supervised by the National Authority
125,Greek_National_Cyber_Strategy%20IN%20GREEK_ver%202.pdf,14," Cyber security and, incidentally, includes information campaigns to citizens, ( eg through the Ministry of Education at primary and secondary level, ) secondary education, ), educational actions, ( eg, in collaboration with them; universities, ) for system, administrators and users, communications and information technology of the agencies web-based viewing, "
126,Greek_National_Cyber_Strategy%20IN%20GREEK_ver%202.pdf,14,Reliable Information Sharing Mechanisms - 
127,Greek_National_Cyber_Strategy%20IN%20GREEK_ver%202.pdf,14,"The exchange of information, in addition to the mandatory ones mentioned in par"
128,Greek_National_Cyber_Strategy%20IN%20GREEK_ver%202.pdf,14,"6 between private entities participating in the National Cyber Security Strategy and their supervisors in the public as well, and the National Cybersecurity Authority is of particular importance for implementation of the National Strategy"
129,Greek_National_Cyber_Strategy%20IN%20GREEK_ver%202.pdf,14,Private operators are invited to 
130,Greek_National_Cyber_Strategy%20IN%20GREEK_ver%202.pdf,14,"Exchange information on communication systems and information technology, they operate the security policies, they have implemented, "
131,Greek_National_Cyber_Strategy%20IN%20GREEK_ver%202.pdf,15," NATIONAL STRATEGY FOR THE GENERAL BUDGET, REVISION, 2 vulnerabilities threats and security incidents, "
132,Greek_National_Cyber_Strategy%20IN%20GREEK_ver%202.pdf,15,"Correspondingly, public bodies are invited to exchange information have been collected by operators which may jeopardize the desirability level of cyber security"
133,Greek_National_Cyber_Strategy%20IN%20GREEK_ver%202.pdf,15, Correlation of this information is possible analysis of the evolution of the threats associated with it
134,Greek_National_Cyber_Strategy%20IN%20GREEK_ver%202.pdf,15," Governance of the country, "
135,Greek_National_Cyber_Strategy%20IN%20GREEK_ver%202.pdf,15,It is necessary to develop those mechanisms for the credibility exchange of information within a framework of mutual trust and respect for the role and responsibilities of all actors involved in the National Cyber Security Strategy
136,Greek_National_Cyber_Strategy%20IN%20GREEK_ver%202.pdf,15,"At this stage, but probably at a later stage, it can to consider the development of private and public sector partnerships that will be adopted in the light of a common scope and use well defined roles to achieve the common objectives"
137,Greek_National_Cyber_Strategy%20IN%20GREEK_ver%202.pdf,15,Support for Research and Development Programs and Academic Education Programs 
138,Greek_National_Cyber_Strategy%20IN%20GREEK_ver%202.pdf,15,"The substantial support on the part of the state for its efforts, academic community, to participate in national, European or other international research "
139,Greek_National_Cyber_Strategy%20IN%20GREEK_ver%202.pdf,15,"Curricula on subjects related to the National Strategy Cybersecurity is an essential parameter in strengthening the level of the Cyber Security of the country, especially given that this field is a constantly evolving field of high technology and specialized knowledge"
140,Greek_National_Cyber_Strategy%20IN%20GREEK_ver%202.pdf,15,"Collaborations at International Level, "
141,Greek_National_Cyber_Strategy%20IN%20GREEK_ver%202.pdf,15,"Since cyberspace and the Internet are a global one, information, environment, addressing threats and vulnerabilities communication and information systems is a worldwide effort,"
142,Greek_National_Cyber_Strategy%20IN%20GREEK_ver%202.pdf,16," NATIONAL STRATEGY FOR THE GENERAL BUDGET REVISION 2, which requires cooperation at international level"
143,Greek_National_Cyber_Strategy%20IN%20GREEK_ver%202.pdf,16,"It, is therefore important to be active presence and participation of our country in the whole spectrum of the international cooperation on the issue of cyber security within the framework of the existing goals, / Aspirations of national foreign policy and guidelines for its exercise and in accordance with the legislation in force In particular, it requires systematic co-operation with countries that have adopted them similar in this case strategy and whose choices "
144,Greek_National_Cyber_Strategy%20IN%20GREEK_ver%202.pdf,16,Are compatible with the Greek ones
145,Greek_National_Cyber_Strategy%20IN%20GREEK_ver%202.pdf,16,Its objective cooperation will be the exchange of experiences and best practices as well
146,Greek_National_Cyber_Strategy%20IN%20GREEK_ver%202.pdf,16, The identification of possibilities for the joint development of appropriate instruments with to address threats and security challenges
147,Greek_National_Cyber_Strategy%20IN%20GREEK_ver%202.pdf,16,It will also make the most of its contribution
148,Greek_National_Cyber_Strategy%20IN%20GREEK_ver%202.pdf,16," Our country in shaping and implementing relevant decisions they have adopted within the framework of international organizations in which Greece participates, with the aim both of enhancing cyber security at national level, as well as of harmonization between "
149,Greek_National_Cyber_Strategy%20IN%20GREEK_ver%202.pdf,16,"Of the relevant international multilateral mechanisms, consultation and action, taking into account, of course, autonomy decision-making at national level"
150,Greek_National_Cyber_Strategy%20IN%20GREEK_ver%202.pdf,16,Evaluation and Review of the National Strategy 
151,Greek_National_Cyber_Strategy%20IN%20GREEK_ver%202.pdf,16,Of the National Strategy 
152,Greek_National_Cyber_Strategy%20IN%20GREEK_ver%202.pdf,16,"Cyber Security is monitored by the National Cyber Security Authority, with evaluation and possible revision of the Strategy"
153,Greek_National_Cyber_Strategy%20IN%20GREEK_ver%202.pdf,16,The evaluation of the Strategy is based on a predetermined methodology which will do use of qualitative and quantitative efficacy indicators on a basis
154,Greek_National_Cyber_Strategy%20IN%20GREEK_ver%202.pdf,16, International standards and concludes with a specific report
155,Greek_National_Cyber_Strategy%20IN%20GREEK_ver%202.pdf,16," Improvement measures within a predefined, timetable"
156,Greek_National_Cyber_Strategy%20IN%20GREEK_ver%202.pdf,16,"The National Authority Cybersecurity monitors international standards to adopt best practices, which it then indicates to the competent bodies for application"
157,Greek_National_Cyber_Strategy%20IN%20GREEK_ver%202.pdf,16, It is imperative to involve all 
158,Greek_National_Cyber_Strategy%20IN%20GREEK_ver%202.pdf,17, NATIONAL STRATEGY FOR THE GENERAL BUDGET REVISION 2 institutions involved in the National Strategy within the institutional and administrative responsibilities
159,Greek_National_Cyber_Strategy%20IN%20GREEK_ver%202.pdf,17,The National Cyber Security Strategy will be developed at its base superior framework of actions and actions that will also create them conditions for the realization of our national vision for the desired level
160,Greek_National_Cyber_Strategy%20IN%20GREEK_ver%202.pdf,17, Cyber security ( see Chapter 3 ) 
161,Greek_National_Cyber_Strategy%20IN%20GREEK_ver%202.pdf,17,"Implementation of the above entails the strengthening of public-private cooperation, which is considered to be particularly important for the achievement of the whole project, but and particularly difficult, given the low degree of maturity and experience"
162,Greek_National_Cyber_Strategy%20IN%20GREEK_ver%202.pdf,17," However, the benefits of this cooperation will be multiplier for the state and public administration for citizens and their level provided security services, but also for the private sector"
163,Greek_National_Cyber_Strategy%20IN%20GREEK_ver%202.pdf,17," ( providers, broadband services, private businesses, ) "
