,Document,Page,Sentence
146,new zealand-cyber-security-cybercrime-plan-december-2015.pdf,8, Cybercrime focus PREVENTING AND MINIMISING HARM Initiatives and activities aimed at increasing awareness of the risks posed by cybercrime will be prioritised with the goal of promoting behavioural change and raising capability to mitigate those risks
147,new zealand-cyber-security-cybercrime-plan-december-2015.pdf,8, Economic GROWTH IS ENABLED Economic harm is a major consequence of cybercrime
148,new zealand-cyber-security-cybercrime-plan-december-2015.pdf,8," In New Zealand, large and small are increasingly affected by cybercrime"
149,new zealand-cyber-security-cybercrime-plan-december-2015.pdf,8," Ways to address cybercrime, which support productivity and competitiveness will be sought"
150,new zealand-cyber-security-cybercrime-plan-december-2015.pdf,8, A PARTNERSHIP APPROACH IS ESSENTIAL
151,new zealand-cyber-security-cybercrime-plan-december-2015.pdf,8," The government has a role to play in cyber security, but it cannot do it alone"
152,new zealand-cyber-security-cybercrime-plan-december-2015.pdf,8," The cybercrime response is a shared responsibility and the New Zealand government will work in close partnership with the private sector, academia, civil society, individuals and other countries"
153,new zealand-cyber-security-cybercrime-plan-december-2015.pdf,8, That partnership will be based on mutual respect and trust
154,new zealand-cyber-security-cybercrime-plan-december-2015.pdf,8, The plan will seek opportunities to share experiences best practice and to cooperate on research and development
155,new zealand-cyber-security-cybercrime-plan-december-2015.pdf,8,", Industry-led and targeted initiatives will be supported, (, for example, among the banking sector )"
156,new zealand-cyber-security-cybercrime-plan-december-2015.pdf,8, The government will also continue to work with NGOs like NetSafe that are engaged in a range of cyber safety and security challenges on behalf of New Zealanders
157,new zealand-cyber-security-cybercrime-plan-december-2015.pdf,8, Human RIGHTS ARE PROTECTED ONLINE
158,new zealand-cyber-security-cybercrime-plan-december-2015.pdf,8," A key part of the New Zealands governments approach to cyber security policy is to support the creativity, freedom, openness and dynamism that has made the Internet what it is today"
159,new zealand-cyber-security-cybercrime-plan-december-2015.pdf,8, New Zealanders should be able to engage online without suffering harm or unlawful interference
160,new zealand-cyber-security-cybercrime-plan-december-2015.pdf,8,This Plan includes four priority: actions
161,new zealand-cyber-security-cybercrime-plan-december-2015.pdf,8, Each should be considered alongside the wider actions in the New Zealands Cyber Security Strategy
162,new zealand-cyber-security-cybercrime-plan-december-2015.pdf,8, All have been incorporated into the 2015 Action Plan
163,new zealand-cyber-security-cybercrime-plan-december-2015.pdf,8," 1 Build capability to address cybercrime, 2, Adapt New Zealands policy and legislative settings to the digital age"
164,new zealand-cyber-security-cybercrime-plan-december-2015.pdf,8,3 Enhance New Zealands operational response to cybercrime
165,new zealand-cyber-security-cybercrime-plan-december-2015.pdf,8,4 Use New Zealands international connections to combat cybercrime
166,new zealand-cyber-security-cybercrime-plan-december-2015.pdf,9,"National Plan to Address Cybercrime, 2015"
167,new zealand-cyber-security-cybercrime-plan-december-2015.pdf,9,PRIORITY ACTION 1 Build capability to address cybercrime; 
168,new zealand-cyber-security-cybercrime-plan-december-2015.pdf,9,"Preventing harm to New Zealanders means that increasing capability and awareness must be at the heart of any response to cybercrime, giving New Zealanders the incentives and tools to change their online behaviour"
169,new zealand-cyber-security-cybercrime-plan-december-2015.pdf,9, This should result in New Zealanders being alert to social engineering and other cybercrime techniques and actively taking practical steps to protect themselves
170,new zealand-cyber-security-cybercrime-plan-december-2015.pdf,9, Law enforcement agencies will also have the capability to undertake search and evidence recovery when a crime has been committed
171,new zealand-cyber-security-cybercrime-plan-december-2015.pdf,9, Success will be measured when New Zealanders know where to go for assistance and cybercrime rates reduce
172,new zealand-cyber-security-cybercrime-plan-december-2015.pdf,9, This is closely linked to the Cyber Capability goal in New Zealands
173,new zealand-cyber-security-cybercrime-plan-december-2015.pdf,9," Cyber Security Strategy Connect Smart (, www"
174,new zealand-cyber-security-cybercrime-plan-december-2015.pdf,9,"nz ) was launched in 2014 to provide an ongoing positive approach to cyber security, supported by a wide range of partners from across the public, private and NGO sectors"
175,new zealand-cyber-security-cybercrime-plan-december-2015.pdf,9, Protect yourself online 
176,new zealand-cyber-security-cybercrime-plan-december-2015.pdf,9,"Connect Smart is aimed at raising awareness of security and promoting ways for New Zealanders to protect themselves online, USING THE CONNECT SMART BRAND TO PREVENT CYBERCRIME"
177,new zealand-cyber-security-cybercrime-plan-december-2015.pdf,9, We will continue to use the Connect Smart brand website and partner channels to raise awareness of the cybercrime threat and promote behavioural change
178,new zealand-cyber-security-cybercrime-plan-december-2015.pdf,9, Providing up-to-date alerts and information around current scams and attack vectors will help ensure New Zealanders understand the threat
179,new zealand-cyber-security-cybercrime-plan-december-2015.pdf,9, Creating a clear understanding of the challenges will underpin active behavioural change by New Zealanders and foster a culture of cyber security
180,new zealand-cyber-security-cybercrime-plan-december-2015.pdf,9," This will also align with initiatives like NetSafes work, with schools to grow digital citizens and significant work by the Ministry of Education on digital literacy"
181,new zealand-cyber-security-cybercrime-plan-december-2015.pdf,9," We will continue to provide advice through Connect, Smart about simple tools and techniques to prevent cybercrime"
182,new zealand-cyber-security-cybercrime-plan-december-2015.pdf,9, It is critical that individuals and small-to-medium enterprises have up-to-date trusted advice about what action they can take
183,new zealand-cyber-security-cybercrime-plan-december-2015.pdf,9," We will work with partners to develop and distribute this advice through a range of channels, including the Connect Smart website and social media"
184,new zealand-cyber-security-cybercrime-plan-december-2015.pdf,9, We will also integrate Connect Smart messaging into crime-prevention initiatives and community liaison roles
185,new zealand-cyber-security-cybercrime-plan-december-2015.pdf,9," ( such as Police community liaison officers, ) DEVELOPING GOVERNMENT CYBERCRIME CAPABILITY"
186,new zealand-cyber-security-cybercrime-plan-december-2015.pdf,9," The Strategy sets out the need to develop a cyber security, professional workforce and the difficulty in both attracting and retaining highly skilled people"
187,new zealand-cyber-security-cybercrime-plan-december-2015.pdf,9, This also applies to law
188,new zealand-cyber-security-cybercrime-plan-december-2015.pdf,9, Electronic evidence is increasingly a part of many criminal investigations
189,new zealand-cyber-security-cybercrime-plan-december-2015.pdf,9, New Zealand must ensure its capability keeps up with demand for these skills and emerging technologies
190,new zealand-cyber-security-cybercrime-plan-december-2015.pdf,9," Police officers and other investigators need as a minimum, to be able to identify cybercrime and cyber-enabled"
191,new zealand-cyber-security-cybercrime-plan-december-2015.pdf,9, Investigators will need to be able to identify lines of enquiry and evidential material and specialist units must have the capability to provide assistance in more complex and sophisticated cases
192,new zealand-cyber-security-cybercrime-plan-december-2015.pdf,9, There must be enough skilled investigators to keep up with the rising demand for electronic evidence
193,new zealand-cyber-security-cybercrime-plan-december-2015.pdf,9," Agencies will continue to share experience, skills, knowledge and resources through the Electronic Combined Law Agency Group ( e-CLAG ) E-CLAG sits within the broader Combined Law Agency Group, a group of intelligence enforcement and compliance professionals who "
194,new zealand-cyber-security-cybercrime-plan-december-2015.pdf,10,National Plan to Address Cybercrime 2015
195,new zealand-cyber-security-cybercrime-plan-december-2015.pdf,10,collaborate on a whole-of-government approach to leverage combined resources
196,new zealand-cyber-security-cybercrime-plan-december-2015.pdf,10, CLAG partnerships are used to tackle the threats of cross-agency crime
197,new zealand-cyber-security-cybercrime-plan-december-2015.pdf,10," Members of e-CLAG are the digital, forensic investigators and analysts from member agencies with digital forensic divisions"
198,new zealand-cyber-security-cybercrime-plan-december-2015.pdf,10, The field is rapidly evolving and in some instances an agency will only have one investigator or analyst on staff
199,new zealand-cyber-security-cybercrime-plan-december-2015.pdf,10," Hence a need to make use of the knowledge, experience and resources of other e-CLAG member agencies"
200,new zealand-cyber-security-cybercrime-plan-december-2015.pdf,10, E-Clag activities include joint agency training sessions and the provision of assistance and tools between member agencies ( and to agencies without digital forensics capability )
201,new zealand-cyber-security-cybercrime-plan-december-2015.pdf,10," Current projects include developing a matrix, capturing equipment, assets and training requirements across agencies"
202,new zealand-cyber-security-cybercrime-plan-december-2015.pdf,10, New Zealand Police is actively developing capability and training to deal with cybercrime
203,new zealand-cyber-security-cybercrime-plan-december-2015.pdf,10," First, National Cybercrime Operating Strategy 2014-2017 sets out Police goals to develop capacity and capability to meet the growing needs around cybercrime and cyber-enabled crime"
204,new zealand-cyber-security-cybercrime-plan-december-2015.pdf,10, The Police Cybercrime Unit is the core Police unit that deals with cybercrime and provides Police with a central point of contact for other agencies
205,new zealand-cyber-security-cybercrime-plan-december-2015.pdf,10," The Unit has recently expanded to seven staff, comprised of a mix of detectives and technical investigators"
206,new zealand-cyber-security-cybercrime-plan-december-2015.pdf,10, Investments in core capability are designed to create a foundation for further development and capacity building
207,new zealand-cyber-security-cybercrime-plan-december-2015.pdf,10, All front line staff ( level
208,new zealand-cyber-security-cybercrime-plan-december-2015.pdf,10, One ) will be trained to deal with customers at the front desk and triage incoming reports
209,new zealand-cyber-security-cybercrime-plan-december-2015.pdf,10," Two ) will identify and follow online lines of enquiry, identify evidential material and prosecute offenders"
210,new zealand-cyber-security-cybercrime-plan-december-2015.pdf,10," Specialists within the Cybercrime Unit ( level, three ) will deal with the more complex cybercrimes impacting on New Zealand businesses and our reputation"
211,new zealand-cyber-security-cybercrime-plan-december-2015.pdf,10, Training material will be in line with the Australia New Zealand Police Advisory Agency Training guidelines 
212,new zealand-cyber-security-cybercrime-plan-december-2015.pdf,11,"National Plan to Address Cybercrime, 2015"
213,new zealand-cyber-security-cybercrime-plan-december-2015.pdf,11,"PRIORITY ACTION, 2, Adapt New Zealands policy and legislative settings for the digital age Alongside increased capability law enforcement and the national security agencies need appropriate and effective powers to investigate cybercrime"
214,new zealand-cyber-security-cybercrime-plan-december-2015.pdf,11, New Zealands legislative and policy
215,new zealand-cyber-security-cybercrime-plan-december-2015.pdf,11, Settings must adapt to new technologies and balance security and privacy
216,new zealand-cyber-security-cybercrime-plan-december-2015.pdf,11, Rapid changes require a technology- neutral framework
217,new zealand-cyber-security-cybercrime-plan-december-2015.pdf,11," At the same time, the global nature of cybercrime poses a challenge to traditional thinking about borders and jurisdiction"
218,new zealand-cyber-security-cybercrime-plan-december-2015.pdf,11," This area of work will be successful when New Zealands legal framework supports a rapid and effective response to cybercrime, LEGISLATIVE REFORM, ALREADY UNDERWAY In recognition of these challenges and other issues"
219,new zealand-cyber-security-cybercrime-plan-december-2015.pdf,11, Legislative reform is underway in a number of related areas
220,new zealand-cyber-security-cybercrime-plan-december-2015.pdf,11," In 2014, following a report from the Law Commission Cabinet agreed to the Ministry of Justice undertaking work to update New Zealands privacy"
221,new zealand-cyber-security-cybercrime-plan-december-2015.pdf,11," Advances in technology since 1993 have dramatically changed how personal information is collected, stored and shared"
222,new zealand-cyber-security-cybercrime-plan-december-2015.pdf,11," Reform of the Privacy Act, 1993 will emphasise, identifying and addressing risks before privacy breaches can occur"
223,new zealand-cyber-security-cybercrime-plan-december-2015.pdf,11, The Law Commission is currently undertaking a review of the Extradition Act 1999 and the Mutual Assistance in Criminal Matters Act 1992
224,new zealand-cyber-security-cybercrime-plan-december-2015.pdf,11, These Acts frame New Zealands response to requests from foreign governments in the investigation and prosecution of crime
225,new zealand-cyber-security-cybercrime-plan-december-2015.pdf,11," The review is based on the effects of technological change, alongside other developments in the international context, such as globalisation, increasing mobility and transnational crime"
226,new zealand-cyber-security-cybercrime-plan-december-2015.pdf,11, The New Zealand Customs Service is in the process of reviewing the Customs and Excise Act 1996
227,new zealand-cyber-security-cybercrime-plan-december-2015.pdf,11," The intent of the review is to ensure that the Act is flexible and permits Customs to undertake their border protection role, using new technology and operating methods"
228,new zealand-cyber-security-cybercrime-plan-december-2015.pdf,11, In response to rising concerns about the harmful effects of cyberbullying on young people
229,new zealand-cyber-security-cybercrime-plan-december-2015.pdf,11, The Harmful Digital Communications Act was passed in July 2015
230,new zealand-cyber-security-cybercrime-plan-december-2015.pdf,11, It could be difficult for victims to deal with harmful digital communications
231,new zealand-cyber-security-cybercrime-plan-december-2015.pdf,11," For example, trying to remove abusive, intimidating and distressing material from the Internet could be difficult drawn out and costly Law enforcement needs to operate swiftly across many jurisdictions"
232,new zealand-cyber-security-cybercrime-plan-december-2015.pdf,11,"Also, few sanctions were available to aid such efforts and to hold offenders to account"
233,new zealand-cyber-security-cybercrime-plan-december-2015.pdf,11, The Act is intended to prevent harm and provide victims with quick and efficient redress
234,new zealand-cyber-security-cybercrime-plan-december-2015.pdf,11," The Act has created a range of measures to address damaging electronic communications spread through methods such as emails texts and social media posts, DEVELOPING A BETTER UNDERSTANDING OF OUR LEGISLATIVE NEEDS"
235,new zealand-cyber-security-cybercrime-plan-december-2015.pdf,11, The Law Commission reviewed computer crime in 1999
236,new zealand-cyber-security-cybercrime-plan-december-2015.pdf,11," The drafting of legislation is technology neutral, but given technological and global developments since then, there may be a need to update or amend it"
237,new zealand-cyber-security-cybercrime-plan-december-2015.pdf,11, Elements of New Zealands legislative framework will be tested to see whether amendment to effectively prevent investigate and respond to
238,new zealand-cyber-security-cybercrime-plan-december-2015.pdf,11, This would be a targeted review
239,new zealand-cyber-security-cybercrime-plan-december-2015.pdf,11, Examples may include amending section 252 of the Crimes Act to permit Police to remove 
240,new zealand-cyber-security-cybercrime-plan-december-2015.pdf,12,"National Plan to Address Cybercrime, 2015"
241,new zealand-cyber-security-cybercrime-plan-december-2015.pdf,12,"botnet infections, considering widening enforcement powers to include seeking information on care and protection matters, considering whether we need an offence of unlawful possession of stolen data, reviewing the crimes involving computers, provisions in the Crimes Act and the role of the Internet in Funding or supporting organised criminal or terrorist groups, Elements of New Zealands policy and legal frameworks will be tested to see whether they need amendment to permit further preventative operational activity"
242,new zealand-cyber-security-cybercrime-plan-december-2015.pdf,12, Work currently plays an important role in investigating and preventing the online exploitation of children
243,new zealand-cyber-security-cybercrime-plan-december-2015.pdf,12," Many criminal networks online rely on trust and confidence to operate, so there may be opportunities to enhance a proactive approach to preventing cybercrime or responding to offenders"
244,new zealand-cyber-security-cybercrime-plan-december-2015.pdf,12, Most cybercrime is perpetrated from outside New Zealand
245,new zealand-cyber-security-cybercrime-plan-december-2015.pdf,12, Exploit the differences between countries and evidence relating to a criminal act may sit in multiple locations
246,new zealand-cyber-security-cybercrime-plan-december-2015.pdf,12," The government will work with partners (, including multinational companies ), to meet the challenges raised by extraterritorial jurisdiction"
247,new zealand-cyber-security-cybercrime-plan-december-2015.pdf,12, Cybercrime often means that law enforcement needs to operate swiftly across many jurisdictions and to access information under many different legal and political regimes
248,new zealand-cyber-security-cybercrime-plan-december-2015.pdf,12," This challenges, our traditional notions of sovereignty and jurisdiction, and the issue will not be resolved by one state"
249,new zealand-cyber-security-cybercrime-plan-december-2015.pdf,12," Exploring accession to the Council of Europe Convention on Cybercrime is an important first step, as is working with companies, to ensure that law enforcement and security agencies have lawful access to data"
250,new zealand-cyber-security-cybercrime-plan-december-2015.pdf,13,"National Plan to Address Cybercrime, 2015"
251,new zealand-cyber-security-cybercrime-plan-december-2015.pdf,13,"PRIORITY ACTION 3 Enhance New Zealands, operational response to cybercrime"
252,new zealand-cyber-security-cybercrime-plan-december-2015.pdf,13," A range of government agencies, NGOs and private sector companies play different roles in regard to cybercrime"
253,new zealand-cyber-security-cybercrime-plan-december-2015.pdf,13, To generate the strongest possible response to cybercrime
254,new zealand-cyber-security-cybercrime-plan-december-2015.pdf,13, We need to work together and leverage our individual and collective strengths
255,new zealand-cyber-security-cybercrime-plan-december-2015.pdf,13," Our measures of success will be a coordinated response to cybercrime and a better understanding of the size, nature and impact of cybercrime, threats, ENHANCING NEW ZEALANDS RESPONSE TO CYBER INCIDENTS, As set out in New Zealands"
256,new zealand-cyber-security-cybercrime-plan-december-2015.pdf,13," Cyber Security Strategy work is underway to establish a national CERT18 to deal with issues across the spectrum, including cybercrime"
257,new zealand-cyber-security-cybercrime-plan-december-2015.pdf,13, Cyber response capabilities have developed organically and are spread across a range of agencies
258,new zealand-cyber-security-cybercrime-plan-december-2015.pdf,13, A CERT should bring some of those capabilities together and result in a more effective and efficient response for victims of cybercrime
259,new zealand-cyber-security-cybercrime-plan-december-2015.pdf,13, Ways to enhance cross-agency operational effectiveness in the prevention investigation and response to cybercrime will be investigated
260,new zealand-cyber-security-cybercrime-plan-december-2015.pdf,13, There are opportunities for agencies to share knowledge and techniques
261,new zealand-cyber-security-cybercrime-plan-december-2015.pdf,13,", As discussed earlier, some of this is already underway through forums like e-CLAG, Police reporting will begin to distinguish cybercrime from other crimes"
262,new zealand-cyber-security-cybercrime-plan-december-2015.pdf,13," At present, it is not always possible to distinguish between crimes committed online and those committed offline"
263,new zealand-cyber-security-cybercrime-plan-december-2015.pdf,13, Recording of reported incidents will need regular reviews to consider identification of cybercrime and cyber-enabled crime so that they are distinguishable from offences which are not facilitated by ICT
264,new zealand-cyber-security-cybercrime-plan-december-2015.pdf,13," This will mean developing criminal behaviour, is properly monitored, allowing new and developing trends to be better identified, Making it easier for "
265,new zealand-cyber-security-cybercrime-plan-december-2015.pdf,13,New Zealanders to report 
266,new zealand-cyber-security-cybercrime-plan-december-2015.pdf,13,Cybercrime will help New Zealand 
267,new zealand-cyber-security-cybercrime-plan-december-2015.pdf,13,"Better understand and respond to cybercrime, ENHANCING OUR CUSTOMER FOCUS, As highlighted earlier"
268,new zealand-cyber-security-cybercrime-plan-december-2015.pdf,13, Cybercrime tends to be under-reported for a range of reasons
269,new zealand-cyber-security-cybercrime-plan-december-2015.pdf,13, Making it easier for New Zealanders to report
270,new zealand-cyber-security-cybercrime-plan-december-2015.pdf,13, Cybercrime will provide better support to victims and ensure better information is collected to help New Zealand
271,new zealand-cyber-security-cybercrime-plan-december-2015.pdf,13, Better understand and respond to cybercrime Options to establish a central point for cybercrime
272,new zealand-cyber-security-cybercrime-plan-december-2015.pdf,13, Reporting will be considered
273,new zealand-cyber-security-cybercrime-plan-december-2015.pdf,13, Customer experience will be considered by providing a single front door at which issues are triaged and directed to the appropriate responder Victims of cybercrime
274,new zealand-cyber-security-cybercrime-plan-december-2015.pdf,13, Have access to the same support as other victims of crime
275,new zealand-cyber-security-cybercrime-plan-december-2015.pdf,13, Focusing on victims in the criminal justice system helps reduce the cost and impact of crime on individuals
276,new zealand-cyber-security-cybercrime-plan-december-2015.pdf,13, Financial and emotional effects of crime on victims will be minimised and services for victims will be provided in a timely and credible way
277,new zealand-cyber-security-cybercrime-plan-december-2015.pdf,13, 18 CERT was once an acronym for computer emergency response team
278,new zealand-cyber-security-cybercrime-plan-december-2015.pdf,13," Since 1997, CERT has been a registered trademark owned by Carnegie Mellon University and is no longer used as an acronym"
279,new zealand-cyber-security-cybercrime-plan-december-2015.pdf,13," New Zealand is requesting permission to use the CERT trademark, victimsinfo "
280,new zealand-cyber-security-cybercrime-plan-december-2015.pdf,14,"National Plan to Address Cybercrime, 2015"
281,new zealand-cyber-security-cybercrime-plan-december-2015.pdf,14,"PRIORITY ACTION, 4 Use New Zealands international connections to combat cybercrime"
282,new zealand-cyber-security-cybercrime-plan-december-2015.pdf,14, International engagement is essential for cyber security
283,new zealand-cyber-security-cybercrime-plan-december-2015.pdf,14," As a result, the principle of partnership applies equally internationally as it does domestically"
284,new zealand-cyber-security-cybercrime-plan-december-2015.pdf,14," New Zealand is not isolated in cyberspace, which creates challenges for law enforcement in investigating and prosecuting cybercriminals"
285,new zealand-cyber-security-cybercrime-plan-december-2015.pdf,14, The fundamentally global nature of the problem requires a coordinated international response
286,new zealand-cyber-security-cybercrime-plan-december-2015.pdf,14, This will be successful when law enforcement in New Zealand can more effectively prevent crime and respond swiftly to cybercrime
287,new zealand-cyber-security-cybercrime-plan-december-2015.pdf,14, Threats emanating outside our jurisdiction
