,Document,Page,Sentence
288,new zealand-cyber-security-cybercrime-plan-december-2015.pdf,14," Closer COOPERATION ON CYBERCRIME, Differences in national laws and enforcement regimes can create barriers to effective international cooperation"
289,new zealand-cyber-security-cybercrime-plan-december-2015.pdf,14, New Zealand is committed to working with partners to reduce those barriers
290,new zealand-cyber-security-cybercrime-plan-december-2015.pdf,14," Law enforcement agencies, work closely with counterparts through INTERPOL and in Australia (, particularly through the Australia, New Zealand Policing, Advisory Agency, ), Canada, the United States and the United Kingdom"
291,new zealand-cyber-security-cybercrime-plan-december-2015.pdf,14, New Zealand is also a member of the Virtual Global Taskforce
292,new zealand-cyber-security-cybercrime-plan-december-2015.pdf,14," The Global Alliance against Child Sexual Abuse Online, the ASEAN Regional Forum and the London Action Plan on spam Consider progressing New Zealands accession to the Council of Europe Convention on Cybercrime, ( also known as the Budapest Convention )"
293,new zealand-cyber-security-cybercrime-plan-december-2015.pdf,14," The Council of Europe Convention on Cybercrime is the first international treaty seeking to address cybercrime by promoting harmonised legal frameworks, improving investigative techniques and increasing cross-border cooperation"
294,new zealand-cyber-security-cybercrime-plan-december-2015.pdf,14," It was developed by the Council of Europe, but a wide range of states have since acceded to the Convention, including our closest partners"
295,new zealand-cyber-security-cybercrime-plan-december-2015.pdf,14," As at May 2015, 45 states parties have ratified the Convention"
296,new zealand-cyber-security-cybercrime-plan-december-2015.pdf,14," To accede will require a National Interest Analysis to test the benefits for New Zealand, including testing"
297,new zealand-cyber-security-cybercrime-plan-december-2015.pdf,14, The domestic policy implications Continue to promote governance of cyberspace and norms of state behaviour online that reflect New Zealands vision and interests
298,new zealand-cyber-security-cybercrime-plan-december-2015.pdf,14, There is not yet a clear consensus about appropriate behaviour for states in an online environment
299,new zealand-cyber-security-cybercrime-plan-december-2015.pdf,14, As set out in the Strategys International Cooperation goal
300,new zealand-cyber-security-cybercrime-plan-december-2015.pdf,14," New Zealand will continue to participate in the development of international consensus about appropriate state of behaviour and the development of confidence-building measures, including on cybercrime, Strengthen New Zealands relationships with international bodies focused on addressing cybercrime"
301,new zealand-cyber-security-cybercrime-plan-december-2015.pdf,14, There are opportunities for New Zealand to contribute to and benefit from relationships with other law enforcement groups
302,new zealand-cyber-security-cybercrime-plan-december-2015.pdf,14," ( such as Europol, NGOs and specialist bodies sponsored by the private sector such as Microsofts Digital Crimes, Unit ) International cooperation currently relies largely on personal and informal relationships"
303,new zealand-cyber-security-cybercrime-plan-december-2015.pdf,14, New Zealand must find ways to ensure these ongoing cooperative relationships are maintained and embedded
304,new zealand-cyber-security-cybercrime-plan-december-2015.pdf,14," For example, New Zealand Police currently has a secondee at the INTERPOL Global Complex for Innovation"
305,new zealand-cyber-security-cybercrime-plan-december-2015.pdf,14," A cutting edge research and development facility based in Singapore Networks of international cooperation will be built to support operational activity through joint investigations, joint operations, intelligence sharing, growing expertise and developing models of best practice"
306,new zealand-cyber-security-cybercrime-plan-december-2015.pdf,15,National Plan to Address Cybercrime 2015
307,new zealand-cyber-security-cybercrime-plan-december-2015.pdf,15,"CAPACITY BUILDING IN THE ASIA-PACIFIC REGION, New Zealand is committed to the maintenance of stability and security in cyberspace"
308,new zealand-cyber-security-cybercrime-plan-december-2015.pdf,15, Improving confidence and understanding of cyber security issues is an important part of international stability
309,new zealand-cyber-security-cybercrime-plan-december-2015.pdf,15, Although the national response to cybercrime is still being developed
310,new zealand-cyber-security-cybercrime-plan-december-2015.pdf,15," Nevertheless, New Zealand is relatively well-placed to contribute to building capacity in the Asia-Pacific region"
311,new zealand-cyber-security-cybercrime-plan-december-2015.pdf,15," As the Pacific region becomes more connected, the opportunities for cybercriminals will increasingly affect economic growth and regional security"
312,new zealand-cyber-security-cybercrime-plan-december-2015.pdf,15," Pacific states are also likely to be targets for criminal activity, as criminals seek legislative settings that are less likely to facilitate their arrest and conviction"
313,new zealand-cyber-security-cybercrime-plan-december-2015.pdf,15, Work with Pacific island states to identify gaps in their capability to respond to cybercrime and undertake capacity building activities in the Asia-Pacific
314,new zealand-cyber-security-cybercrime-plan-december-2015.pdf,15," New Zealand is one of 42 founding members of the Global Forum on Cyber Expertise, ( GFCE ) launched at the 4th Global Conference on Cyber Space in the Hague in 2015"
315,new zealand-cyber-security-cybercrime-plan-december-2015.pdf,15, The GFCE is intended to give momentum to global cyber security capacity
316,new zealand-cyber-security-cybercrime-plan-december-2015.pdf,15," New Zealands capacity building activities will assist in building a more secure, open and accessible cyberspace that delivers broad-based economic and social benefits"
317,new zealand-cyber-security-cybercrime-plan-december-2015.pdf,15, Efforts will focus on raising awareness of the opportunities and risks cyberspace offers and ways to manage those along with practical solutions to raise the Policy and operational capacity of law enforcement and other government agencies to respond cyber security risks
318,new zealand-cyber-security-cybercrime-plan-december-2015.pdf,17,National Plan to Address Cybercrime 2015
319,new zealand-cyber-security-cybercrime-plan-december-2015.pdf,17,"National Plan to Address Cybercrime, 2015 "
