,Document,Page,Sentence
0,new zealand-cyber-security-cybercrime-plan-december-2015.pdf,1,"National Plan to Address Cybercrime, "
1,new zealand-cyber-security-cybercrime-plan-december-2015.pdf,1,"Improving our ability to prevent, "
2,new zealand-cyber-security-cybercrime-plan-december-2015.pdf,1,"Investigate and respond to cybercrime, "
3,new zealand-cyber-security-cybercrime-plan-december-2015.pdf,2,Purpose of the Plan 
4,new zealand-cyber-security-cybercrime-plan-december-2015.pdf,2,The nature of the cybercrime problem and the challenges for New Zealand PRINCIPLES TO UNDERPIN OUR APPROACH
5,new zealand-cyber-security-cybercrime-plan-december-2015.pdf,2,Build capability to address cybercrime: 
6,new zealand-cyber-security-cybercrime-plan-december-2015.pdf,2,"Adapt New Zealands policy and legislative settings for the digital age Enhance New Zealands operational response to cybercrime, Use New Zealands international connections to combat cybercrime"
7,new zealand-cyber-security-cybercrime-plan-december-2015.pdf,2,"A secure, resilient and prosperous online New Zealand "
8,new zealand-cyber-security-cybercrime-plan-december-2015.pdf,3,"National Plan to Address Cybercrime, 2015"
9,new zealand-cyber-security-cybercrime-plan-december-2015.pdf,3,INTRODUCTION New Zealanders live in a connected world
10,new zealand-cyber-security-cybercrime-plan-december-2015.pdf,3, The Internet and information communications technologies
11,new zealand-cyber-security-cybercrime-plan-december-2015.pdf,3," ( ICT ) have broken down geographical barriers, brought people together and created opportunities for economic growth and innovation"
12,new zealand-cyber-security-cybercrime-plan-december-2015.pdf,3," New Zealanders, private and professional lives are underpinned by digital technologies"
13,new zealand-cyber-security-cybercrime-plan-december-2015.pdf,3," Government, business, non-governmental organisations and individuals are seizing the opportunity to deliver services, transact business and communicate in cyberspace"
14,new zealand-cyber-security-cybercrime-plan-december-2015.pdf,3, The cyber environment also provides opportunities for those with criminal or hostile objectives
15,new zealand-cyber-security-cybercrime-plan-december-2015.pdf,3," The scale, speed and global nature of cybercrime present a challenge to traditional law enforcement methods and skills and to confidence in our online world Purpose of the National Plan to Address Cybercrime"
16,new zealand-cyber-security-cybercrime-plan-december-2015.pdf,3," New Zealands Cyber Security Strategy 2015 has four goals: Cyber Resilience, Cyber Capability Addressing Cybercrime and International Cooperation"
17,new zealand-cyber-security-cybercrime-plan-december-2015.pdf,3,"; The National Plan to Address Cybercrime ( the Plan ) has been developed to support the cybercrime goal and contribute to the delivery of the Strategys vision, A secure, resilient and Prosperous online New Zealand CYBER RESILIENCE, "
18,new zealand-cyber-security-cybercrime-plan-december-2015.pdf,3,New Zealands information infrastructures can resist cyber threats and we have the tools to protect our national interests
19,new zealand-cyber-security-cybercrime-plan-december-2015.pdf,3,"New Zealand improves its ability to prevent, investigate and respond to cybercrime"
20,new zealand-cyber-security-cybercrime-plan-december-2015.pdf,3,New Zealanders businesses and government agencies understand cyber threats and have the capability to protect themselves
21,new zealand-cyber-security-cybercrime-plan-december-2015.pdf,3,New Zealand protects and advances its interests on cyberspace issues internationally
22,new zealand-cyber-security-cybercrime-plan-december-2015.pdf,3," The Plan sets out the New Zealand governments, understanding of the cybercrime issue, principles and actions to improve our ability to prevent, investigate and respond to cybercrime and reduce harm to New Zealanders"
23,new zealand-cyber-security-cybercrime-plan-december-2015.pdf,3," It will ensure New Zealands response to cybercrime is coordinated at a national and international level, while also providing individuals and businesses with the tools to protect themselves"
24,new zealand-cyber-security-cybercrime-plan-december-2015.pdf,4,National Plan to Address Cybercrime - 2015
25,new zealand-cyber-security-cybercrime-plan-december-2015.pdf,4, Cybercrime is part of a continuum of activity that ranges from cyber safety challenges to threats to national security
26,new zealand-cyber-security-cybercrime-plan-december-2015.pdf,4, Cybercrime can encompass criminal activity from cyberbullying to state-sponsored theft of intellectual property
27,new zealand-cyber-security-cybercrime-plan-december-2015.pdf,4," Cybercrime can be devastating to individuals, communities and business"
28,new zealand-cyber-security-cybercrime-plan-december-2015.pdf,4," At both ends of the scale For the purposes of this Plan, the definition of cybercrime has two elements: A criminal act that can only be committed through the use of ICT or the Internet and where the computer or network is the target of the offence"
29,new zealand-cyber-security-cybercrime-plan-december-2015.pdf,4," This is regardless of what the criminal goal is, whether political or financial, gain espionage or any other reason"
30,new zealand-cyber-security-cybercrime-plan-december-2015.pdf,4," Examples of cybercrime include producing malicious software network intrusions, denial of service attacks and phishing"
31,new zealand-cyber-security-cybercrime-plan-december-2015.pdf,4," Cyber-Enabled crime is any criminal act that could be committed without ICT or the Internet, but is assisted, facilitated or escalated in scale by the use of technology"
32,new zealand-cyber-security-cybercrime-plan-december-2015.pdf,4," This includes a vast amount of serious and organised crime, such as cyber-enabled fraud or the distribution of child exploitation material"
33,new zealand-cyber-security-cybercrime-plan-december-2015.pdf,4," However, cybercrime is a subset of general crime, and the boundaries will not always be hard and fast"
34,new zealand-cyber-security-cybercrime-plan-december-2015.pdf,4," The nature of the cybercrime problem and the challenges for New Zealand, THE COSTS OF CYBERCRIME ARE DIFFICULT TO CALCULATE RELIABLY"
35,new zealand-cyber-security-cybercrime-plan-december-2015.pdf,4, The extent of the cybercrime problem is not well understood
36,new zealand-cyber-security-cybercrime-plan-december-2015.pdf,4, Worldwide many instances of cybercrime go unreported
37,new zealand-cyber-security-cybercrime-plan-december-2015.pdf,4," In some instances, victims will be unaware"
38,new zealand-cyber-security-cybercrime-plan-december-2015.pdf,4, They have been affected
39,new zealand-cyber-security-cybercrime-plan-december-2015.pdf,4, Other victims are too embarrassed to report
40,new zealand-cyber-security-cybercrime-plan-december-2015.pdf,4, The crime do not know to whom to report whether a crime has been committed or do not believe law enforcement can provide a remedy
41,new zealand-cyber-security-cybercrime-plan-december-2015.pdf,4, If victims receive a remedy from a supplier or financial institution
42,new zealand-cyber-security-cybercrime-plan-december-2015.pdf,4, They may not also report a crime
43,new zealand-cyber-security-cybercrime-plan-december-2015.pdf,4," Finally, businesses can be reluctant to disclose losses or breaches for fear of reputational damage"
44,new zealand-cyber-security-cybercrime-plan-december-2015.pdf,4," According to the UK Home Office survey, data suggests that in 2012, businesses reported only 2 % of online crime incidents"
45,new zealand-cyber-security-cybercrime-plan-december-2015.pdf,4," As a result, the economic cost of cybercrime is notoriously difficult to calculate reliably"
46,new zealand-cyber-security-cybercrime-plan-december-2015.pdf,4, What we do know is that survey and anecdotal evidence indicates a high level of experience with cybercrime
47,new zealand-cyber-security-cybercrime-plan-december-2015.pdf,4, One recent report estimated the annual cost to the global economy at more than US $ 400 billion
48,new zealand-cyber-security-cybercrime-plan-december-2015.pdf,4," The indirect costs from cybercrime are equally difficult to quantify, including the opportunity costs"
49,new zealand-cyber-security-cybercrime-plan-december-2015.pdf,4, For many small-to-medium enterprises
50,new zealand-cyber-security-cybercrime-plan-december-2015.pdf,4, Cybercrime may result in denial of business
51,new zealand-cyber-security-cybercrime-plan-december-2015.pdf,4," Nothing may be stolen, but an attack can reduce their ability to"
52,new zealand-cyber-security-cybercrime-plan-december-2015.pdf,4," Businesses and individuals also face costs to protect against cybercrime and for remediation (, if required"
53,new zealand-cyber-security-cybercrime-plan-december-2015.pdf,4," ) Overseas, well-known losses include the theft of personal and financial information for 70 million customers of US retailer Target in 2013 and the theft of data related to 56 million credit cards from Home Depot in 2014"
54,new zealand-cyber-security-cybercrime-plan-december-2015.pdf,4," Cybercrime can also enable the organisation and perpetration of physical crime, for example, fraud, extortion, disorder, sexual and other violent assaults, 1 New Zealand, Police Prevention; First, National Cybercrime, Operating Strategy, 2014-2017 (, Wellington, 2014, ), 2 M McGuire and S Dowling Cyber crime"
55,new zealand-cyber-security-cybercrime-plan-december-2015.pdf,4," A review of the evidence: ( Home Office Research Report, 75 October 2013, ) 3 Police, National Intelligence Centre, ( NIC, ), Summary from Cyber crime; The need to improve public confidence, ( May 2014 ) (, New Zealand, Police, Wellington, 2014, ) "
56,new zealand-cyber-security-cybercrime-plan-december-2015.pdf,5,National Plan to Address Cybercrime 2015
57,new zealand-cyber-security-cybercrime-plan-december-2015.pdf,5,"Cybercrime may result in social harms through embarrassment and nuisance and in more serious cases, physical or emotional harm"
58,new zealand-cyber-security-cybercrime-plan-december-2015.pdf,5," In the Sony pictures hack in late 2014, large quantities of personal and commercial data were stolen and publicly released ("
59,new zealand-cyber-security-cybercrime-plan-december-2015.pdf,5," In addition to triggering an international debate on freedom of expression in the digital age ), Finally, while the financial losses from cybercrime can be small in an individual instance, the effects on public trust and confidence may be corrosive over time"
60,new zealand-cyber-security-cybercrime-plan-december-2015.pdf,5, There IS NO COMPLETE PICTURE OF CYBERCRIME
61,new zealand-cyber-security-cybercrime-plan-december-2015.pdf,5," In NEW ZEALAND, We are only seeing the tip of the iceberg"
62,new zealand-cyber-security-cybercrime-plan-december-2015.pdf,5, Research commissioned for Connect
63,new zealand-cyber-security-cybercrime-plan-december-2015.pdf,5," Smart Week, 2014 found that 83 % of New Zealanders had experienced a cyber- security breach"
64,new zealand-cyber-security-cybercrime-plan-december-2015.pdf,5," This is not yet reflected in reporting, as New Zealand does not have a single central point of reporting and breach"
65,new zealand-cyber-security-cybercrime-plan-december-2015.pdf,5, Disclosure is not mandatory
66,new zealand-cyber-security-cybercrime-plan-december-2015.pdf,5,", Even if they want to victims"
67,new zealand-cyber-security-cybercrime-plan-december-2015.pdf,5, Do not always know where to report
68,new zealand-cyber-security-cybercrime-plan-december-2015.pdf,5," Different agencies are responsible for different types of cybercrime, so some incidents will be reported to multiple places, while other victims may be passed from one agency to another in an effort to find the best place for a resolution"
69,new zealand-cyber-security-cybercrime-plan-december-2015.pdf,5, May also vary within each service
70,new zealand-cyber-security-cybercrime-plan-december-2015.pdf,5," As a result, no one has a consolidated picture of cybercrime in New Zealand"
71,new zealand-cyber-security-cybercrime-plan-december-2015.pdf,5,Of New Zealanders have experienced a cyber breach As the threat picture develops
72,new zealand-cyber-security-cybercrime-plan-december-2015.pdf,5," We will gain a better understanding of what is required to effectively combat cybercrime, including the full ramifications of rapid technological change and emerging trends such as the rise of online or crypto"
73,new zealand-cyber-security-cybercrime-plan-december-2015.pdf,5," Related legislative reforms are already underway, but further amendments are likely to be required to ensure New Zealands legal framework is future-proof and facilitates an effective response to cybercrime"
74,new zealand-cyber-security-cybercrime-plan-december-2015.pdf,5," It IS DIFFICULT TO DETECT, INVESTIGATE AND PROSECUTE CYBERCRIME"
75,new zealand-cyber-security-cybercrime-plan-december-2015.pdf,5, Cybercrime produces high returns at a low cost and reasonably low risk to the criminal
76,new zealand-cyber-security-cybercrime-plan-december-2015.pdf,5," Thousands of spam emails may generate small losses for each victim, but a much greater loss for New Zealand as a whole"
77,new zealand-cyber-security-cybercrime-plan-december-2015.pdf,5," The two most common techniques - social engineering (, where a victim is tricked into granting access, ) and vulnerability, exploitation, (, taking advantage of programming issues"
78,new zealand-cyber-security-cybercrime-plan-december-2015.pdf,5, ) do not require much investment by criminals due to the low marginal cost between one victim and thousands of victims
79,new zealand-cyber-security-cybercrime-plan-december-2015.pdf,5," Cybercrime can also be distinguished from traditional crimes by the challenges its global nature presents for law, enforcement"
80,new zealand-cyber-security-cybercrime-plan-december-2015.pdf,5,", Individuals and groups overseas can operate wherever an Internet connection is present"
81,new zealand-cyber-security-cybercrime-plan-december-2015.pdf,5,", The perpetrators are overwhelmingly based overseas and are highly organised"
82,new zealand-cyber-security-cybercrime-plan-december-2015.pdf,5, One United Nations report estimates that 80 % of cybercrime is a part of organised criminal activity
83,new zealand-cyber-security-cybercrime-plan-december-2015.pdf,5, Traditional organised crime groups are migrating to this environment for greater profit at less risk
84,new zealand-cyber-security-cybercrime-plan-december-2015.pdf,5," 5 Connect Smart Understanding, Public Perceptions Toward Cyber Security, ( July 2014, ) Last accessed 30/09/2014 http //www"
85,new zealand-cyber-security-cybercrime-plan-december-2015.pdf,5," 7 United Nations Office on Drugs and Crime, Comprehensive Study on Cybercrime, Draft"
86,new zealand-cyber-security-cybercrime-plan-december-2015.pdf,5," ( February 2013, ) Last accessed 24/09/14"
87,new zealand-cyber-security-cybercrime-plan-december-2015.pdf,6,"National Plan to Address Cybercrime, 2015"
88,new zealand-cyber-security-cybercrime-plan-december-2015.pdf,6,The global element makes it difficult to find the perpetrator and access related
89,new zealand-cyber-security-cybercrime-plan-december-2015.pdf,6," Information exchange and cooperation between different countries can be poor and even where strong cooperative relationships exist, mutual legal assistance treaty processes can be very slow and cumbersome"
90,new zealand-cyber-security-cybercrime-plan-december-2015.pdf,6," Cases may require a disproportionate amount of investigative effort, reducing the availability of resources to deal with other demands"
91,new zealand-cyber-security-cybercrime-plan-december-2015.pdf,6, The country where a perpetrator is based may also not have the necessary skills or capacity to conduct a suitable investigation or preserve evidence
92,new zealand-cyber-security-cybercrime-plan-december-2015.pdf,6, Investigation is further complicated by the ability to operate near-anonymously on the Internet
93,new zealand-cyber-security-cybercrime-plan-december-2015.pdf,6," Attribution in cyber incidents is very difficult, particularly when an attack originates"
94,new zealand-cyber-security-cybercrime-plan-december-2015.pdf,6," This makes cybercrime challenging not only to investigate, but also to prosecute"
95,new zealand-cyber-security-cybercrime-plan-december-2015.pdf,6," Proxies and channels like The Onion Router (, TOR ) and peer-to-peer ( P2P ) networks can be exploited by criminals, attempting to hide their identity under layers of encryption"
96,new zealand-cyber-security-cybercrime-plan-december-2015.pdf,6, Those networks are frequently used to facilitate criminal activity and pose challenges for law enforcement
97,new zealand-cyber-security-cybercrime-plan-december-2015.pdf,6," One well- known example, was the use of the now-closed Silk Road site on the TOR network for drugs trading"
98,new zealand-cyber-security-cybercrime-plan-december-2015.pdf,6, The fastest growing is a market called Evolution
99,new zealand-cyber-security-cybercrime-plan-december-2015.pdf,6," Advertising guns, stolen credit card data, stolen medical information and fake identification, which offers highly secure transactions"
100,new zealand-cyber-security-cybercrime-plan-december-2015.pdf,6, Increasingly such sites and dark markets are also selling cybercrime as a service such as hackers for hire or simple toolkits
101,new zealand-cyber-security-cybercrime-plan-december-2015.pdf,6, These developments lower the barriers for entry into cybercrime
102,new zealand-cyber-security-cybercrime-plan-december-2015.pdf,6," Dark markets are selling cybercrime as a service, hackers for hire or "
103,new zealand-cyber-security-cybercrime-plan-december-2015.pdf,6,"Accordingly, a growing group of unskilled actors can have a relatively damaging impact"
104,new zealand-cyber-security-cybercrime-plan-december-2015.pdf,6, At the other end of the spectrum
105,new zealand-cyber-security-cybercrime-plan-december-2015.pdf,6," The lines are blurring between criminal actors and state actors, (, some of whom may also act with criminal intent ) as activity proliferates and techniques become increasingly sophisticated"
106,new zealand-cyber-security-cybercrime-plan-december-2015.pdf,6," As technology and detection strategies evolve, so too do the actors making it difficult for responders to keep pace"
107,new zealand-cyber-security-cybercrime-plan-december-2015.pdf,6,"11 New Zealand offenders are not averse to using anonymising technology, including the use of TOR, to attempt to hide sites providing child exploitation, material and drug dealing"
108,new zealand-cyber-security-cybercrime-plan-december-2015.pdf,6," New ZEALANDS RESPONSE TO CYBERCRIME IS SHARED BETWEEN GOVERNMENT NGOs, THE PRIVATE SECTOR AND INDIVIDUALS"
109,new zealand-cyber-security-cybercrime-plan-december-2015.pdf,6, A range of government agencies have policy and operational responsibilities related to cybercrime
110,new zealand-cyber-security-cybercrime-plan-december-2015.pdf,6, Those roles have largely evolved organically rather than by design
111,new zealand-cyber-security-cybercrime-plan-december-2015.pdf,6," At present, these include New Zealand Police, overarching responsibility for crime prevention, detection and investigation in New Zealand, the Police, Cybercrime Unit Online Child Exploitation Across New Zealand, (, OCEANZ, ), Organised Financial Crime Agency, New Zealand, ( OFCANZ, ) Ministry of Business, Innovation and Employment, Scamwatch and fraud"
112,new zealand-cyber-security-cybercrime-plan-december-2015.pdf,6," Awareness Department of Internal Affairs, Electronic Messaging Compliance, (, anti-spam, ) Censorship, Compliance Unit, "
113,new zealand-cyber-security-cybercrime-plan-december-2015.pdf,6,"8 Calum Jeffray and Tobias Feakin Special Report: The Underground Web, The Cybercrime Challenge, (, Australian Strategic Policy Institute March 2015, ) "
114,new zealand-cyber-security-cybercrime-plan-december-2015.pdf,6,9 Jeffray and Feakin 2015
115,new zealand-cyber-security-cybercrime-plan-december-2015.pdf,6,"11 Police, NIC 2014 "
116,new zealand-cyber-security-cybercrime-plan-december-2015.pdf,7,"National Plan to Address Cybercrime, 2015"
117,new zealand-cyber-security-cybercrime-plan-december-2015.pdf,7," Department of the Prime Minister and Cabinet, the National Cyber Policy Office Connect Smart "
118,new zealand-cyber-security-cybercrime-plan-december-2015.pdf,7,"Ministry of Justice, criminal justice policy development, National Cyber Security Centre, ( in the Government, Communications Security Bureau, ), advanced threats against New Zealands information, infrastructures of national importance, New Zealand, Customs Service, border protection, New Zealand Security, Intelligence Service, investigation of state-sponsored espionage, either directed against or involving New Zealand, with emphasis on detection and investigation of threats, Serious Fraud, Office, serious or complex frauds"
119,new zealand-cyber-security-cybercrime-plan-december-2015.pdf,7," However, cybercrime is a shared problem"
120,new zealand-cyber-security-cybercrime-plan-december-2015.pdf,7," Non-Governmental organisations, ( NGOs, ) civil society and the private sector all have a role to play in both prevention and response"
121,new zealand-cyber-security-cybercrime-plan-december-2015.pdf,7," NetSafe12, and the New Zealand Internet Taskforce,13, for example, provide a reporting point and incident advisories and have taken on roles not currently provided by government"
122,new zealand-cyber-security-cybercrime-plan-december-2015.pdf,7, Twenty-Three percent of all the reports NetSafe received in 2014 were directly referred from the New Zealand Police
123,new zealand-cyber-security-cybercrime-plan-december-2015.pdf,7," The New Zealand government has also initiated Connect Smart:15, a partnership with a range of organisations to raise awareness and capability"
124,new zealand-cyber-security-cybercrime-plan-december-2015.pdf,7, Many private sector companies provide a response to cybercrime
125,new zealand-cyber-security-cybercrime-plan-december-2015.pdf,7," As a part of their core customer service, managing cybercrime is a part of doing business in the 21st century and build a range of protections into the services they offer Protect yourself online "
126,new zealand-cyber-security-cybercrime-plan-december-2015.pdf,7,Responsibility also sits with the wider community
127,new zealand-cyber-security-cybercrime-plan-december-2015.pdf,7, The New Zealand Polices operating strategy is Prevention
128,new zealand-cyber-security-cybercrime-plan-december-2015.pdf,7," First, an approach which is also relevant to cybercrime"
129,new zealand-cyber-security-cybercrime-plan-december-2015.pdf,7," Ideally, cybercrime will be prevented before it occurs"
130,new zealand-cyber-security-cybercrime-plan-december-2015.pdf,7," While there is no way to totally eliminate the risk, there are simple steps: every individual can take to reduce risk"
131,new zealand-cyber-security-cybercrime-plan-december-2015.pdf,7," New Zealanders need to take cyber security threats seriously and be equipped with the tools and techniques to protect themselves online, To reduce the number of cybercrime victims"
132,new zealand-cyber-security-cybercrime-plan-december-2015.pdf,7," In New Zealand, we need to raise awareness in a way that creates behavioural change"
133,new zealand-cyber-security-cybercrime-plan-december-2015.pdf,7," Research commissioned as part of Connect Smart Week, 2014 showed that of the 83 % of New Zealanders who had experienced a cyber-security breach"
134,new zealand-cyber-security-cybercrime-plan-december-2015.pdf,7, 61 % had not changed their online behaviour since the breach
135,new zealand-cyber-security-cybercrime-plan-december-2015.pdf,7," The research also suggested that New Zealanders find the topic overwhelming meaning there is a role for government, in partnership with the private sector and NGOs to be a trusted source of information and advice"
136,new zealand-cyber-security-cybercrime-plan-december-2015.pdf,7," Accordingly, there are opportunities for the government to improve the experience for victims of cybercrime, while also gaining a better understanding of the issue"
137,new zealand-cyber-security-cybercrime-plan-december-2015.pdf,7, A joined-up approach will be critical to provide an effective customer-focused response to cybercrime
138,new zealand-cyber-security-cybercrime-plan-december-2015.pdf,7," Confidence in the security and use of ICT will also be critical to achieve the governments objectives in delivering services to citizens via online channels, 12 http, //www"
139,new zealand-cyber-security-cybercrime-plan-december-2015.pdf,7,"nz, 14 Figure from NetSafe"
140,new zealand-cyber-security-cybercrime-plan-december-2015.pdf,7, 17 Connect Smart 2014 
141,new zealand-cyber-security-cybercrime-plan-december-2015.pdf,8,National Plan to Address Cybercrime 2015
142,new zealand-cyber-security-cybercrime-plan-december-2015.pdf,8,PRINCIPLES TO UNDERPIN OUR APPROACH
143,new zealand-cyber-security-cybercrime-plan-december-2015.pdf,8, Four key principles underpin the New Zealand governments approach to cybercrime
144,new zealand-cyber-security-cybercrime-plan-december-2015.pdf,8, Three of these are drawn from New Zealands Cyber Security Strategy
145,new zealand-cyber-security-cybercrime-plan-december-2015.pdf,8," The first principle ( below ), is specific to this Plans"
