,Document,Page,Sentence
133,Philippine_2005_National%20Cyber%20Security%20Plan%202005.pdf,6," It covers operations that use hacking techniques against a target Internet site with the intent of disrupting normal operations, but without causing serious damage"
134,Philippine_2005_National%20Cyber%20Security%20Plan%202005.pdf,6," It also includes electronic civil disobedience, which brings methods of civil disobedience to cyberspace, like virtual sit-ins and blockades, automated e-mail bombs, web hacks and computer break-ins, including the use of malicious codes"
135,Philippine_2005_National%20Cyber%20Security%20Plan%202005.pdf,6," Cyberterrorism, The exploitation of digital infrastructures for terrorist ends"
136,Philippine_2005_National%20Cyber%20Security%20Plan%202005.pdf,6," It comprises of politically-motivated hacking operations designed to cause grave harm, such as loss of life or severe economic damage"
137,Philippine_2005_National%20Cyber%20Security%20Plan%202005.pdf,6, An example would be an intrusion into an air traffic control system and causing two planes to collide
138,Philippine_2005_National%20Cyber%20Security%20Plan%202005.pdf,6, This is the intermediate step between `` conventional'' terrorism and `` cyberterrorism
139,Philippine_2005_National%20Cyber%20Security%20Plan%202005.pdf,6," Unlike the cyberterrorist, the technoterrorist will attack those systems that exist in the physical world to disrupt cyberspace"
140,Philippine_2005_National%20Cyber%20Security%20Plan%202005.pdf,6," Thus, the computer itself ( hardware rather than software ), is the target of the technoterrorist"
141,Philippine_2005_National%20Cyber%20Security%20Plan%202005.pdf,6," The technoterrorist will use `` conventional'' weapons, such as bombs and physical destruction, to disable or destroy digital infrastructures"
142,Philippine_2005_National%20Cyber%20Security%20Plan%202005.pdf,6," Information Warfare Defined as being concerned with the defensive and offensive use of information and information systems to exploit corrupt or destroy an adversarys information and information system, while protecting Ones: own"
143,Philippine_2005_National%20Cyber%20Security%20Plan%202005.pdf,6,"47 Winn, Schwartau, a pioneer on the topic of information warfare has developed three classes: personal information warfare, which is characterized by the electronic attack against an individuals, privacy, corporate information warfare, where corporations use information and its associated technology to destroy or win against their competitors and Global information warfare which targets entire industries, nations and global economic forces"
144,Philippine_2005_National%20Cyber%20Security%20Plan%202005.pdf,6, The cyberspace is a potentially lucrative source of strategic and competitive intelligence that can be collected by intelligence agencies of governments and their military and police
145,Philippine_2005_National%20Cyber%20Security%20Plan%202005.pdf,7," Intelligence that can be collected in the cyberspace include reports on current events, analytic "
146,Philippine_2005_National%20Cyber%20Security%20Plan%202005.pdf,7,"political and economic assessments and plans, as well as programs and operations of government political organizations, non-government organizations/peoples organizations, ( NGOs/POs, ) and business organizations"
147,Philippine_2005_National%20Cyber%20Security%20Plan%202005.pdf,7," It encompasses monitoring, eavesdropping and interception of communications or electronic messages"
148,Philippine_2005_National%20Cyber%20Security%20Plan%202005.pdf,7, Cyber Crimes Synonymously referred to as computer crimes
149,Philippine_2005_National%20Cyber%20Security%20Plan%202005.pdf,7," They are characterized by hacking or unauthorized access to computer systems or networks or forcibly taking over a computer network to destroy and/or, modify data and programs, including stealing information that can cause disruption to the network"
150,Philippine_2005_National%20Cyber%20Security%20Plan%202005.pdf,7," Reasons, may vary from personal gains to political, reasons"
151,Philippine_2005_National%20Cyber%20Security%20Plan%202005.pdf,7," Cyber crimes include theft, sabotage vandalism, cyberstalking, child pornography, copyright violations, piracy trademark counterfeiting, Internet fraud and others"
152,Philippine_2005_National%20Cyber%20Security%20Plan%202005.pdf,7," Likewise, acts which disrupt or interfere with the normal conduct of transactions over the cyberspace are regarded as cyber crimes"
153,Philippine_2005_National%20Cyber%20Security%20Plan%202005.pdf,7," According to the Tenth United Nations Congress on the Prevention of Crime and the Treatment of Offenders in Vienna on April 10-17, 2000, Cyber crime is defined as any crime capable of being committed in an electronic environment where crime refers to behavior generally defined as illegal or likely To be criminalized"
154,Philippine_2005_National%20Cyber%20Security%20Plan%202005.pdf,7,", Specific cyber crimes have already been identified by the international community, as well as the Philippine legislative body, and will be elaborated in the latter parts of this section"
155,Philippine_2005_National%20Cyber%20Security%20Plan%202005.pdf,7, TOOLS FOR CYBER ATTACKS
156,Philippine_2005_National%20Cyber%20Security%20Plan%202005.pdf,7," In carrying out these threats, several tools and weapons are used by perpetrators of cyber attacks"
157,Philippine_2005_National%20Cyber%20Security%20Plan%202005.pdf,7, The following are some of the most commonly known tools: 1
158,Philippine_2005_National%20Cyber%20Security%20Plan%202005.pdf,7," Back Door, / Trap Door"
159,Philippine_2005_National%20Cyber%20Security%20Plan%202005.pdf,7, This is a set of instructions that permits an unauthorized or authorized user to bypass the systems
160,Philippine_2005_National%20Cyber%20Security%20Plan%202005.pdf,7," Security measures ( - usually a network firewall ), usually referred to as backdoor entrances"
161,Philippine_2005_National%20Cyber%20Security%20Plan%202005.pdf,7, These program codes are placed by developers and vendors to make it easier for them to modify or repair system parameters
162,Philippine_2005_National%20Cyber%20Security%20Plan%202005.pdf,7, Because they are usually compromised
163,Philippine_2005_National%20Cyber%20Security%20Plan%202005.pdf,7, They are used as entry points for hacking
164,Philippine_2005_National%20Cyber%20Security%20Plan%202005.pdf,7, These can also be program codes that have been planted by an attacker into a computer systems firewall in the form of a trojan horse
165,Philippine_2005_National%20Cyber%20Security%20Plan%202005.pdf,7, The Trojan horse acts as a slave waiting for a command to be executed and controlled remotely by a master (
166,Philippine_2005_National%20Cyber%20Security%20Plan%202005.pdf,7, Usually the attacker ) 2
167,Philippine_2005_National%20Cyber%20Security%20Plan%202005.pdf,7," These are programs that appear to be valid and useful, but usually contain hidden instructions that can cause damage to the system"
168,Philippine_2005_National%20Cyber%20Security%20Plan%202005.pdf,7,", A destructive software that disguises itself as a benign application"
169,Philippine_2005_National%20Cyber%20Security%20Plan%202005.pdf,7, They are usually utilized in order to place a backdoor/trap door into a compromised system
170,Philippine_2005_National%20Cyber%20Security%20Plan%202005.pdf,7," This is a special type of Trojan horse that can replicate itself and spread just like a biological virus, causing damage to a computer system or network"
171,Philippine_2005_National%20Cyber%20Security%20Plan%202005.pdf,7, Depending on the authors motive
172,Philippine_2005_National%20Cyber%20Security%20Plan%202005.pdf,7," A program infected with virus may cause damage immediately upon execution, or it may wait until a certain event has occurred, such as a particular date time or command"
173,Philippine_2005_National%20Cyber%20Security%20Plan%202005.pdf,8," It should be noted that computer virus infection is increasing by 47 % per year perpetrated by hackers who maintain 30,000 hacker- "
174,Philippine_2005_National%20Cyber%20Security%20Plan%202005.pdf,8,oriented sites on the Internet
175,Philippine_2005_National%20Cyber%20Security%20Plan%202005.pdf,8," This is a type of Trojan horse whose destructive actions are set to occur when a particular condition occurs, such as reaching a particular clock-time of the initiation of a particular program"
176,Philippine_2005_National%20Cyber%20Security%20Plan%202005.pdf,8, Bombs are sometimes used for computerized vandalism and revenge
177,Philippine_2005_National%20Cyber%20Security%20Plan%202005.pdf,8, They are designed to go off long after the programmer has left the organization
178,Philippine_2005_National%20Cyber%20Security%20Plan%202005.pdf,8, A worm is a program that replicates itself via a permanent or dial-up network connection
179,Philippine_2005_National%20Cyber%20Security%20Plan%202005.pdf,8," Unlike a virus which seeds itself within the computers hard disk for file system, a worm is a self-supporting program"
180,Philippine_2005_National%20Cyber%20Security%20Plan%202005.pdf,8," It can also be used to spread time bombs, viruses, Trojan horses and etc"
181,Philippine_2005_National%20Cyber%20Security%20Plan%202005.pdf,8," This is a form of attack that involves the flooding of ports with large number of packets, with the intent to deny service to the network"
182,Philippine_2005_National%20Cyber%20Security%20Plan%202005.pdf,8, It can be repeated in rapid fire succession generating enough traffic to shut major networks
183,Philippine_2005_National%20Cyber%20Security%20Plan%202005.pdf,8, This is sometimes called the smurf attack
184,Philippine_2005_National%20Cyber%20Security%20Plan%202005.pdf,8," E-mail Bombs, More commonly known as email spamming"
185,Philippine_2005_National%20Cyber%20Security%20Plan%202005.pdf,8," This is the bombardment of email accounts, with thousands of messages distributed with the aid of an automated tool causing a recipients incoming email box to jam"
186,Philippine_2005_National%20Cyber%20Security%20Plan%202005.pdf,8, These are program utilities that easily permit unauthorized persons to capture packet data and examine this data
187,Philippine_2005_National%20Cyber%20Security%20Plan%202005.pdf,8," Sniffers, monitor network data and can be a self-contained software program of hardware devices which usually act as network probes or snoops examining network traffic, but without intercepting or altering it"
188,Philippine_2005_National%20Cyber%20Security%20Plan%202005.pdf,8, The two kinds of packet sniffing are PASSIVE and ACTIVE
189,Philippine_2005_National%20Cyber%20Security%20Plan%202005.pdf,8," Passive sniffing is usually done in a local area network environment within the same subnet, while ACTIVE sniffing is done in a larger- scale environment, usually over a routed, wide-area network"
190,Philippine_2005_National%20Cyber%20Security%20Plan%202005.pdf,8," These are programs that automatically traverse the webs hypertext structure, designed to retrieve documents from a site and reference all documents in a recursive manner"
191,Philippine_2005_National%20Cyber%20Security%20Plan%202005.pdf,8,", Sometimes called web wanderers, crawlers or spiders software robots are usually used to carry out search tasks, but they can also be designed to Steal information destroy data, violate copyright or strain resources on another site and also overload networks and servers"
192,Philippine_2005_National%20Cyber%20Security%20Plan%202005.pdf,9," This pertains to the installation of microchips in the production of integrated circuits by manufacturers that can be used for sabotage by serving as control and locator for some future undertaking, "
193,Philippine_2005_National%20Cyber%20Security%20Plan%202005.pdf,9, These are tiny robots that are smaller than ants and are used to attack computer hardware by crawling and entering computers through slots and shutting down electronic circuits
194,Philippine_2005_National%20Cyber%20Security%20Plan%202005.pdf,9, A special breed of microbes can also be used to destroy integrated circuits
195,Philippine_2005_National%20Cyber%20Security%20Plan%202005.pdf,9," This is the deliberate radiation, re-radiation and reflection of electromagnetic energy for the purpose of disrupting or prevent the use of electronic devices equipment or systems"
196,Philippine_2005_National%20Cyber%20Security%20Plan%202005.pdf,9," High Energy, Radio Frequency, (, HERF, ), GunsEMP Bombs"
197,Philippine_2005_National%20Cyber%20Security%20Plan%202005.pdf,9, Herf guns are radio transmitters that can shoot a high-power radio signal at an electronic target to disable it
198,Philippine_2005_National%20Cyber%20Security%20Plan%202005.pdf,9, EMP bombs are weapons that use electromagnetic pulse that can be detonated near electronic devices
199,Philippine_2005_National%20Cyber%20Security%20Plan%202005.pdf,9, It can destroy all computer and communication systems in a large area
200,Philippine_2005_National%20Cyber%20Security%20Plan%202005.pdf,9, Distributed Denial of Service ( DDoS ) DDoS attacks employ armies of `` zombie'' machines that are controlled by a single master server
201,Philippine_2005_National%20Cyber%20Security%20Plan%202005.pdf,9, These machines will then inundate a target server with thousands of packets of data in an attempt to overwhelm the server and cause it to crash
202,Philippine_2005_National%20Cyber%20Security%20Plan%202005.pdf,9, Ddos attacks have always been a tool of choice for attackers in taking down entire networks
203,Philippine_2005_National%20Cyber%20Security%20Plan%202005.pdf,9, Steganography Steganography is simply taking one piece of information and hiding it within another picture or document
204,Philippine_2005_National%20Cyber%20Security%20Plan%202005.pdf,9," Computer files, such as images, sound recordings and disks, contain unused or insignificant areas of data"
205,Philippine_2005_National%20Cyber%20Security%20Plan%202005.pdf,9," Steganography takes advantage of these areas, replacing them with information like encrypted mail for instance"
206,Philippine_2005_National%20Cyber%20Security%20Plan%202005.pdf,9, Cyber terrorists can use information-hiding to assist them in their plot to destroy infrastructures and cause damage to key government sites and services
207,Philippine_2005_National%20Cyber%20Security%20Plan%202005.pdf,9, These attackers can embed full messages and communications inside pictures that people would never suspect
208,Philippine_2005_National%20Cyber%20Security%20Plan%202005.pdf,9," Information-Hiding can also be used for hiding Trojans spreading viruses, concealing backdoors, hiding destructive, wiping programs, imbedding links and passing secret information"
209,Philippine_2005_National%20Cyber%20Security%20Plan%202005.pdf,9, The usual modes of operations are the following: Hacking is defined as the unauthorized access to a computer system to gain knowledge about a particular computer system and how it operates
210,Philippine_2005_National%20Cyber%20Security%20Plan%202005.pdf,9," On the other hand, is the unauthorized access to computer systems to sabotage steal information and modify data or congest information traffic into the computer network for personal or political gains"
211,Philippine_2005_National%20Cyber%20Security%20Plan%202005.pdf,9,? Phreaking is the unauthorized entry to or hacking of a telecommunication system in order to gain access to a telephone line or make free calls
212,Philippine_2005_National%20Cyber%20Security%20Plan%202005.pdf,10, It is also a means to gain control of a phone switch in 
213,Philippine_2005_National%20Cyber%20Security%20Plan%202005.pdf,10,order to add additional phone lines and modify billing information
214,Philippine_2005_National%20Cyber%20Security%20Plan%202005.pdf,10, Threats to critical cyber infrastructure will increase as development of these infrastructures
215,Philippine_2005_National%20Cyber%20Security%20Plan%202005.pdf,10, These threats may come from a variety of sources which may be either internal or external to the cyber infrastructure per se
216,Philippine_2005_National%20Cyber%20Security%20Plan%202005.pdf,10," Threat sources include, among others, Nations, (, hostile or non-hostile ) for economic, political and security reasons, Foreign Intelligence Service for information superiority through collection of strategic Intelligence and information warfare, Business Competitors for competitive advantage through industrial espionage and competitive intelligence, Terrorist Organizations for disruption and destruction through cyber terrorism, among others"
217,Philippine_2005_National%20Cyber%20Security%20Plan%202005.pdf,10,", Organized Crime, Groups for personal and organizational gain through all forms of cyber crimes, Insiders for revenge or economic gain through sabotage and Theft V"
218,Philippine_2005_National%20Cyber%20Security%20Plan%202005.pdf,10, VIEW OF THE THREAT Threats to critical cyber infrastructure will rapidly increase in terms of frequency and lethality as development and use of these infrastructures also increases
219,Philippine_2005_National%20Cyber%20Security%20Plan%202005.pdf,10,", The US Department of Defense came up with a projection on how these threats will be in the future"
220,Philippine_2005_National%20Cyber%20Security%20Plan%202005.pdf,11," As shown in the table below PERPETRATOR, Validated Existence, Existence Likely, but Not validated Likely By 2005 Beyond 2005 Incompetent W Hacker W Disgruntled Employee, W Crook, W Organized Crime, L, W "
221,Philippine_2005_National%20Cyber%20Security%20Plan%202005.pdf,11," Political Dissidents, W Terrorists Groups, L, W Foreign Espionage, L, W Tactical Countermeasures, W Orchestrated Tactical Iw L W Major Strategic Disruption, L Source, IW, ( Defense ) by DoD, USA 1995, Where W WIDESPREAD L, LIMITED VI"
222,Philippine_2005_National%20Cyber%20Security%20Plan%202005.pdf,11," MOTIVATIONS Threat sources, likewise have diverse, individual and collective motivations or intentions"
223,Philippine_2005_National%20Cyber%20Security%20Plan%202005.pdf,11,", While some perpetrators do not intend to cause large-scale damage to cyber infrastructures"
224,Philippine_2005_National%20Cyber%20Security%20Plan%202005.pdf,11," Many do engage in these activities to realize political and economic ends, such as achieving competitive advantage, instituting revenge deliberately invading privacy, spreading ideologies and others"
225,Philippine_2005_National%20Cyber%20Security%20Plan%202005.pdf,11, The identification of potential threat sources and the understanding of their motivations are crucial to knowing what type of preparedness and security requirements must be organized to minimize avert or eliminate potential exposure
226,Philippine_2005_National%20Cyber%20Security%20Plan%202005.pdf,12," Despite the benefits, the increasing use and rapid growth of critical cyber infrastructures have amplified the risks in our national security"
227,Philippine_2005_National%20Cyber%20Security%20Plan%202005.pdf,12," Here are the major contributory factors why such a situation occurs, despite the benefits that ICT provides 1"
228,Philippine_2005_National%20Cyber%20Security%20Plan%202005.pdf,12," Dependency, Increasing dependence on the use of information and information and communication systems for individual and corporate undertakings"
229,Philippine_2005_National%20Cyber%20Security%20Plan%202005.pdf,12," Digital infrastructures are interdependent in terms of system configurations, connectivity and applications"
230,Philippine_2005_National%20Cyber%20Security%20Plan%202005.pdf,12, The failure of one digital infrastructure can cause the failure of another infrastructure or vice versa
231,Philippine_2005_National%20Cyber%20Security%20Plan%202005.pdf,12, The globalization of business operations and processes requires the need for real- time information and information
232,Philippine_2005_National%20Cyber%20Security%20Plan%202005.pdf,12, Inability to perform these functions can constitute substantial income and opportunity
233,Philippine_2005_National%20Cyber%20Security%20Plan%202005.pdf,12,", Standardization of Technology, Standardization of technology for interoperability and system efficiency opens up windows of vulnerabilities that will be common to all systems and to the knowledge of everyone"
234,Philippine_2005_National%20Cyber%20Security%20Plan%202005.pdf,12, Technology as a Force
235,Philippine_2005_National%20Cyber%20Security%20Plan%202005.pdf,12," Multiplier Information and communication technology provided equal opportunity to government military and police organizations, as well as to individuals, criminal and terrorist organizations"
236,Philippine_2005_National%20Cyber%20Security%20Plan%202005.pdf,12," Ict provides the advantage of speed stealth wide coverage in terms of distance and target anonymity, low cost and high success potential among others"
237,Philippine_2005_National%20Cyber%20Security%20Plan%202005.pdf,12, It only takes a personal computer connected to a network and a computer virus to inflict tremendous damage on a global scale
238,Philippine_2005_National%20Cyber%20Security%20Plan%202005.pdf,12, Ict is also an effective medium for propaganda
239,Philippine_2005_National%20Cyber%20Security%20Plan%202005.pdf,12, Three INTERNATIONAL AND DOMESTIC CYBER SECURITY REGIME
240,Philippine_2005_National%20Cyber%20Security%20Plan%202005.pdf,12, The pervasiveness of threats to critical cyber infrastructure has long been considered an international problem
241,Philippine_2005_National%20Cyber%20Security%20Plan%202005.pdf,12, This prompted the international community to draft guidelines and implement measures to curb its increasing potential to undermine the peaceful world order
242,Philippine_2005_National%20Cyber%20Security%20Plan%202005.pdf,12," The Philippines, being a member of different international organizations, recognizes and subscribes to these guidelines as essential ingredients in its own cyber security planning and programs"
243,Philippine_2005_National%20Cyber%20Security%20Plan%202005.pdf,13, The importance of dealing with cybersecurity concerns attained international status and character owing to its pervasiveness and capability to undermine the peaceful world order
244,Philippine_2005_National%20Cyber%20Security%20Plan%202005.pdf,13, The UN General Assembly
245,Philippine_2005_National%20Cyber%20Security%20Plan%202005.pdf,13," During its 81st Plenary Meeting on December 4, 2000 adopted Resolution 55/63 entitled Combating the Criminal Misuse of Information Technologies, which provides, among others, that ( a ) States should ensure that their laws and practice eliminate safe havens for those who criminally misuse information technologies, (, b, ) Law enforcement cooperation in the investigation and prosecution of international cases of criminal misuse of information technologies should be coordinated among all concerned States"
246,Philippine_2005_National%20Cyber%20Security%20Plan%202005.pdf,13, ( c ) Information should be exchanged between States regarding the problems that they face in combating the criminal misuse of information technologies
247,Philippine_2005_National%20Cyber%20Security%20Plan%202005.pdf,13, ( d ) Law enforcement personnel should be trained and equipped to address the criminal misuse of information technologies
248,Philippine_2005_National%20Cyber%20Security%20Plan%202005.pdf,13," ( e ) Legal systems should protect the confidentiality, integrity and availability of data and computer systems from unauthorized impairment and ensure that criminal abuse is penalized"
249,Philippine_2005_National%20Cyber%20Security%20Plan%202005.pdf,13," ( f, ) Legal systems should permit the preservation of and quick access to, electronic data pertaining to particular criminal investigations"
250,Philippine_2005_National%20Cyber%20Security%20Plan%202005.pdf,13, ( g ) Mutual assistance regimes should ensure the timely investigation of the criminal misuse of information technologies and the timely gathering and exchange of evidence
251,Philippine_2005_National%20Cyber%20Security%20Plan%202005.pdf,13," In such cases, ( h, ), The general public should be made aware of the need to prevent and combat the criminal misuse of information technologies"
252,Philippine_2005_National%20Cyber%20Security%20Plan%202005.pdf,13," ( i ) To the extent practicable information technologies should be designed to help prevent and detect criminal misuse, trace criminals and collect evidence"
253,Philippine_2005_National%20Cyber%20Security%20Plan%202005.pdf,13," (, j ), The fight against the criminal misuse of information technologies requires the development of solutions taking into account both the protection of individual freedoms and privacy and the preservation of the capacity of Governments to fight such criminal misuse"
254,Philippine_2005_National%20Cyber%20Security%20Plan%202005.pdf,13," In a subsequent Resolution 56/121, the UN moved to invite Member States when developing national law policy and practice to combat the criminal misuse of information technologies and take into account as appropriate"
255,Philippine_2005_National%20Cyber%20Security%20Plan%202005.pdf,13," The work and achievements of the Commission on Crime Prevention and Criminal Justice and of other international and regional organizations, The most significant effort on the part of the UN in the area of cybersecurity, was the adoption of Resolution 57/239 entitled Creation of a Global Culture of Cybersecurity"
256,Philippine_2005_National%20Cyber%20Security%20Plan%202005.pdf,13, During its 78th Plenary Meeting on 20 December 2002
