,Document,Page,Sentence
961,SaudiArabia_NISS_Draft_7_EN.pdf,47," The national program should be designed to Ensure that the ICT and information systems that underlie critical, national and organizational infrastructures have implemented proactive, protective and resilient technological strategies"
962,SaudiArabia_NISS_Draft_7_EN.pdf,47, Architectures implementations and processes to meet critical levels of services
963,SaudiArabia_NISS_Draft_7_EN.pdf,47,"These strategies, architectures, implementations and processes should be based on both dependency and interdependency, analyses and an operational risk assessment, Leverage, international standards, partnerships, alliances and collaboration through participation in international security bodies and organizations to identify state-of-the-art practices and Technology, Utilize, CERT-SA and any other IS, and cyber threat and incident centers and establish a Function comprised of government and private sector technical representatives from critical infrastructure areas"
964,SaudiArabia_NISS_Draft_7_EN.pdf,47," These representatives will establish responsibilities and processes for the expanded sharing of operational situation, awareness, ( incident threats and vulnerability"
965,SaudiArabia_NISS_Draft_7_EN.pdf,47," ), coordinate security and resilience practices develop the necessary capabilities for cyber-incident analysis and creation of secure processes for sharing information and situational awareness for operators and decision makers"
966,SaudiArabia_NISS_Draft_7_EN.pdf,47, This could evolve into an all-source Security Operations Center under the NISE and should support KSA national-level crisis management efforts
967,SaudiArabia_NISS_Draft_7_EN.pdf,47, 2 ) Partnership with Telecommunications Providers; 
968,SaudiArabia_NISS_Draft_7_EN.pdf,47,The Governments Telecom Regulator shall ensure a long-term partnership effort is undertaken with telecommunications providers to assess and improve telecommunications/network security and resilience
969,SaudiArabia_NISS_Draft_7_EN.pdf,47," This is a necessary effort to support the increased dependency and interdependency that will result, as the Kingdom transforms into an information society and digital economy"
970,SaudiArabia_NISS_Draft_7_EN.pdf,47," Consider formation of a private sector, National Security and Emergency Preparedness, Telecommunications, "
971,SaudiArabia_NISS_Draft_7_EN.pdf,48,43 | P: a g e 
972,SaudiArabia_NISS_Draft_7_EN.pdf,48, National Information Security Strategy
973,SaudiArabia_NISS_Draft_7_EN.pdf,48,Advisory Committee comprised of senior members of key telecommunication and internet service providers to assist in the effort and progress reviews
974,SaudiArabia_NISS_Draft_7_EN.pdf,48, 3 ) IS Business Continuity and Disaster Planning and Management Due to the importance of electric power for the operation of most ICT and information systems conduct an analysis to assure that SCADA and other systems required to maintain and recover operations of vital electric power system
975,SaudiArabia_NISS_Draft_7_EN.pdf,48, Components have implemented required
976,SaudiArabia_NISS_Draft_7_EN.pdf,48," Ict and information system, asset protection and security measures"
977,SaudiArabia_NISS_Draft_7_EN.pdf,48," Ensure that such measures are regularly monitored, evaluated and audited for effectiveness"
978,SaudiArabia_NISS_Draft_7_EN.pdf,48, Ensure business continuity plans and disaster management and restoration plans are established and regularly exercised
979,SaudiArabia_NISS_Draft_7_EN.pdf,48, It should be recognized that to provide adequate IS business continuity
980,SaudiArabia_NISS_Draft_7_EN.pdf,48," Many supporting areas must be addressed to assure effective backup and restoration in the event of a disaster, 3 Challenges and Issues"
981,SaudiArabia_NISS_Draft_7_EN.pdf,48,"1 ), Though each critical infrastructure organization is responsible for its own operations, security and resilience"
982,SaudiArabia_NISS_Draft_7_EN.pdf,48," The national government must ensure that those organizations are implementing practices commensurate with the importance of the services, as well as their potential to impact KSAs"
983,SaudiArabia_NISS_Draft_7_EN.pdf,48, National and economic security
984,SaudiArabia_NISS_Draft_7_EN.pdf,48, 2 ) Telecommunication dependencies affect all other critical infrastructures
985,SaudiArabia_NISS_Draft_7_EN.pdf,48,"Historical relationships, and independence must transform to an increased transparency that increases confidence and assurances of service 3 ) Because of the sensitive nature of information about these infrastructure operations"
986,SaudiArabia_NISS_Draft_7_EN.pdf,48, Development of a trusting environment to share specific information about vulnerabilities incidents and practices will strong collaboration among owners and operators
987,SaudiArabia_NISS_Draft_7_EN.pdf,48,Specific recommendations for sharing this type of information are highlighted in National Cooperation and Sharing for Information Security
988,SaudiArabia_NISS_Draft_7_EN.pdf,48, Section 4 require 
989,SaudiArabia_NISS_Draft_7_EN.pdf,48,"4, Measures of Progress, "
990,SaudiArabia_NISS_Draft_7_EN.pdf,48,1 ) The extent of the willingness of leaders to encourage collaborative efforts and methodically measure progress and accountability on implementation initiatives is a key indicator leading to success
991,SaudiArabia_NISS_Draft_7_EN.pdf,48," 2 ) Service quality and outage metrics should be standardized and reviewed by MCIT, with infrastructure owners and operators to identify issues to be addressed"
992,SaudiArabia_NISS_Draft_7_EN.pdf,48," 3 ) Identify key service metrics to include service restoration, goals"
993,SaudiArabia_NISS_Draft_7_EN.pdf,48," Exercises and test of recovery and restoration plans, and processes should be conducted on a regular basis to identify after action areas of improvement"
994,SaudiArabia_NISS_Draft_7_EN.pdf,48, Track and test after actions to assure proper implementation and changes in processes
995,SaudiArabia_NISS_Draft_7_EN.pdf,48," Objective T-2 Technical Frameworks for ICT Infrastructures and Information Systems, "
996,SaudiArabia_NISS_Draft_7_EN.pdf,48,"Establish a KSA common evaluation process that permits owners and operators of ICT infrastructures and information systems to uniformly identify an appropriate risk tier level that reflects their ICT infrastructure and system information security and resilience requirements, 1 Approach"
997,SaudiArabia_NISS_Draft_7_EN.pdf,48,"As guidance to owners and operators of ICT and information systems develop a set of common technical frameworks for security and resilience, approaches and practices to be applied to systems based on the risk assessment methodology discussed in section 4"
998,SaudiArabia_NISS_Draft_7_EN.pdf,48,3 Risk Management and Assessment
999,SaudiArabia_NISS_Draft_7_EN.pdf,49,44 | P: a g e 
1000,SaudiArabia_NISS_Draft_7_EN.pdf,49, National Information Security Strategy
1001,SaudiArabia_NISS_Draft_7_EN.pdf,49,"1 ) ICT Security Standards and Policies Establish a well-publicized national program to lead, coordinate and establish initiatives among the national security ministries, critical infrastructure sectors and private sector organizations to assess and improve the security and resilience of critical infrastructures"
1002,SaudiArabia_NISS_Draft_7_EN.pdf,49," Utilizing a common risk framework 2 ) Risk Tier Standards, "
1003,SaudiArabia_NISS_Draft_7_EN.pdf,49,"Establish risk tier standards, controls and metrics for assuring consistent security and resilience application by ICT and information system owners and operators by adapting the U"
1004,SaudiArabia_NISS_Draft_7_EN.pdf,49," National Institute of Standards and Technology, ( NIST, ) 800 series process as the basis for developing such an approach for KSA 3 Challenges and Issues "
1005,SaudiArabia_NISS_Draft_7_EN.pdf,49,"1 ) Elevating the priority of the technical challenge and the importance of collaborative efforts to KSA is essential, especially to attract the best technical talent to this difficult endeavor, 2 )"
1006,SaudiArabia_NISS_Draft_7_EN.pdf,49," Due to the very complex nature of the ICT and information systems, KSA should capitalize on existing developed frameworks, guidelines and standards, for example the U"
1007,SaudiArabia_NISS_Draft_7_EN.pdf,49, They can serve as a way of accelerating adoption of the required framework
1008,SaudiArabia_NISS_Draft_7_EN.pdf,49," 3 ) Inter-networking of information systems and networks requiring different levels of risk management must be explicitly addressed, especially as cloud architectures are adopted"
1009,SaudiArabia_NISS_Draft_7_EN.pdf,49," 4 Measures of Progress, "
1010,SaudiArabia_NISS_Draft_7_EN.pdf,49,1 ) Developing the KSA technical framework should be a priority
1011,SaudiArabia_NISS_Draft_7_EN.pdf,49,Specific milestones should be established and tracked during development of the framework
1012,SaudiArabia_NISS_Draft_7_EN.pdf,49, 2 ) Metrics for the adoption levels by organizations can be carried out through annual surveys and should be used as a key performance indicator of progress
1013,SaudiArabia_NISS_Draft_7_EN.pdf,49," 3 ), Continuous monitoring of critical sensitive interconnections can be applied to measure and demonstrate compliance with requirements"
1014,SaudiArabia_NISS_Draft_7_EN.pdf,49,"3 Objective T-3 Government ICT Infrastructures Institutionalize a cross-ministry effort that goes beyond e-Government systems, to evaluate and assure that each ministry has well-defined processes to address documented security and resilience requirements for their ICT infrastructure and systems"
1015,SaudiArabia_NISS_Draft_7_EN.pdf,49,Provide an increased national focus on current implementations to identify any security and resilience gaps
1016,SaudiArabia_NISS_Draft_7_EN.pdf,49, Develop remediation or technology migration plans to meet the transformational aspirations of the KSA 2 Implementation Initiatives
1017,SaudiArabia_NISS_Draft_7_EN.pdf,49,"1 ) Cadre of Expertise, "
1018,SaudiArabia_NISS_Draft_7_EN.pdf,49,"Develop a cadre of expertise, familiar with current architectural analysis and development processes and tools to enhance capabilities and promote the importance of these specific skills and expertise"
1019,SaudiArabia_NISS_Draft_7_EN.pdf,49," 2 ) Workshops and Opportunities for Expanding Information, Sharing and Collaboration, Create workshops and opportunities for expanding information sharing and collaboration"
1020,SaudiArabia_NISS_Draft_7_EN.pdf,49," Among government, private sector and academic organizations about enterprise architectures"
1021,SaudiArabia_NISS_Draft_7_EN.pdf,49, Include a special focus on wireless and cloud based services/infrastructures 
1022,SaudiArabia_NISS_Draft_7_EN.pdf,50,45 | P: a g e 
1023,SaudiArabia_NISS_Draft_7_EN.pdf,50, National Information Security Strategy
1024,SaudiArabia_NISS_Draft_7_EN.pdf,50,"3 ) Government Enterprise Architecture, ( GEA, ), "
1025,SaudiArabia_NISS_Draft_7_EN.pdf,50,"Adopt and require ministries to follow a Government Enterprise Architecture, ( GEA ) and identify international security standards, practices and common technology configurations to be applied to the GEA 4 ) Compliance Monitoring Practices, "
1026,SaudiArabia_NISS_Draft_7_EN.pdf,50,"Develop compliance monitoring practices using continuous monitoring methodologies for evaluating the state of compliance to adopted standard configurations, 5 ) Engagements with International Activities"
1027,SaudiArabia_NISS_Draft_7_EN.pdf,50,"Increase the number and frequency of engagements with international activities such as The Open Group standards bodies and consortiums that are leaders in security and resilience for existing and emerging technologies, 3 Challenges and Issues"
1028,SaudiArabia_NISS_Draft_7_EN.pdf,50,"1 ) Strong leadership among Chief Information Officers, ( CIOs, ) within ministries or agencies, will be required"
1029,SaudiArabia_NISS_Draft_7_EN.pdf,50,2 ) Developing a common vision and mission among the diverse ministries will take time unless there has been a prior focus on architecture
1030,SaudiArabia_NISS_Draft_7_EN.pdf,50," Similar broad efforts have taken years to reach maturity, 3 ), Those that share a common network and do not comply with the architecture and practices can place"
1031,SaudiArabia_NISS_Draft_7_EN.pdf,50, The security of others at great risk
1032,SaudiArabia_NISS_Draft_7_EN.pdf,50, Some have found that penetration testing by expert companies in this field can be effective in demonstrating existing issues which then precipitates greater collaboration and a willingness to share information and practices
1033,SaudiArabia_NISS_Draft_7_EN.pdf,50, 4 ) Emerging use of more automated compliance monitoring capabilities has shown objective levels of improvement
1034,SaudiArabia_NISS_Draft_7_EN.pdf,50," New techniques require sufficient resources and time for adoption, 5 ) Technology and security threats and capabilities change"
1035,SaudiArabia_NISS_Draft_7_EN.pdf,50, Very active engagement with those facing similar problems and issues is essential
1036,SaudiArabia_NISS_Draft_7_EN.pdf,50," 4, Measures of Progress, "
1037,SaudiArabia_NISS_Draft_7_EN.pdf,50,"1 ) Tracking of the number of new certified individuals and experience levels with architectural analysis tools and processes within each ministries, CIO office, 2, ), Establishment of a plan and timeline for development and transition to common architectures standard products and shared services and infrastructures, 3, ) Tracking And publishing of milestone, accomplishments, 3 ) Compliance audits and testing of each ministry on a regular periodic basis and providing them with scorecards can serve to monitor and demonstrate continuous improvements in these critical areas"
1038,SaudiArabia_NISS_Draft_7_EN.pdf,50, 4 ) Identification of organizational 
1039,SaudiArabia_NISS_Draft_7_EN.pdf,50,"International engagements Levels of information sharing resulting from those engagements with colleagues in other ministries, responsibilities"
1040,SaudiArabia_NISS_Draft_7_EN.pdf,51,46 | P: a g e 
1041,SaudiArabia_NISS_Draft_7_EN.pdf,51, National Information Security Strategy
1042,SaudiArabia_NISS_Draft_7_EN.pdf,51,"The Human Resource ( HR ) element of the NISS is focused on expanding the number of Saudis, qualified and willing to work for the government in the field of IS security"
1043,SaudiArabia_NISS_Draft_7_EN.pdf,51," Five interrelated and interconnected HR elements require integrated and overlapping approaches involving Human Infrastructure, ( Human Resource"
1044,SaudiArabia_NISS_Draft_7_EN.pdf,51," In specific jobs, ) Education, Training Awareness and Shared Responsibility, Increasingly rapid changes in technological economic, cultural and occupational spheres have radically increased the risks to information and ICT systems"
1045,SaudiArabia_NISS_Draft_7_EN.pdf,51, Most of the Kingdom's organizations that responded to the NISS data collection questionnaire cited lack of qualified ICT security staff as a major issue
1046,SaudiArabia_NISS_Draft_7_EN.pdf,51, The appropriate defense cannot be implemented and ongoing penetration attempts and successes may not even be noticed
1047,SaudiArabia_NISS_Draft_7_EN.pdf,51," This situation could place such elements as the Kingdom's major financial and investment strategies, the petroleum delivery systems and the nation's political deliberations at risk of exposure or exploitation due to weak IS practices"
1048,SaudiArabia_NISS_Draft_7_EN.pdf,51," The approach is to first identify work-ready Saudis who, with minimum of training, could be quickly employed based on their true (, not paper, ) qualifications"
1049,SaudiArabia_NISS_Draft_7_EN.pdf,51," Second, it has been reported that government compensation for Saudi employment in IT and IT security positions is neither competitive with private industry"
1050,SaudiArabia_NISS_Draft_7_EN.pdf,51, Nor equivalent to that received by some professionals from neighboring countries
1051,SaudiArabia_NISS_Draft_7_EN.pdf,51,"Instituting, a premium compensation scale to raise Saudi compensation is proposed, so the current unfilled need can be met"
1052,SaudiArabia_NISS_Draft_7_EN.pdf,51,"The third approach is to greatly expand, IS education and training"
1053,SaudiArabia_NISS_Draft_7_EN.pdf,51," Detailed objectives, approaches and initiatives for this element are described In the sub-sections below ELEMENT DESCRIPTION, "
1054,SaudiArabia_NISS_Draft_7_EN.pdf,51,"1, The HR element of the NISS focuses on the broad range of information, security and ICT security requirements that involve the following five areas"
1055,SaudiArabia_NISS_Draft_7_EN.pdf,51," Human Infrastructure is defined as the human resources in individual positions of leadership, employment or functional responsibility"
1056,SaudiArabia_NISS_Draft_7_EN.pdf,51, A brilliant researcher who is not a manager and an excellent manager who is not a researcher compose a human resource
1057,SaudiArabia_NISS_Draft_7_EN.pdf,51," One assignment, creating a human infrastructure, would be the researcher in a research position and the manager in a managerial position"
1058,SaudiArabia_NISS_Draft_7_EN.pdf,51, Another assignment could be the reverse
1059,SaudiArabia_NISS_Draft_7_EN.pdf,51," With the researcher in the managerial position and the manager in the research, position"
1060,SaudiArabia_NISS_Draft_7_EN.pdf,51,It is clear that the value to the Kingdom of the second human infrastructure assignment is much less than the first
1061,SaudiArabia_NISS_Draft_7_EN.pdf,51," Education is a broad concept involving the entire spectrum of both formal self-taught, on line professional and job based; schools, institutes, workshops, special courses, programs and opportunities to equip human resources with the knowledge, learning capability, thinking, language, analytical and problem solving skills needed for success in the 21st Century'S ICT and information environment"
1062,SaudiArabia_NISS_Draft_7_EN.pdf,51," At the top university level, a Kingdom IS certification program can be established with uniform and stringent certification standards for both teachers and curriculum"
1063,SaudiArabia_NISS_Draft_7_EN.pdf,51," This can be combined with foreign universities, in exchange of both teachers and students"
1064,SaudiArabia_NISS_Draft_7_EN.pdf,51," Training is intended to provide and continually update the mental and physical skills, language proficiency and functional knowledge required for productive employment today and into the future"
1065,SaudiArabia_NISS_Draft_7_EN.pdf,51," This includes the development of technical capabilities and strategic thinking, as well as individuals who can manage, supervise and make sound security decisions in the context of their organizations, missions and available resources"
1066,SaudiArabia_NISS_Draft_7_EN.pdf,51," Awareness is the understanding of the threats and vulnerabilities in today's government, private sector and consumer online systems and the consequences of poor security in each"
1067,SaudiArabia_NISS_Draft_7_EN.pdf,51, Innovation and growth sectors require HR ICT security awareness
1068,SaudiArabia_NISS_Draft_7_EN.pdf,51, It is the responsibility of each individual to protect information in any form
1069,SaudiArabia_NISS_Draft_7_EN.pdf,51," From its creation to its eventual destruction, regardless of who owns the information"
1070,SaudiArabia_NISS_Draft_7_EN.pdf,51,", This is accomplished through initiatives and the use of creative approaches to ensure that ICTS awareness, education and training are available to all people"
1071,SaudiArabia_NISS_Draft_7_EN.pdf,52,47 | P: a g e 
1072,SaudiArabia_NISS_Draft_7_EN.pdf,52, National Information Security Strategy
1073,SaudiArabia_NISS_Draft_7_EN.pdf,52,"Shared Responsibility is the concept that each person has a responsibility to act appropriately in protecting the information and ICT systems belonging to them and their organization, as well as each ICT system with which they are involved"
1074,SaudiArabia_NISS_Draft_7_EN.pdf,52," It is important for the leadership government and private sector managers and employees, as well as the public, to understand that the actions or lack of correct actions by even one person can create high risk to the security and privacy of information and the security of ICT systems"
1075,SaudiArabia_NISS_Draft_7_EN.pdf,52," That are remote, but interconnected, 2 RELATIONSHIP TO KINGDOM'S TOP ICT OBJECTIVES"
1076,SaudiArabia_NISS_Draft_7_EN.pdf,52," The Kingdom's HR is a major element of each of the national plans, with emphasis, depending upon the objective of the plan"
1077,SaudiArabia_NISS_Draft_7_EN.pdf,52," Some national objectives relevant to the HR Element of the NISS, are listed in the boxes below "
1078,SaudiArabia_NISS_Draft_7_EN.pdf,52,"National Communications and Information Technology, ( NCIT ) Plan [ 1 ]"
1079,SaudiArabia_NISS_Draft_7_EN.pdf,52, It is expected that ICT will greatly facilitate the effective employment of women and utilization of their capacities
1080,SaudiArabia_NISS_Draft_7_EN.pdf,52,"Raising the percentage of university students in ICT specializations Transformation to information society requires the promotion and development of educational curricula, teaching and learning methods, as well as dissemination of new constructive concepts and values in the society that encourages innovation, invention, creativity, work perfection, productivity raising initiatives and Acceptance of failure - Ninth Development Plan, Human Resources, Development, [, 2, ]"
1081,SaudiArabia_NISS_Draft_7_EN.pdf,52, The Plan highlights a range of issues and challenges facing the Kingdom in its drive towards attaining higher international competitiveness rankings
1082,SaudiArabia_NISS_Draft_7_EN.pdf,52, These include The need to raise the educational level of the workforce towards a well-qualified workforce capable of absorbing new technologies is one of the cornerstones of competitiveness
1083,SaudiArabia_NISS_Draft_7_EN.pdf,52,"1 Objective H-1 Increase Number of Saudi IS Practitioners and Managers Increase the availability and number of educated trained and skilled Saudi Information, Communications and Technology Security, ( ICTS, ) professionals and managers to fill current and future key ICTS positions, 1 Approach, "
1084,SaudiArabia_NISS_Draft_7_EN.pdf,52,"The approach consists of a series of both short and long-term initiatives that utilize current information security, human resources and are aimed at increasing the size of the future ICT and ICTS Saudi HR"
1085,SaudiArabia_NISS_Draft_7_EN.pdf,52," The short-term strategy is to:, "
1086,SaudiArabia_NISS_Draft_7_EN.pdf,52,"Eliminate the current disincentives for skilled people to accept ICTS government jobs, Increase the utilization of women in ICTS "
1087,SaudiArabia_NISS_Draft_7_EN.pdf,52,"[ 1 ], The National Communications and Information Technology Plan, The Vision Towards the Information Society; 1426H; unofficial, Translation of the Arabic text"
1088,SaudiArabia_NISS_Draft_7_EN.pdf,52," [ 2 ] Development Plan, ( 1431/32 1435/36 ), 2010-2014 Ministry of Economy and Planning Chapter 24"
1089,SaudiArabia_NISS_Draft_7_EN.pdf,53,48 | P: a g e 
1090,SaudiArabia_NISS_Draft_7_EN.pdf,53, National Information Security Strategy
1091,SaudiArabia_NISS_Draft_7_EN.pdf,53,"Recruit train and employ work-ready, but underutilized ICTS, skilled Saudis in the Kingdom's provinces; "
1092,SaudiArabia_NISS_Draft_7_EN.pdf,53,"Repatriate skilled Saudi teachers, researchers and practitioners currently overseas for both temporary and permanent assignments in ICTS Revaluate, the skills, qualifications and performance effectiveness of those in senior ICTS positions for eligibility for premium compensation, as well as for being retained"
1093,SaudiArabia_NISS_Draft_7_EN.pdf,53, In that critical position
1094,SaudiArabia_NISS_Draft_7_EN.pdf,53," Review civil services, job descriptions and HR regulations that pertain to ICTS positions"
1095,SaudiArabia_NISS_Draft_7_EN.pdf,53," The longer-term strategy is to:, "
1096,SaudiArabia_NISS_Draft_7_EN.pdf,53,Create a process for early identification of talented children and youth to be trained for key ICTS positions in the Kingdom
1097,SaudiArabia_NISS_Draft_7_EN.pdf,53,Create a national ICTS development program
1098,SaudiArabia_NISS_Draft_7_EN.pdf,53,", Create cooperative programs with friendly international countries and institutions"
1099,SaudiArabia_NISS_Draft_7_EN.pdf,53," Establish continuous and current professional training for ICTS teachers, researchers and practitioners"
1100,SaudiArabia_NISS_Draft_7_EN.pdf,53,1 ) Upgrade Salary Scale
1101,SaudiArabia_NISS_Draft_7_EN.pdf,53,"Develop a scale for ICTS government jobs that is comparable in wages and benefits with industry, compensation for qualified persons, 2 ) Employ qualified women"
1102,SaudiArabia_NISS_Draft_7_EN.pdf,53,"Employ qualified women in ICTS positions, some of which could be in all female locations"
1103,SaudiArabia_NISS_Draft_7_EN.pdf,53,", Identify and establish a cadre of skilled, Saudi female ICTS, practitioners and teachers with appropriate training and competitive salaries"
1104,SaudiArabia_NISS_Draft_7_EN.pdf,53," 3 ) Hire Skilled Saudi ICTS Persons, Encourage the Kingdom's provinces to hire skilled Saudi ICTS persons"
1105,SaudiArabia_NISS_Draft_7_EN.pdf,53," So the regional and municipal ICT systems and disaster recovery infrastructure meet information, security objectives, 4 ), Establish Salary and Benefits; Incentives, Establish an incentive program of salary and benefits to encourage Saudis qualified in ICTS who are new graduates or are currently working in the private sector"
1106,SaudiArabia_NISS_Draft_7_EN.pdf,53, To accept government positions
