,Document,Page,Sentence
268,Slovenia_2016_Cyber_Security_Strategy.pdf,17,"To achieve the objective of cyber security assurance in the area of public security and combating cyber crime, the following measures will be taken: Implementation of appropriate cyber capacities to protect ICT systems of the police, regular training on cyber security for law enforcement authorities participating in the development Of cyber capacities for public security and in combating cyber crime, regular updating of the laws and procedures in line with the development of ICT 6 Development of defensive cyber capabilities, Slovenia will develop cyber defence capabilities that will be able to independently and in cooperation with other EU And NATO countries to protect defence, ICT systems and to provide support to military operations and crisis planning"
269,Slovenia_2016_Cyber_Security_Strategy.pdf,17," Slovenia will develop its cyber defence capabilities independently, as well as in cooperation with its EU and NATO partners, while also cooperating with industry and academic institutions"
270,Slovenia_2016_Cyber_Security_Strategy.pdf,17," To achieve the objective of defence, cyber security, the following measure will be taken: development of appropriate cyber capabilities to protect defence, ICT systems, 7, Ensuring safe operation and availability of key ICT systems in the event of major natural and other disasters"
271,Slovenia_2016_Cyber_Security_Strategy.pdf,17,"Slovenia is exposed to natural and other disasters15, which may also be large-scale"
272,Slovenia_2016_Cyber_Security_Strategy.pdf,17," Therefore, it is necessary to provide adequate resources and implement measures for ensuring the smooth operation of ICT systems in all circumstances, even in the event of major natural and other disasters"
273,Slovenia_2016_Cyber_Security_Strategy.pdf,17," Cyber security assurance measures are intended to ensure data integrity, as well as the availability, reliability and security of access to services and data To achieve the objective of ensuring safe operation and availability of key ICT systems in the event of major natural and other disasters"
274,Slovenia_2016_Cyber_Security_Strategy.pdf,17, The following measure will be taken: ensuring conditions for smooth operation of key ICT systems in the event of major natural and other disasters
275,Slovenia_2016_Cyber_Security_Strategy.pdf,17,"8, Strengthening national cyber security through international cooperation, Given the global nature of the Internet, and thus also the problems of cyber security"
276,Slovenia_2016_Cyber_Security_Strategy.pdf,17," International cooperation in ensuring cyber security for Slovenia, as a small country, is indispensable"
277,Slovenia_2016_Cyber_Security_Strategy.pdf,17," Such cooperation facilitates good exchanges of experience, knowledge and best practices"
278,Slovenia_2016_Cyber_Security_Strategy.pdf,17, All of which contribute to the strengthening of national security
279,Slovenia_2016_Cyber_Security_Strategy.pdf,17," Slovenia will therefore continue to promote the participation of its representatives in international organisations such as the UN, EU, NATO, OSCE, OECD and ITU, as well as in international professional associations in this field"
280,Slovenia_2016_Cyber_Security_Strategy.pdf,17, It will strive for the 
281,Slovenia_2016_Cyber_Security_Strategy.pdf,17,15 Resolution on the national program for protection against natural and other disasters in the years 2009 to 2015
282,Slovenia_2016_Cyber_Security_Strategy.pdf,17,"In Official Gazette of the Republic of Slovenia, 2009 no"
283,Slovenia_2016_Cyber_Security_Strategy.pdf,17, Available at http //www
284,Slovenia_2016_Cyber_Security_Strategy.pdf,17,si / 1 / post
285,Slovenia_2016_Cyber_Security_Strategy.pdf,17,"jsp urlid, = 200957 & number = 2789"
286,Slovenia_2016_Cyber_Security_Strategy.pdf,17," Cyber Security Strategy, "
287,Slovenia_2016_Cyber_Security_Strategy.pdf,18,Development of international standards of operation in cyberspace and for the implementation of practical confidence-building measures in cooperation with other countries and international partners
288,Slovenia_2016_Cyber_Security_Strategy.pdf,18," At the international level, Slovenia will take an active part in knowledge transfer in the area of cyber security To achieve the objective of national Cyber security with international cooperation, the following measure will be taken: ensuring conditions for the participation of Slovenian experts in the relevant international cyber security, working bodies and associations"
289,Slovenia_2016_Cyber_Security_Strategy.pdf,18,9 Strategy implementation risks 
290,Slovenia_2016_Cyber_Security_Strategy.pdf,18,"The greatest risk to the strategys implementation is insufficient awareness about the importance of cyber security assurance, which goes hand in hand with low general security culture and the lack of political will and consensus for the systemic regulation of this area at the national level"
291,Slovenia_2016_Cyber_Security_Strategy.pdf,18, Development of such an important area as cyber security assurance would entail very harmful consequences for the state which would be in the event of large-scale cyber attacks
292,Slovenia_2016_Cyber_Security_Strategy.pdf,18," Difficult to remedy Successful implementation of the strategy will, on the contrary, have a positive impact on the assurance of national security with positive multiplicative effects associated with the increased level of security"
293,Slovenia_2016_Cyber_Security_Strategy.pdf,18," It will also have influence on the increase of users' confidence in the Internet and thus the development of new services and business models associated with its use, which will be reflected in digital economic growth and greater social welfare STRENGTHS"
294,Slovenia_2016_Cyber_Security_Strategy.pdf,18,Operational level of cyber security assurance has Strategic level of cyber security assurance has been established
295,Slovenia_2016_Cyber_Security_Strategy.pdf,18,"Quality, though insufficient human resources at Lack of resources, ( financial, human material and the operational level of the system, technical ), "
296,Slovenia_2016_Cyber_Security_Strategy.pdf,18,"Good results of the preventive measures, ( awareness, raising programmes, ) implemented so far, "
297,Slovenia_2016_Cyber_Security_Strategy.pdf,18,"Insufficient cooperation between key stakeholders, "
298,Slovenia_2016_Cyber_Security_Strategy.pdf,18,The field lacks a regulatory framework Participation in common international exercises
299,Slovenia_2016_Cyber_Security_Strategy.pdf,18,"Increased trust of users, ( businesses, state administration, individuals, ) in the use of the Internet, which increases its use, (, B2C, B2B, B2G, G2C ), lowers operating costs and consequently allows digital growth, The integration of existing capabilities and the utilisation of synergies"
300,Slovenia_2016_Cyber_Security_Strategy.pdf,18,"Insufficient awareness of the importance of the area and the associated lack of political will and consensus for rapid and effective action and systemic regulation at national level The possibility of system failure in the event of an increase in security incidents if the system is not reinforced Table 2 Analysis of strengths, weaknesses, opportunities and threats to strategy implementation, "
301,Slovenia_2016_Cyber_Security_Strategy.pdf,19,"Being a strategic document, cyber security strategy has no direct financial implications"
302,Slovenia_2016_Cyber_Security_Strategy.pdf,19, It is a guiding principle of development activities for cyber security
303,Slovenia_2016_Cyber_Security_Strategy.pdf,19," Financial implications will arise with the implementation of the strategy, which will be limited by the resources available within the respective applicable state budget"
304,Slovenia_2016_Cyber_Security_Strategy.pdf,19," Thus, having regard to Article 23 of the Budget Implementation Act, which provides that the amount earmarked for specific expenditure can only be in the amount specified by the budget"
305,Slovenia_2016_Cyber_Security_Strategy.pdf,19,", The implementation of the strategy will also be limited by the resources available within the Operational Programme for the Implementation of the EU Cohesion Policy - 2014 2020"
306,Slovenia_2016_Cyber_Security_Strategy.pdf,20,"A List of abbreviations, "
307,Slovenia_2016_Cyber_Security_Strategy.pdf,20,"Agency for Communication Networks and Services of the Republic of Slovenia, Academic and Research Network of Slovenia, Business to Business"
308,Slovenia_2016_Cyber_Security_Strategy.pdf,20,Computer Emergency Response Team 
309,Slovenia_2016_Cyber_Security_Strategy.pdf,20,"European Union Agency for Network and Information Security, European Union "
310,Slovenia_2016_Cyber_Security_Strategy.pdf,20,"State bodies, communication network "
311,Slovenia_2016_Cyber_Security_Strategy.pdf,20,Information and communications technology 
312,Slovenia_2016_Cyber_Security_Strategy.pdf,20,"North Atlantic Treaty Organization, "
313,Slovenia_2016_Cyber_Security_Strategy.pdf,20,"Organisation for Security and Cooperation in Europe, SI-CERT "
314,Slovenia_2016_Cyber_Security_Strategy.pdf,20,"Slovenian National Computer Emergency Response Team, SIGOV-CERT "
315,Slovenia_2016_Cyber_Security_Strategy.pdf,20,"Public Administration, Computer Emergency Response Team, "
316,Slovenia_2016_Cyber_Security_Strategy.pdf,20,Slovenian Intelligence and Security Agency 
