,Document,Page,Sentence
142,Slovenia_2016_Cyber_Security_Strategy.pdf,10,"In an information society, individuals' privacy increasingly comes under attack, as it must be aligned with interests regarding retrieval processing and storage of personal data by different companies for commercial purposes, as well as by state authorities"
143,Slovenia_2016_Cyber_Security_Strategy.pdf,10," It is expected that with the increasing terrorist threats and the implementation of measures to prevent them, trends towards greater control and consequently the restriction of individuals' privacy in the cyberspace will also be on the increase"
144,Slovenia_2016_Cyber_Security_Strategy.pdf,10,Public and private sector organisations participate in the cyber security system
145,Slovenia_2016_Cyber_Security_Strategy.pdf,10," Apart from the central coordination of the national cyber security assurance system and all the national response centres, an important role is played by the Electronic Communications Networks and Services Agency of the Republic of Slovenia, ( AKOS, ) telecom operators and telecommunication infrastructure, administrators information society, service providers"
146,Slovenia_2016_Cyber_Security_Strategy.pdf,10," Academic and research, community (, some faculties and research organisations, ) occupational ( chambers of commerce and industry, ) and professional associations, ( Slovenian associations and sections of international association in the area of information and communication technologies, and cyber security, ) and software vendors that provide support to National authorities, In a broader sense, stakeholders in cyber security assurance in Slovenia, also include relevant organisations abroad, especially when these are cooperating with Slovenian stakeholders in response to security incidents"
147,Slovenia_2016_Cyber_Security_Strategy.pdf,10," In this respect, partners within the EU and NATO are particularly important 6"
148,Slovenia_2016_Cyber_Security_Strategy.pdf,10, The establishment of a comprehensive cyber security system and clear governance structure 
149,Slovenia_2016_Cyber_Security_Strategy.pdf,10,Successful high-level cyber security assurance requires the effective use of existing resources and appropriate multi-level organisation
150,Slovenia_2016_Cyber_Security_Strategy.pdf,10, Slovenia will set up central coordination of the national cyber security assurance system and provide conditions for its stable operation
151,Slovenia_2016_Cyber_Security_Strategy.pdf,10, This coordination body will 
152,Slovenia_2016_Cyber_Security_Strategy.pdf,11,Coordinate the cyber security assurance capabilities at the strategic level to ensure cyber security in the country at lower levels and will represent a single point of contact for international cooperation
153,Slovenia_2016_Cyber_Security_Strategy.pdf,11, The organisation form of coordination functions will be determined by the Government of the Republic of Slovenia
154,Slovenia_2016_Cyber_Security_Strategy.pdf,11," At the operational level of cyber security assurance, SI-CERT will operate with its capabilities at the national level, the Ministry of Defence in the field of defence and protection against natural and other disasters, the police, in ensuring cyber security in the context of public safety and the fight Against cyber crime, SOVA in counter intelligence and the emergent SIGOV-CERT in public administration Figure 1 Scheme of the cyber security assurance system"
155,Slovenia_2016_Cyber_Security_Strategy.pdf,11, The cyber security assurance system will also include other stakeholders
156,Slovenia_2016_Cyber_Security_Strategy.pdf,11," Operators of critical infrastructure in the private and public sectors are important, particularly in the energy supply sector, (, electricity producers and distributors ), and in information and communication support, ( telecom operators, information society, service providers, etc"
157,Slovenia_2016_Cyber_Security_Strategy.pdf,11," In awareness raising education and research, the academic and research community will contribute to the cyber security assurance system through their higher-education programmes and courses on cyber security at all levels of education and through the results of research organisations"
158,Slovenia_2016_Cyber_Security_Strategy.pdf,11, Cyber Security Strategy 
159,Slovenia_2016_Cyber_Security_Strategy.pdf,12,System will also be open to civil society's initiatives
160,Slovenia_2016_Cyber_Security_Strategy.pdf,12," This applies primarily to initiatives for improvements and assistance in raising awareness among various target groups by professional associations, ( Slovenian associations and the Slovenian sections of international associations in the field of information and communication technologies and cyber security"
161,Slovenia_2016_Cyber_Security_Strategy.pdf,12," The areas of strategy implementation Strategy implementation will focus on preventing security incidents, responding to security incidents and increasing awareness of the target groups about the importance of cyber security"
162,Slovenia_2016_Cyber_Security_Strategy.pdf,12,"The prevention of security incidents ranges from the technical design of information system, components to providing national and international legal frameworks and regulations that contribute to the development of safer applications and infrastructure"
163,Slovenia_2016_Cyber_Security_Strategy.pdf,12," Furthermore, it should be ensured that the design of programmes and ICT infrastructure include the safety and protection of individuals' privacy and that the standards ensuring safe and smooth operation of the systems, including the use of encryption solutions, are observed"
164,Slovenia_2016_Cyber_Security_Strategy.pdf,12, Risks are assessed which serves as a basis for the preparation and implementation of measures to mitigate unacceptable risks and an analysis of the implemented measures
165,Slovenia_2016_Cyber_Security_Strategy.pdf,12, The use of open-source technologies that ensure interoperability and allow best possible control and which are not partially of fully closed
166,Slovenia_2016_Cyber_Security_Strategy.pdf,12," Because of patent rights is encouraged, 2 Response, "
167,Slovenia_2016_Cyber_Security_Strategy.pdf,12,Prevention alone is insufficient for achieving a high level of cyber security
168,Slovenia_2016_Cyber_Security_Strategy.pdf,12," As security incidents can never be fully eliminated, it is necessary to provide for appropriate mechanisms to respond to them"
169,Slovenia_2016_Cyber_Security_Strategy.pdf,12," It is furthermore important to take account of the experience obtained from the prevention phase, as well as from the past security incident response"
170,Slovenia_2016_Cyber_Security_Strategy.pdf,12, Experience may come from domestic and foreign institutions responsible for cyber security assurance and therefore their best possible
171,Slovenia_2016_Cyber_Security_Strategy.pdf,12, Interconnectivity is very important
172,Slovenia_2016_Cyber_Security_Strategy.pdf,12,", Based on the experience and analysis of incidents and risks"
173,Slovenia_2016_Cyber_Security_Strategy.pdf,12, The response measures are constantly updated and improved
174,Slovenia_2016_Cyber_Security_Strategy.pdf,12, Active cooperation is also observed in the preparation of standard cyber crisis response procedures at the international or global level
175,Slovenia_2016_Cyber_Security_Strategy.pdf,12, 3 Awareness raising 
176,Slovenia_2016_Cyber_Security_Strategy.pdf,12,"People are those who develop, build and use"
177,Slovenia_2016_Cyber_Security_Strategy.pdf,12, Awareness raising and education may help to eliminate the risks and build a culture of safe technology use
178,Slovenia_2016_Cyber_Security_Strategy.pdf,12," In the awareness-raising phase, the experience derived from prevention and response phases must be utilised so that users are acquainted with actual risks and effective methods of avoiding them"
179,Slovenia_2016_Cyber_Security_Strategy.pdf,12, The methods and contents of awareness raising ( programmes ) are adjusted to various target groups to the greatest possible extent
180,Slovenia_2016_Cyber_Security_Strategy.pdf,12, For children and adolescents
181,Slovenia_2016_Cyber_Security_Strategy.pdf,12, Cyber security topics are included in the curriculum at different levels of education
182,Slovenia_2016_Cyber_Security_Strategy.pdf,12,", Adjusted awareness-raising programmes for the remaining population and business entities are developed"
183,Slovenia_2016_Cyber_Security_Strategy.pdf,12, The use of encryption solutions as one of the cornerstones of cyber security assurance is encouraged
184,Slovenia_2016_Cyber_Security_Strategy.pdf,13,"8 Strategy objectives and measures for their achievement Strategy, implementation, which will be based on the upgrade and update of the existing cyber security system capabilities, will be monitored by the Government of the Republic of Slovenia"
185,Slovenia_2016_Cyber_Security_Strategy.pdf,13," The central coordination of the national cyber security system and by the relevant ministries, in accordance with the grounds of jurisdiction set out in the Constitution and legislation, A number of measures will be carried out to reach the objectives of cyber security"
186,Slovenia_2016_Cyber_Security_Strategy.pdf,13," During the implementation of the strategy, the measures can be upgraded accordingly, OBJECTIVES"
187,Slovenia_2016_Cyber_Security_Strategy.pdf,13,Strengthening and systemic regulation of 
188,Slovenia_2016_Cyber_Security_Strategy.pdf,13,"Establishing a central coordination of the national cyber, the national cyber security assurance system, security assurance system, "
189,Slovenia_2016_Cyber_Security_Strategy.pdf,13,"Human resource and technological strengthening of bodies at the operative level of cyber security assurance system, along with the implementation of SIGOV-CERT, regular participation in international exercises on cyber security and organisation of national exercises, gradual upgrade of state bodies' HKOM networks with equipment that is appropriately approved by The Slovenian authorities as being safe and suitable for use "
190,Slovenia_2016_Cyber_Security_Strategy.pdf,13,"Implementation of competent checks of safety and functionality of IT equipment within the existing and newly established bodies, The safety of citizens in cyberspace, regular implementation of awareness-raising, "
191,Slovenia_2016_Cyber_Security_Strategy.pdf,13,"Programmes on cyber security, "
192,Slovenia_2016_Cyber_Security_Strategy.pdf,13,"Introducing cyber security content in education and training programmes, Cyber security in the economy, "
193,Slovenia_2016_Cyber_Security_Strategy.pdf,13,"Promotion of development and introduction of new technologies in the field of cyber security, regular implementation of awareness raising "
194,Slovenia_2016_Cyber_Security_Strategy.pdf,13,Programmes on cyber security for business entities Providing the operation of critical 
195,Slovenia_2016_Cyber_Security_Strategy.pdf,13,"Regular assessment of risks to the operation of the infrastructure in the sector of ICT support, critical infrastructure of the ICT support sector planning, appropriate protection measures and updating risk assessment in this field"
196,Slovenia_2016_Cyber_Security_Strategy.pdf,13, Cyber security assurance to ensure public 
197,Slovenia_2016_Cyber_Security_Strategy.pdf,13,Security and combat cyber crime 
198,Slovenia_2016_Cyber_Security_Strategy.pdf,13,"Implementation of appropriate cyber capacities to protect ICT systems of the police, regular training on cyber security for law enforcement authorities, participating in the development of cyber capacities for public security and in combating cyber crime"
199,Slovenia_2016_Cyber_Security_Strategy.pdf,13, Regular updating of the laws and procedures in line with the development of ICT 
200,Slovenia_2016_Cyber_Security_Strategy.pdf,13,"Development of defence, cyber "
201,Slovenia_2016_Cyber_Security_Strategy.pdf,13,Development of appropriate cybercapabilities to protect capabilities
202,Slovenia_2016_Cyber_Security_Strategy.pdf,13,"Ensuring safe operation and availability of ensuring conditions for the smooth operation of key ICT Cyber Security Strategy, "
203,Slovenia_2016_Cyber_Security_Strategy.pdf,14,"Key ICT systems in the event of major natural and other disasters systems in the event of major natural and other disasters, Strengthening national cyber security"
204,Slovenia_2016_Cyber_Security_Strategy.pdf,14,Ensuring conditions for the participation of Slovenian through international cooperation 
205,Slovenia_2016_Cyber_Security_Strategy.pdf,14,"Experts in the relevant international working bodies and associations in the area of cyber security Table 1 Cyber security strategy objectives and actions needed to achieve them, 1, Strengthening and systemic regulation of the national cyber security assurance system"
206,Slovenia_2016_Cyber_Security_Strategy.pdf,14,"Slovenia will strengthen and upgrade its existing cyber security assurance system, including its diplomatic and consular network"
207,Slovenia_2016_Cyber_Security_Strategy.pdf,14,", Due to the increasing volume of security incidents"
208,Slovenia_2016_Cyber_Security_Strategy.pdf,14, The existing capabilities of the response centres are no longer sufficient
209,Slovenia_2016_Cyber_Security_Strategy.pdf,14, In order to ensure the proper response
210,Slovenia_2016_Cyber_Security_Strategy.pdf,14," The capabilities of the National Response Centre, ( SI-CERT and the response centre for the needs of the defence and protection against natural and other disaster ( cyber capacities of the Ministry of Defence ) will be strengthened and an independent response centre for the public administration systems will Be set up, (, SIGOV-CERT )"
211,Slovenia_2016_Cyber_Security_Strategy.pdf,14, The framework of strengthening the cyber security assurance system also included the preparation of a plan to respond to security incidents At the strategic level of cyber security assurance system
212,Slovenia_2016_Cyber_Security_Strategy.pdf,14, A central coordination for comprehensive approach and coordination of activities in all areas of cyber security will be set
213,Slovenia_2016_Cyber_Security_Strategy.pdf,14,", One of the functions of this coordination will be to act as a single national point of contact for international cooperation in the area of cyber security"
214,Slovenia_2016_Cyber_Security_Strategy.pdf,14," Also in the future, Slovenia will regularly participate in international exercises on cyber security"
215,Slovenia_2016_Cyber_Security_Strategy.pdf,14," Besides that, it will also carry out exercises at the national level"
216,Slovenia_2016_Cyber_Security_Strategy.pdf,14, The content of each exercise will possibly be consistent with the risk assessment of a specific treat
217,Slovenia_2016_Cyber_Security_Strategy.pdf,14," However, based on the most realistic scenario, possible"
218,Slovenia_2016_Cyber_Security_Strategy.pdf,14, At least occasionally - exercises will be carried out with the participation of all stakeholder engaged in cyber security assurance
219,Slovenia_2016_Cyber_Security_Strategy.pdf,14," Thus, all the mechanisms, the preparedness and the interaction of participants will be checked"
220,Slovenia_2016_Cyber_Security_Strategy.pdf,14," Each exercise will be followed by a detailed analysis of the results and drafting proposals for any improvements and, if necessary, upgrading or updating the security incidents response plan To achieve the objective of strengthening and systemic regulation of national cyber security assurance system"
221,Slovenia_2016_Cyber_Security_Strategy.pdf,14," The following measures shall be implemented: establishing a central coordination of the national cyber security assurance system, human resource and technological strengthening of bodies at the operative level of cyber security assurance system, along with the implementation of SIGOV-CERT"
222,Slovenia_2016_Cyber_Security_Strategy.pdf,14, Regular participation in international exercises on cyber security and organisation of national exercises 
223,Slovenia_2016_Cyber_Security_Strategy.pdf,14,Gradual upgrade of state bodies' HKOM networks with equipment that is appropriately approved by the Slovenian authorities as being safe and suitable for use
224,Slovenia_2016_Cyber_Security_Strategy.pdf,15,Implementation of competent checks of safety and functionality of IT equipment within the existing and newly established bodies
225,Slovenia_2016_Cyber_Security_Strategy.pdf,15,"2, The safety of citizens in cyberspace"
226,Slovenia_2016_Cyber_Security_Strategy.pdf,15, Each individual must be able to have access to the safest possible use of ICT while respecting privacy and human rights
227,Slovenia_2016_Cyber_Security_Strategy.pdf,15, Citizens must have the opportunity to become acquainted with the risks in cyberspace and means of their control and the associated responsibility of each individual for their own safety in the global communications network
228,Slovenia_2016_Cyber_Security_Strategy.pdf,15, Cyber security assurance should not disproportionately infringe on privacy by using excessive measures or means
229,Slovenia_2016_Cyber_Security_Strategy.pdf,15, All the relevant and interested stakeholders must always be involved in the drafting of the legislation governing permissible degree of intrusion into the privacy of information in a timely and equitable manner
230,Slovenia_2016_Cyber_Security_Strategy.pdf,15, Raising user awareness about the importance of cyber security is extremely important as it contributes to building or improving the culture of cyber security
231,Slovenia_2016_Cyber_Security_Strategy.pdf,15," Thus, users learn to independently take care of their own security in cyberspace"
232,Slovenia_2016_Cyber_Security_Strategy.pdf,15," Therefore, in addition to further implementation of the existing awareness programmes, new ones will be developed"
233,Slovenia_2016_Cyber_Security_Strategy.pdf,15, Participation in various initiatives to raise awareness and involve civil society in these activities will be encouraged
234,Slovenia_2016_Cyber_Security_Strategy.pdf,15," Effective outreach will focus on specific target groups, ( e"
235,Slovenia_2016_Cyber_Security_Strategy.pdf,15," children and adolescents, different age groups of citizens, business entities, ) Cyber security topics - will be properly included in the curricula of schools at all levels of the education system"
236,Slovenia_2016_Cyber_Security_Strategy.pdf,15," Furthermore, universities should be encouraged"
237,Slovenia_2016_Cyber_Security_Strategy.pdf,15,", by increased demand from the economy ) to offer independent study programmes on cyber security"
238,Slovenia_2016_Cyber_Security_Strategy.pdf,15, Key stakeholders in cyber security assurance should ensure the development of competences and certification of personnel that perform or will perform the tasks of cyber security assurance by continuous training
239,Slovenia_2016_Cyber_Security_Strategy.pdf,15," To achieve the objective of ensuring citizens security in cyberspace, the following two measures will be taken: regular implementation of awareness, raising programmes on cyber security, introducing contents in the area of cyber security in the education and training programmes; 3; Cyber security in the economy"
240,Slovenia_2016_Cyber_Security_Strategy.pdf,15," In the economy, Slovenia already has a lot of potential, but with adequately focused investments in research, development and innovation"
241,Slovenia_2016_Cyber_Security_Strategy.pdf,15, Further breakthrough is also possible in the field of cyber security
242,Slovenia_2016_Cyber_Security_Strategy.pdf,15, Cyber security assurance in the economy is particularly important in the digitalised business and industry environment
243,Slovenia_2016_Cyber_Security_Strategy.pdf,15," The state will co-finance projects and targeted research in this field, which have the potential of contributing to cyber security"
244,Slovenia_2016_Cyber_Security_Strategy.pdf,15, The applicable results of such projects and research must constantly upgrade the system of cyber security
245,Slovenia_2016_Cyber_Security_Strategy.pdf,15," Likewise, in other areas, also in the area of cyber security, the state will promote integration of academic and research sphere with the economy at both national and international levels"
246,Slovenia_2016_Cyber_Security_Strategy.pdf,15," Thus, it will help to create a critical mass of experts in this field, thereby creating public-private partnerships that will be able to develop innovative products and services with high added value to domestic and global markets"
247,Slovenia_2016_Cyber_Security_Strategy.pdf,15, Cyber Security Strategy 
248,Slovenia_2016_Cyber_Security_Strategy.pdf,16,"For its operation, the increasingly digitalised economy, should be provided with a secure communication"
249,Slovenia_2016_Cyber_Security_Strategy.pdf,16,", Therefore, programmes to raise companies, awareness about the risks of cyberspace and the secure use of ICT will be continued"
250,Slovenia_2016_Cyber_Security_Strategy.pdf,16," In doing so, greater attention will be paid to the identified critical areas in accordance with the current analyses of the situation"
251,Slovenia_2016_Cyber_Security_Strategy.pdf,16, Efforts for the development and use of standards in cyber security will be promoted To achieve the objective of cyber security in the economy
252,Slovenia_2016_Cyber_Security_Strategy.pdf,16," The following two measures will be taken: the promotion of development and introduction of new technologies in the field of cyber security, regular implementation of awareness, raising programmes on cyber security for business entities 4, Providing the operation of critical infrastructure in the sector of ICT support; Critical infrastructure Of ICT support sector must be designed and managed so as to provide systemic ICT support at various levels"
253,Slovenia_2016_Cyber_Security_Strategy.pdf,16, The uninterrupted operation of infrastructure must be ensured which requires the functioning of internet systems as well as hardware and software that support critical functions in the country
254,Slovenia_2016_Cyber_Security_Strategy.pdf,16, Rapid and efficient mechanisms for responding to threats and debugging i
255,Slovenia_2016_Cyber_Security_Strategy.pdf,16, sanation of damage resulting from security incidents and preventive mechanisms
256,Slovenia_2016_Cyber_Security_Strategy.pdf,16," That, as far as possible, prevent such threats and errors are established"
257,Slovenia_2016_Cyber_Security_Strategy.pdf,16, By establishing an independent response centre for public administration systems
258,Slovenia_2016_Cyber_Security_Strategy.pdf,16," ( SIGOV-CERT, ) SI-CERT will be relieved and thus, with appropriate reinforcement, able to focus attention to providing cyber security in the ICT support sector"
259,Slovenia_2016_Cyber_Security_Strategy.pdf,16," To achieve the objective of ensuring the operation of critical infrastructure in the sector of ICT support, the following measure will be taken: regular assessment of risks to the operation of the critical infrastructure of the ICT support sector, planning, appropriate protection measures and updating risk assessment"
260,Slovenia_2016_Cyber_Security_Strategy.pdf,16," In this field 5 Cyber security assurance to ensure public security and combat cyber crime, Slovenia will develop cyber capabilities that will be able to independently and in cooperation with other countries, protect ICT systems in public security, ( Schengen, Europol, Interpol, ), and to provide support to operational Police work"
261,Slovenia_2016_Cyber_Security_Strategy.pdf,16,", The development of the capabilities of the police and judicial authorities for combating cybercrime will be accelerated"
262,Slovenia_2016_Cyber_Security_Strategy.pdf,16, Greater attention will be paid to the development of digital forensics and care for adequate qualification of all law enforcement authorities operating in this area
263,Slovenia_2016_Cyber_Security_Strategy.pdf,16," Suppression is also important for successful prosecution of the classic types of crime, as the use of services offered online and other networks is increasing"
264,Slovenia_2016_Cyber_Security_Strategy.pdf,16, In performing these activities
265,Slovenia_2016_Cyber_Security_Strategy.pdf,16," In the development of cyber capabilities, the state will cooperate with industry and academic institutions"
266,Slovenia_2016_Cyber_Security_Strategy.pdf,16," In the detection of new forms of cyber crime and the exchange of information, cooperation of the police with response centres, academic and research institutions, hardware and software producers, as well as with professional Associations in the field of ICT at national and international level will be important"
267,Slovenia_2016_Cyber_Security_Strategy.pdf,16, Legislation and procedures in this area should stay abreast of the rapid development of ICT and appropriate technical experts should be involved in their drafting
